[I 2026-03-17 14:39:46,720] Using an existing study with name 'yoloe_hparam_search_v4' instead of creating a new one.
/fs01/home/dhaneshr/code/obj-det-test/.venv/lib/python3.12/site-packages/albumentations/core/validation.py:114: UserWarning: ShiftScaleRotate is a special case of Affine transform. Please use Affine transform instead.
  original_init(self, **validated_kwargs)
[I 2026-03-17 14:50:36,420] Trial 9 pruned. 
[I 2026-03-17 14:56:50,710] Trial 30 pruned. 
[I 2026-03-17 15:07:41,601] Trial 41 pruned. 
[I 2026-03-17 15:11:51,735] Trial 60 pruned. 
[I 2026-03-17 15:28:54,492] Trial 74 finished with value: 0.6956862738623345 and parameters: {'learning_rate': 0.0028118872210255064, 'weight_decay': 0.009834423227055269, 'mosaic_prob': 0.3707798064582288, 'label_smooth': 0.07886228038687776, 'copy_paste_p': 0.06831708379146467, 'slice_stride': 10, 'batch_size': 16, 'use_clahe': True, 'use_shift_scale_rotate': True, 'use_brightness_contrast': False, 'use_median_blur': True, 'median_blur_limit': 5, 'use_speckle_noise': False, 'speckle_level': 'medium'}. Best is trial 14 with value: 0.7280141285840982.
[I 2026-03-17 15:32:36,243] Trial 104 pruned. 
[I 2026-03-17 15:44:31,566] Trial 118 pruned. 
[I 2026-03-17 15:57:08,165] Trial 136 pruned. 
[I 2026-03-17 16:11:03,667] Trial 156 pruned. 
[I 2026-03-17 16:21:12,183] Trial 182 pruned. 
[I 2026-03-17 16:41:35,667] Trial 203 finished with value: 0.6818724011502695 and parameters: {'learning_rate': 0.0003042982067972426, 'weight_decay': 0.005484731599966591, 'mosaic_prob': 0.217894796848895, 'label_smooth': 0.09699496754390191, 'copy_paste_p': 0.20269267622711695, 'slice_stride': 5, 'batch_size': 16, 'use_clahe': False, 'use_shift_scale_rotate': True, 'use_brightness_contrast': True, 'use_median_blur': True, 'median_blur_limit': 5, 'use_speckle_noise': True, 'speckle_level': 'medium'}. Best is trial 14 with value: 0.7280141285840982.
[I 2026-03-17 16:54:55,069] Trial 236 pruned. 
[I 2026-03-17 16:59:10,429] Trial 256 pruned. 
[I 2026-03-17 17:18:30,919] Trial 260 finished with value: 0.7035121230013812 and parameters: {'learning_rate': 0.0003359244064976733, 'weight_decay': 0.002590398263082911, 'mosaic_prob': 0.3759008925715146, 'label_smooth': 0.030235068927324006, 'copy_paste_p': 0.2656794916156274, 'slice_stride': 7, 'batch_size': 16, 'use_clahe': True, 'use_shift_scale_rotate': True, 'use_brightness_contrast': True, 'use_median_blur': True, 'median_blur_limit': 5, 'use_speckle_noise': False, 'speckle_level': 'heavy'}. Best is trial 14 with value: 0.7280141285840982.
[I 2026-03-17 17:33:25,987] Trial 281 finished with value: 0.6866064402693441 and parameters: {'learning_rate': 0.00036695231141511454, 'weight_decay': 0.0027722680317882574, 'mosaic_prob': 0.3786759436343255, 'label_smooth': 0.03761297464512851, 'copy_paste_p': 0.35989723290592873, 'slice_stride': 7, 'batch_size': 16, 'use_clahe': False, 'use_shift_scale_rotate': True, 'use_brightness_contrast': True, 'use_median_blur': True, 'median_blur_limit': 5, 'use_speckle_noise': True, 'speckle_level': 'light'}. Best is trial 14 with value: 0.7280141285840982.
