[I 2026-03-17 22:48:00,788] Using an existing study with name 'yoloe_hparam_search_v5' instead of creating a new one.
/fs01/home/dhaneshr/code/obj-det-test/.venv/lib/python3.12/site-packages/albumentations/core/validation.py:114: UserWarning: ShiftScaleRotate is a special case of Affine transform. Please use Affine transform instead.
  original_init(self, **validated_kwargs)
[I 2026-03-17 22:52:30,487] Trial 236 pruned. 
[I 2026-03-17 23:06:24,514] Trial 248 finished with value: 0.7052210002932814 and parameters: {'learning_rate': 0.0005754532739793587, 'weight_decay': 0.000670096232931248, 'mosaic_prob': 0.5088198522671866, 'label_smooth': 0.10937176295859277, 'copy_paste_p': 0.4891093842248419, 'slice_stride': 10, 'batch_size': 16, 'use_clahe': True, 'use_shift_scale_rotate': True, 'use_brightness_contrast': False, 'use_median_blur': True, 'median_blur_limit': 5, 'use_speckle_noise': False, 'speckle_level': 'light'}. Best is trial 123 with value: 0.7353625013713276.
[I 2026-03-17 23:18:09,076] Trial 281 pruned. 
[I 2026-03-17 23:29:35,979] Trial 310 finished with value: 0.6413739933760079 and parameters: {'learning_rate': 0.0008707839533447586, 'weight_decay': 0.0002797895163139535, 'mosaic_prob': 0.6726633168632645, 'label_smooth': 0.08888718601656813, 'copy_paste_p': 0.21558603956491457, 'slice_stride': 10, 'batch_size': 16, 'use_clahe': True, 'use_shift_scale_rotate': True, 'use_brightness_contrast': False, 'use_median_blur': True, 'median_blur_limit': 5, 'use_speckle_noise': False, 'speckle_level': 'medium'}. Best is trial 123 with value: 0.7353625013713276.
[I 2026-03-17 23:39:57,700] Trial 331 finished with value: 0.6564986130271012 and parameters: {'learning_rate': 0.0006756286458745202, 'weight_decay': 0.002190581102007468, 'mosaic_prob': 0.35066515165687695, 'label_smooth': 0.08141815004435012, 'copy_paste_p': 0.2776464009755029, 'slice_stride': 5, 'batch_size': 16, 'use_clahe': False, 'use_shift_scale_rotate': False, 'use_brightness_contrast': False, 'use_median_blur': False, 'median_blur_limit': 5, 'use_speckle_noise': False, 'speckle_level': 'light'}. Best is trial 123 with value: 0.7353625013713276.
[I 2026-03-17 23:44:53,550] Trial 355 pruned. 
[I 2026-03-17 23:55:51,341] Trial 369 finished with value: 0.6169110943223182 and parameters: {'learning_rate': 0.0010176665238746296, 'weight_decay': 0.005335387899396878, 'mosaic_prob': 0.37239046571247936, 'label_smooth': 0.08608840563480159, 'copy_paste_p': 0.2603341080781068, 'slice_stride': 10, 'batch_size': 16, 'use_clahe': True, 'use_shift_scale_rotate': True, 'use_brightness_contrast': False, 'use_median_blur': True, 'median_blur_limit': 5, 'use_speckle_noise': False, 'speckle_level': 'heavy'}. Best is trial 123 with value: 0.7353625013713276.
[I 2026-03-18 00:09:27,808] Trial 395 finished with value: 0.6676284261417628 and parameters: {'learning_rate': 0.0006006191818401276, 'weight_decay': 0.0004538488396307283, 'mosaic_prob': 0.35144395793256245, 'label_smooth': 0.08931904625699652, 'copy_paste_p': 0.5583094837199398, 'slice_stride': 10, 'batch_size': 16, 'use_clahe': True, 'use_shift_scale_rotate': True, 'use_brightness_contrast': True, 'use_median_blur': True, 'median_blur_limit': 5, 'use_speckle_noise': False, 'speckle_level': 'light'}. Best is trial 123 with value: 0.7353625013713276.
[I 2026-03-18 00:13:40,692] Trial 428 pruned. 
[I 2026-03-18 00:18:44,646] Trial 438 finished with value: 0.2950495049504951 and parameters: {'learning_rate': 0.0007731888847503827, 'weight_decay': 0.00029854278299914567, 'mosaic_prob': 0.549451567967693, 'label_smooth': 0.1037581336077153, 'copy_paste_p': 0.6302007405853148, 'slice_stride': 10, 'batch_size': 16, 'use_clahe': True, 'use_shift_scale_rotate': False, 'use_brightness_contrast': True, 'use_median_blur': False, 'median_blur_limit': 5, 'use_speckle_noise': False, 'speckle_level': 'heavy'}. Best is trial 409 with value: 0.7500143454379812.
[I 2026-03-18 00:23:03,919] Trial 452 pruned. 
[I 2026-03-18 00:36:02,932] Trial 457 pruned. 
[I 2026-03-18 00:48:23,214] Trial 482 finished with value: 0.6993496669187588 and parameters: {'learning_rate': 0.0005636892321363977, 'weight_decay': 0.0009805711381455752, 'mosaic_prob': 0.4809105426628504, 'label_smooth': 0.06826033352830266, 'copy_paste_p': 0.5768735659855628, 'slice_stride': 5, 'batch_size': 8, 'use_clahe': False, 'use_shift_scale_rotate': True, 'use_brightness_contrast': False, 'use_median_blur': True, 'median_blur_limit': 7, 'use_speckle_noise': False, 'speckle_level': 'light'}. Best is trial 409 with value: 0.7500143454379812.
[I 2026-03-18 00:53:08,267] Trial 496 finished with value: 0.633663366336634 and parameters: {'learning_rate': 0.0005076150500013215, 'weight_decay': 0.0009193472375077528, 'mosaic_prob': 0.484379356491364, 'label_smooth': 0.06986910655605545, 'copy_paste_p': 0.6933542618685395, 'slice_stride': 5, 'batch_size': 8, 'use_clahe': False, 'use_shift_scale_rotate': True, 'use_brightness_contrast': False, 'use_median_blur': True, 'median_blur_limit': 7, 'use_speckle_noise': True, 'speckle_level': 'light'}. Best is trial 409 with value: 0.7500143454379812.
[I 2026-03-18 00:57:46,512] Trial 506 finished with value: 0.5643564356435646 and parameters: {'learning_rate': 0.0004796784995693778, 'weight_decay': 0.0009779256449503437, 'mosaic_prob': 0.4727262630829761, 'label_smooth': 0.06194580850457069, 'copy_paste_p': 0.49289944444211764, 'slice_stride': 5, 'batch_size': 8, 'use_clahe': False, 'use_shift_scale_rotate': True, 'use_brightness_contrast': False, 'use_median_blur': True, 'median_blur_limit': 7, 'use_speckle_noise': True, 'speckle_level': 'light'}. Best is trial 409 with value: 0.7500143454379812.
