[I 2026-03-17 14:39:48,670] Using an existing study with name 'yoloe_hparam_search_v4' instead of creating a new one.
/fs01/home/dhaneshr/code/obj-det-test/.venv/lib/python3.12/site-packages/albumentations/core/validation.py:114: UserWarning: ShiftScaleRotate is a special case of Affine transform. Please use Affine transform instead.
  original_init(self, **validated_kwargs)
[I 2026-03-17 14:56:39,866] Trial 10 finished with value: 0.6708275100112447 and parameters: {'learning_rate': 0.00043284502212938834, 'weight_decay': 0.007969454818643935, 'mosaic_prob': 0.39279757672456206, 'label_smooth': 0.08979877262955549, 'copy_paste_p': 0.10921304830970556, 'slice_stride': 10, 'batch_size': 16, 'use_clahe': True, 'use_shift_scale_rotate': True, 'use_brightness_contrast': False, 'use_median_blur': True, 'median_blur_limit': 5, 'use_speckle_noise': False, 'speckle_level': 'medium'}. Best is trial 10 with value: 0.6708275100112447.
[I 2026-03-17 15:01:03,904] Trial 40 pruned. 
[I 2026-03-17 15:22:10,441] Trial 53 finished with value: 0.6586063265655117 and parameters: {'learning_rate': 0.0002789916501431784, 'weight_decay': 0.0037337870210359166, 'mosaic_prob': 0.34287370961329033, 'label_smooth': 0.10619097317435439, 'copy_paste_p': 0.19570456322131752, 'slice_stride': 7, 'batch_size': 16, 'use_clahe': True, 'use_shift_scale_rotate': True, 'use_brightness_contrast': False, 'use_median_blur': True, 'median_blur_limit': 5, 'use_speckle_noise': False, 'speckle_level': 'heavy'}. Best is trial 14 with value: 0.7280141285840982.
[I 2026-03-17 15:42:18,214] Trial 92 finished with value: 0.6347136011623614 and parameters: {'learning_rate': 0.00019537558352930638, 'weight_decay': 0.006669152885079561, 'mosaic_prob': 0.2752520669964538, 'label_smooth': 0.11530843772584244, 'copy_paste_p': 0.1572712795277461, 'slice_stride': 7, 'batch_size': 16, 'use_clahe': True, 'use_shift_scale_rotate': True, 'use_brightness_contrast': False, 'use_median_blur': True, 'median_blur_limit': 5, 'use_speckle_noise': False, 'speckle_level': 'heavy'}. Best is trial 14 with value: 0.7280141285840982.
[I 2026-03-17 15:47:21,825] Trial 130 pruned. 
[I 2026-03-17 15:51:33,877] Trial 143 pruned. 
[I 2026-03-17 15:59:32,395] Trial 149 finished with value: 0.4651950495049506 and parameters: {'learning_rate': 0.00022042393363747893, 'weight_decay': 0.00894325043709462, 'mosaic_prob': 0.39897462595011396, 'label_smooth': 0.08861432109044484, 'copy_paste_p': 0.07989569009563545, 'slice_stride': 10, 'batch_size': 16, 'use_clahe': True, 'use_shift_scale_rotate': True, 'use_brightness_contrast': False, 'use_median_blur': True, 'median_blur_limit': 5, 'use_speckle_noise': False, 'speckle_level': 'medium'}. Best is trial 14 with value: 0.7280141285840982.
[I 2026-03-17 16:12:30,091] Trial 160 pruned. 
[I 2026-03-17 16:29:57,853] Trial 184 finished with value: 0.6773518967931625 and parameters: {'learning_rate': 0.0024089375552820863, 'weight_decay': 0.007704820491803288, 'mosaic_prob': 0.29360382816130604, 'label_smooth': 0.020685996171887683, 'copy_paste_p': 0.08100527414002898, 'slice_stride': 10, 'batch_size': 16, 'use_clahe': True, 'use_shift_scale_rotate': True, 'use_brightness_contrast': False, 'use_median_blur': True, 'median_blur_limit': 5, 'use_speckle_noise': False, 'speckle_level': 'heavy'}. Best is trial 14 with value: 0.7280141285840982.
[I 2026-03-17 16:39:54,906] Trial 214 pruned. 
[I 2026-03-17 16:57:10,769] Trial 233 finished with value: 0.6884535611369001 and parameters: {'learning_rate': 0.00035969032194780904, 'weight_decay': 0.0010995700750000266, 'mosaic_prob': 0.38644887483960116, 'label_smooth': 0.026772279053107233, 'copy_paste_p': 0.41745490907872457, 'slice_stride': 10, 'batch_size': 16, 'use_clahe': True, 'use_shift_scale_rotate': True, 'use_brightness_contrast': True, 'use_median_blur': True, 'median_blur_limit': 5, 'use_speckle_noise': False, 'speckle_level': 'heavy'}. Best is trial 14 with value: 0.7280141285840982.
[I 2026-03-17 17:01:49,882] Trial 259 pruned. 
[I 2026-03-17 17:05:27,341] Trial 264 pruned. 
[I 2026-03-17 17:16:48,066] Trial 268 pruned. 
[I 2026-03-17 17:20:34,413] Trial 278 pruned. 
