[I 2026-03-17 22:47:56,631] Using an existing study with name 'yoloe_hparam_search_v5' instead of creating a new one.
/fs01/home/dhaneshr/code/obj-det-test/.venv/lib/python3.12/site-packages/albumentations/core/validation.py:114: UserWarning: ShiftScaleRotate is a special case of Affine transform. Please use Affine transform instead.
  original_init(self, **validated_kwargs)
[I 2026-03-17 22:59:45,097] Trial 231 pruned. 
[I 2026-03-17 23:03:54,604] Trial 260 finished with value: 0.5049504950495052 and parameters: {'learning_rate': 0.0007140771797619988, 'weight_decay': 0.0008482675360027443, 'mosaic_prob': 0.6500863501275913, 'label_smooth': 0.08251291105758908, 'copy_paste_p': 0.2539552189327706, 'slice_stride': 7, 'batch_size': 8, 'use_clahe': True, 'use_shift_scale_rotate': True, 'use_brightness_contrast': False, 'use_median_blur': True, 'median_blur_limit': 7, 'use_speckle_noise': False, 'speckle_level': 'medium'}. Best is trial 123 with value: 0.7353625013713276.
[I 2026-03-17 23:16:53,069] Trial 274 pruned. 
[I 2026-03-17 23:30:41,994] Trial 305 finished with value: 0.7200488926231934 and parameters: {'learning_rate': 0.0008707839533447586, 'weight_decay': 0.0005757261670218325, 'mosaic_prob': 0.6726633168632645, 'label_smooth': 0.08888718601656813, 'copy_paste_p': 0.21558603956491457, 'slice_stride': 10, 'batch_size': 16, 'use_clahe': True, 'use_shift_scale_rotate': True, 'use_brightness_contrast': False, 'use_median_blur': True, 'median_blur_limit': 5, 'use_speckle_noise': False, 'speckle_level': 'medium'}. Best is trial 123 with value: 0.7353625013713276.
[I 2026-03-17 23:35:11,805] Trial 333 finished with value: 0.7029702970297034 and parameters: {'learning_rate': 0.0014241626018817078, 'weight_decay': 0.0020938779101119915, 'mosaic_prob': 0.35066515165687695, 'label_smooth': 0.08549672111035257, 'copy_paste_p': 0.275409117012347, 'slice_stride': 5, 'batch_size': 16, 'use_clahe': False, 'use_shift_scale_rotate': False, 'use_brightness_contrast': False, 'use_median_blur': False, 'median_blur_limit': 5, 'use_speckle_noise': False, 'speckle_level': 'light'}. Best is trial 123 with value: 0.7353625013713276.
[I 2026-03-17 23:51:10,966] Trial 342 pruned. 
[I 2026-03-18 00:02:48,639] Trial 385 finished with value: 0.6817341629026125 and parameters: {'learning_rate': 0.0012673167963529275, 'weight_decay': 0.00034705511435449184, 'mosaic_prob': 0.37239046571247936, 'label_smooth': 0.09468445031081635, 'copy_paste_p': 0.587688616060044, 'slice_stride': 10, 'batch_size': 16, 'use_clahe': True, 'use_shift_scale_rotate': True, 'use_brightness_contrast': False, 'use_median_blur': True, 'median_blur_limit': 5, 'use_speckle_noise': False, 'speckle_level': 'light'}. Best is trial 123 with value: 0.7353625013713276.
[I 2026-03-18 00:06:43,290] Trial 414 pruned. 
[I 2026-03-18 00:10:12,008] Trial 424 finished with value: 0.5643564356435646 and parameters: {'learning_rate': 0.001271284546170043, 'weight_decay': 0.0013777822632565348, 'mosaic_prob': 0.3825105813503051, 'label_smooth': 0.08857320582951665, 'copy_paste_p': 0.6047288993685446, 'slice_stride': 10, 'batch_size': 8, 'use_clahe': True, 'use_shift_scale_rotate': True, 'use_brightness_contrast': False, 'use_median_blur': True, 'median_blur_limit': 7, 'use_speckle_noise': False, 'speckle_level': 'light'}. Best is trial 123 with value: 0.7353625013713276.
[I 2026-03-18 00:22:50,113] Trial 430 pruned. 
[I 2026-03-18 00:28:09,937] Trial 456 pruned. 
[I 2026-03-18 00:39:14,317] Trial 470 pruned. 
[I 2026-03-18 00:52:55,757] Trial 489 finished with value: 0.6504409659703857 and parameters: {'learning_rate': 0.0005636892321363977, 'weight_decay': 0.0009805711381455752, 'mosaic_prob': 0.4849570091206274, 'label_smooth': 0.06826033352830266, 'copy_paste_p': 0.46693906176718303, 'slice_stride': 5, 'batch_size': 16, 'use_clahe': True, 'use_shift_scale_rotate': True, 'use_brightness_contrast': False, 'use_median_blur': True, 'median_blur_limit': 5, 'use_speckle_noise': False, 'speckle_level': 'medium'}. Best is trial 409 with value: 0.7500143454379812.
[I 2026-03-18 00:57:43,924] Trial 504 finished with value: 0.6633663366336637 and parameters: {'learning_rate': 0.0005076150500013215, 'weight_decay': 0.0009193472375077528, 'mosaic_prob': 0.484379356491364, 'label_smooth': 0.0695864567080613, 'copy_paste_p': 0.6551877662849778, 'slice_stride': 5, 'batch_size': 8, 'use_clahe': False, 'use_shift_scale_rotate': True, 'use_brightness_contrast': False, 'use_median_blur': True, 'median_blur_limit': 7, 'use_speckle_noise': True, 'speckle_level': 'light'}. Best is trial 409 with value: 0.7500143454379812.
[I 2026-03-18 01:09:26,819] Trial 509 finished with value: 0.6847836659533155 and parameters: {'learning_rate': 0.0006356251076242764, 'weight_decay': 0.0053129876047396, 'mosaic_prob': 0.4587459612465916, 'label_smooth': 0.07283270343556576, 'copy_paste_p': 0.36615062753792726, 'slice_stride': 5, 'batch_size': 8, 'use_clahe': False, 'use_shift_scale_rotate': True, 'use_brightness_contrast': False, 'use_median_blur': True, 'median_blur_limit': 7, 'use_speckle_noise': False, 'speckle_level': 'light'}. Best is trial 409 with value: 0.7500143454379812.
