/cm/local/apps/slurm/var/spool/job00739/slurm_script: /cvmfs/soft.computecanada.ca/custom/software/lmod/lmod/init/bash: Too many levels of symbolic links
[I 2026-03-17 10:46:39,198] Using an existing study with name 'yoloe_hparam_search_v3' instead of creating a new one.
/fs01/home/dhaneshr/code/obj-det-test/.venv/lib/python3.12/site-packages/albumentations/core/validation.py:114: UserWarning: ShiftScaleRotate is a special case of Affine transform. Please use Affine transform instead.
  original_init(self, **validated_kwargs)
[I 2026-03-17 11:10:44,472] Trial 5 finished with value: 0.5073273181915283 and parameters: {'learning_rate': 0.00043284502212938834, 'weight_decay': 0.007969454818643935, 'slice_stride': 5, 'batch_size': 32, 'mosaic_prob': 0.34044600469728353, 'label_smooth': 0.10621088666940683, 'use_clahe': False, 'use_shift_scale_rotate': True, 'use_brightness_contrast': False, 'use_median_blur': False, 'median_blur_limit': 7, 'use_speckle_noise': False, 'speckle_level': 'heavy', 'copy_paste_p': 0.1397716475108518}. Best is trial 8 with value: 0.6186953783035278.
[I 2026-03-17 11:15:13,993] Trial 32 pruned. 
[I 2026-03-17 11:19:22,047] Trial 45 pruned. 
[I 2026-03-17 11:25:47,826] Trial 64 pruned. 
[I 2026-03-17 11:49:36,050] Trial 78 finished with value: 0.4930236041545868 and parameters: {'learning_rate': 0.000565928261384969, 'weight_decay': 0.009834423227055269, 'slice_stride': 5, 'batch_size': 32, 'mosaic_prob': 0.36207385087147276, 'label_smooth': 0.09940557510047471, 'use_clahe': False, 'use_shift_scale_rotate': True, 'use_brightness_contrast': False, 'use_median_blur': False, 'median_blur_limit': 7, 'use_speckle_noise': False, 'speckle_level': 'heavy', 'copy_paste_p': 0.10047199950562401}. Best is trial 8 with value: 0.6186953783035278.
[I 2026-03-17 12:05:06,592] Trial 124 pruned. 
[I 2026-03-17 12:29:04,831] Trial 145 finished with value: 0.4832252860069275 and parameters: {'learning_rate': 0.0024535301530424574, 'weight_decay': 0.00022395980524351648, 'slice_stride': 5, 'batch_size': 32, 'mosaic_prob': 0.3824286760538182, 'label_smooth': 0.07989905482440353, 'use_clahe': False, 'use_shift_scale_rotate': True, 'use_brightness_contrast': False, 'use_median_blur': False, 'median_blur_limit': 7, 'use_speckle_noise': False, 'speckle_level': 'light', 'copy_paste_p': 0.18327295233157356}. Best is trial 8 with value: 0.6186953783035278.
[I 2026-03-17 12:51:10,969] Trial 198 finished with value: 0.5574053525924683 and parameters: {'learning_rate': 0.0008634666718373443, 'weight_decay': 0.00011924877739976039, 'slice_stride': 5, 'batch_size': 16, 'mosaic_prob': 0.3644489794682245, 'label_smooth': 0.10048549250804921, 'use_clahe': False, 'use_shift_scale_rotate': True, 'use_brightness_contrast': False, 'use_median_blur': False, 'median_blur_limit': 7, 'use_speckle_noise': False, 'speckle_level': 'heavy', 'copy_paste_p': 0.1588071245080845}. Best is trial 8 with value: 0.6186953783035278.
[I 2026-03-17 13:12:50,618] Trial 233 finished with value: 0.5113574266433716 and parameters: {'learning_rate': 0.0007721705997213452, 'weight_decay': 0.00014246067839468314, 'slice_stride': 5, 'batch_size': 16, 'mosaic_prob': 0.29140160478816096, 'label_smooth': 0.1053737847293937, 'use_clahe': False, 'use_shift_scale_rotate': True, 'use_brightness_contrast': False, 'use_median_blur': False, 'median_blur_limit': 7, 'use_speckle_noise': False, 'speckle_level': 'heavy', 'copy_paste_p': 0.14221080007136727}. Best is trial 8 with value: 0.6186953783035278.
[I 2026-03-17 13:18:29,479] Trial 249 pruned. 
[I 2026-03-17 13:39:35,095] Trial 263 finished with value: 0.5380108952522278 and parameters: {'learning_rate': 0.0006823159277405775, 'weight_decay': 0.00017609627596163748, 'slice_stride': 5, 'batch_size': 16, 'mosaic_prob': 0.2522255609635706, 'label_smooth': 0.05398135928387312, 'use_clahe': False, 'use_shift_scale_rotate': True, 'use_brightness_contrast': False, 'use_median_blur': False, 'median_blur_limit': 7, 'use_speckle_noise': False, 'speckle_level': 'heavy', 'copy_paste_p': 0.09109080198067142}. Best is trial 8 with value: 0.6186953783035278.
[I 2026-03-17 13:45:11,621] Trial 275 pruned. 
[I 2026-03-17 14:05:57,301] Trial 279 finished with value: 0.5052191615104675 and parameters: {'learning_rate': 0.0009093909744916993, 'weight_decay': 0.0001662227373024175, 'slice_stride': 5, 'batch_size': 16, 'mosaic_prob': 0.23837342959879662, 'label_smooth': 0.09169450443582376, 'use_clahe': False, 'use_shift_scale_rotate': True, 'use_brightness_contrast': True, 'use_median_blur': True, 'median_blur_limit': 7, 'use_speckle_noise': False, 'speckle_level': 'heavy', 'copy_paste_p': 0.11252549349286109}. Best is trial 8 with value: 0.6186953783035278.
[I 2026-03-17 14:09:50,327] Trial 281 pruned. 
[I 2026-03-17 14:15:08,449] Trial 282 pruned. 
