[I 2026-03-17 22:47:45,118] Using an existing study with name 'yoloe_hparam_search_v5' instead of creating a new one.
/fs01/home/dhaneshr/code/obj-det-test/.venv/lib/python3.12/site-packages/albumentations/core/validation.py:114: UserWarning: ShiftScaleRotate is a special case of Affine transform. Please use Affine transform instead.
  original_init(self, **validated_kwargs)
[I 2026-03-17 23:01:38,409] Trial 221 finished with value: 0.6710668877509667 and parameters: {'learning_rate': 0.0007915728651566832, 'weight_decay': 0.041416012702173176, 'mosaic_prob': 0.7224940715966972, 'label_smooth': 0.10155664206374179, 'copy_paste_p': 0.288665982615622, 'slice_stride': 10, 'batch_size': 16, 'use_clahe': True, 'use_shift_scale_rotate': True, 'use_brightness_contrast': False, 'use_median_blur': True, 'median_blur_limit': 5, 'use_speckle_noise': False, 'speckle_level': 'medium'}. Best is trial 123 with value: 0.7353625013713276.
[I 2026-03-17 23:05:24,423] Trial 269 finished with value: 0.5940594059405944 and parameters: {'learning_rate': 0.0009752135114021492, 'weight_decay': 0.004417614779013768, 'mosaic_prob': 0.356134584510198, 'label_smooth': 0.09125031831312644, 'copy_paste_p': 0.2539552189327706, 'slice_stride': 7, 'batch_size': 8, 'use_clahe': True, 'use_shift_scale_rotate': True, 'use_brightness_contrast': False, 'use_median_blur': True, 'median_blur_limit': 7, 'use_speckle_noise': False, 'speckle_level': 'medium'}. Best is trial 123 with value: 0.7353625013713276.
[I 2026-03-17 23:17:12,820] Trial 279 pruned. 
[I 2026-03-17 23:30:56,274] Trial 308 finished with value: 0.6705744204476233 and parameters: {'learning_rate': 0.0008707839533447586, 'weight_decay': 0.0002797895163139535, 'mosaic_prob': 0.6726633168632645, 'label_smooth': 0.08888718601656813, 'copy_paste_p': 0.21558603956491457, 'slice_stride': 10, 'batch_size': 16, 'use_clahe': True, 'use_shift_scale_rotate': True, 'use_brightness_contrast': False, 'use_median_blur': True, 'median_blur_limit': 5, 'use_speckle_noise': False, 'speckle_level': 'medium'}. Best is trial 123 with value: 0.7353625013713276.
[I 2026-03-17 23:35:31,328] Trial 334 finished with value: 0.5049504950495052 and parameters: {'learning_rate': 0.0014016924985981495, 'weight_decay': 0.0007328516712335126, 'mosaic_prob': 0.6924339379597593, 'label_smooth': 0.08564507446459328, 'copy_paste_p': 0.275409117012347, 'slice_stride': 5, 'batch_size': 16, 'use_clahe': False, 'use_shift_scale_rotate': False, 'use_brightness_contrast': False, 'use_median_blur': False, 'median_blur_limit': 5, 'use_speckle_noise': False, 'speckle_level': 'light'}. Best is trial 123 with value: 0.7353625013713276.
[I 2026-03-17 23:40:08,275] Trial 344 pruned. 
[I 2026-03-17 23:52:02,019] Trial 356 finished with value: 0.6714232154921627 and parameters: {'learning_rate': 0.0015505255835364874, 'weight_decay': 0.00038811829275189777, 'mosaic_prob': 0.4220066523817803, 'label_smooth': 0.0908456053124477, 'copy_paste_p': 0.5203373452032731, 'slice_stride': 10, 'batch_size': 16, 'use_clahe': True, 'use_shift_scale_rotate': True, 'use_brightness_contrast': False, 'use_median_blur': True, 'median_blur_limit': 5, 'use_speckle_noise': False, 'speckle_level': 'medium'}. Best is trial 123 with value: 0.7353625013713276.
[I 2026-03-18 00:04:19,663] Trial 386 pruned. 
[I 2026-03-18 00:13:47,386] Trial 417 finished with value: 0.6825292102489384 and parameters: {'learning_rate': 0.001271284546170043, 'weight_decay': 0.0002500734251354872, 'mosaic_prob': 0.3246269481740557, 'label_smooth': 0.09388714517197123, 'copy_paste_p': 0.6047288993685446, 'slice_stride': 10, 'batch_size': 16, 'use_clahe': False, 'use_shift_scale_rotate': True, 'use_brightness_contrast': False, 'use_median_blur': True, 'median_blur_limit': 5, 'use_speckle_noise': True, 'speckle_level': 'heavy'}. Best is trial 123 with value: 0.7353625013713276.
[I 2026-03-18 00:25:51,645] Trial 439 pruned. 
[I 2026-03-18 00:29:54,599] Trial 464 finished with value: 0.5445544554455448 and parameters: {'learning_rate': 0.0007030178418839289, 'weight_decay': 0.0030815710329736247, 'mosaic_prob': 0.5177804178638646, 'label_smooth': 0.07774344703703262, 'copy_paste_p': 0.47856491173796023, 'slice_stride': 10, 'batch_size': 8, 'use_clahe': False, 'use_shift_scale_rotate': True, 'use_brightness_contrast': False, 'use_median_blur': True, 'median_blur_limit': 7, 'use_speckle_noise': False, 'speckle_level': 'light'}. Best is trial 409 with value: 0.7500143454379812.
[I 2026-03-18 00:34:19,695] Trial 472 pruned. 
[I 2026-03-18 00:47:27,765] Trial 478 finished with value: 0.7289275525498599 and parameters: {'learning_rate': 0.0010573285181248791, 'weight_decay': 0.0009805711381455752, 'mosaic_prob': 0.4849570091206274, 'label_smooth': 0.06826033352830266, 'copy_paste_p': 0.6657024265231213, 'slice_stride': 10, 'batch_size': 16, 'use_clahe': False, 'use_shift_scale_rotate': True, 'use_brightness_contrast': False, 'use_median_blur': True, 'median_blur_limit': 5, 'use_speckle_noise': True, 'speckle_level': 'light'}. Best is trial 409 with value: 0.7500143454379812.
[I 2026-03-18 00:51:48,966] Trial 495 pruned. 
[I 2026-03-18 01:03:46,818] Trial 501 finished with value: 0.6742959537768963 and parameters: {'learning_rate': 0.0005274371782364522, 'weight_decay': 0.0009779256449503437, 'mosaic_prob': 0.4727262630829761, 'label_smooth': 0.06194580850457069, 'copy_paste_p': 0.49289944444211764, 'slice_stride': 5, 'batch_size': 8, 'use_clahe': False, 'use_shift_scale_rotate': True, 'use_brightness_contrast': False, 'use_median_blur': True, 'median_blur_limit': 7, 'use_speckle_noise': True, 'speckle_level': 'light'}. Best is trial 409 with value: 0.7500143454379812.
