[I 2026-03-19 11:24:30,542] Using an existing study with name 'yoloe_hparam_search_v6' instead of creating a new one.
/fs01/home/dhaneshr/code/obj-det-test/.venv/lib/python3.12/site-packages/albumentations/core/validation.py:114: UserWarning: ShiftScaleRotate is a special case of Affine transform. Please use Affine transform instead.
  original_init(self, **validated_kwargs)
[I 2026-03-19 11:41:27,689] Trial 44 finished with value: 0.677176759016468 and parameters: {'learning_rate': 0.00043284502212938834, 'weight_decay': 0.03680860814877612, 'mosaic_prob': 0.6659969709057025, 'label_smooth': 0.08979877262955549, 'copy_paste_p': 0.27800932022121827, 'slice_stride': 10, 'batch_size': 16, 'use_clahe': True, 'use_shift_scale_rotate': True, 'use_brightness_contrast': False, 'use_median_blur': True, 'median_blur_limit': 5, 'use_speckle_noise': False, 'speckle_level': 'medium'}. Best is trial 42 with value: 0.7017763012337562.
[I 2026-03-19 11:59:07,167] Trial 88 finished with value: 0.6484612819669235 and parameters: {'learning_rate': 0.001243439271836434, 'weight_decay': 0.01609192899181143, 'mosaic_prob': 0.7575649266751439, 'label_smooth': 0.06688463202699092, 'copy_paste_p': 0.20631055894313843, 'slice_stride': 5, 'batch_size': 32, 'use_clahe': False, 'use_shift_scale_rotate': False, 'use_brightness_contrast': True, 'use_median_blur': False, 'median_blur_limit': 3, 'use_speckle_noise': True, 'speckle_level': 'light'}. Best is trial 42 with value: 0.7017763012337562.
[I 2026-03-19 12:04:35,968] Trial 117 pruned. 
[I 2026-03-19 12:15:07,560] Trial 128 finished with value: 0.6496200366902807 and parameters: {'learning_rate': 0.0008702387199250504, 'weight_decay': 0.00190691385597105, 'mosaic_prob': 0.6350748699524886, 'label_smooth': 0.08032288423921365, 'copy_paste_p': 0.44844833153945335, 'slice_stride': 10, 'batch_size': 8, 'use_clahe': True, 'use_shift_scale_rotate': False, 'use_brightness_contrast': False, 'use_median_blur': False, 'median_blur_limit': 7, 'use_speckle_noise': False, 'speckle_level': 'medium'}. Best is trial 106 with value: 0.7300394720216199.
[I 2026-03-19 12:20:28,352] Trial 156 finished with value: 0.5346534653465349 and parameters: {'learning_rate': 0.0037483709833604677, 'weight_decay': 0.0029601284578833625, 'mosaic_prob': 0.5011364991518662, 'label_smooth': 0.023957798214168574, 'copy_paste_p': 0.5438507489919274, 'slice_stride': 7, 'batch_size': 16, 'use_clahe': False, 'use_shift_scale_rotate': True, 'use_brightness_contrast': True, 'use_median_blur': True, 'median_blur_limit': 5, 'use_speckle_noise': True, 'speckle_level': 'heavy'}. Best is trial 106 with value: 0.7300394720216199.
[I 2026-03-19 12:34:47,608] Trial 168 pruned. 
[I 2026-03-19 12:42:27,314] Trial 198 pruned. 
[I 2026-03-19 12:59:16,942] Trial 209 finished with value: 0.7081488611258705 and parameters: {'learning_rate': 0.0004430153379741383, 'weight_decay': 0.0008642587690124893, 'mosaic_prob': 0.48181834966641707, 'label_smooth': 0.031255816499126184, 'copy_paste_p': 0.5125853788401384, 'slice_stride': 7, 'batch_size': 8, 'use_clahe': True, 'use_shift_scale_rotate': True, 'use_brightness_contrast': False, 'use_median_blur': True, 'median_blur_limit': 5, 'use_speckle_noise': False, 'speckle_level': 'heavy'}. Best is trial 166 with value: 0.7379452386507251.
[I 2026-03-19 13:05:22,603] Trial 242 pruned. 
[I 2026-03-19 13:17:48,579] Trial 250 finished with value: 0.6884956594071715 and parameters: {'learning_rate': 0.00034991059317743457, 'weight_decay': 0.00025780471345815224, 'mosaic_prob': 0.4705641782741157, 'label_smooth': 0.03281654162118907, 'copy_paste_p': 0.6706462917549864, 'slice_stride': 7, 'batch_size': 8, 'use_clahe': True, 'use_shift_scale_rotate': True, 'use_brightness_contrast': False, 'use_median_blur': True, 'median_blur_limit': 7, 'use_speckle_noise': False, 'speckle_level': 'heavy'}. Best is trial 227 with value: 0.745034987552105.
[I 2026-03-19 13:34:09,825] Trial 274 pruned. 
[I 2026-03-19 13:48:20,691] Trial 301 finished with value: 0.6932274210650684 and parameters: {'learning_rate': 0.00037470675443109115, 'weight_decay': 0.00017231311963984868, 'mosaic_prob': 0.5571717625714814, 'label_smooth': 0.04935061587843526, 'copy_paste_p': 0.6817425437989063, 'slice_stride': 7, 'batch_size': 16, 'use_clahe': False, 'use_shift_scale_rotate': True, 'use_brightness_contrast': True, 'use_median_blur': True, 'median_blur_limit': 5, 'use_speckle_noise': True, 'speckle_level': 'light'}. Best is trial 227 with value: 0.745034987552105.
[I 2026-03-19 13:54:41,569] Trial 317 pruned. 
[I 2026-03-19 14:02:08,944] Trial 325 pruned. 
[I 2026-03-19 14:07:55,638] Trial 329 pruned. 
