[I 2026-03-19 11:24:40,741] Using an existing study with name 'yoloe_hparam_search_v6' instead of creating a new one.
/fs01/home/dhaneshr/code/obj-det-test/.venv/lib/python3.12/site-packages/albumentations/core/validation.py:114: UserWarning: ShiftScaleRotate is a special case of Affine transform. Please use Affine transform instead.
  original_init(self, **validated_kwargs)
[I 2026-03-19 11:31:20,601] Trial 58 finished with value: 0.34356435643564365 and parameters: {'learning_rate': 0.00043284502212938834, 'weight_decay': 0.03680860814877612, 'mosaic_prob': 0.6659969709057025, 'label_smooth': 0.08979877262955549, 'copy_paste_p': 0.27800932022121827, 'slice_stride': 10, 'batch_size': 16, 'use_clahe': True, 'use_shift_scale_rotate': True, 'use_brightness_contrast': False, 'use_median_blur': True, 'median_blur_limit': 5, 'use_speckle_noise': False, 'speckle_level': 'medium'}. Best is trial 46 with value: 0.3726930693069308.
[I 2026-03-19 11:35:10,985] Trial 65 finished with value: 0.5049504950495052 and parameters: {'learning_rate': 0.000747599299995651, 'weight_decay': 0.003971084710792475, 'mosaic_prob': 0.32322520635999885, 'label_smooth': 0.09113172778521575, 'copy_paste_p': 0.2852620618436458, 'slice_stride': 10, 'batch_size': 8, 'use_clahe': True, 'use_shift_scale_rotate': False, 'use_brightness_contrast': False, 'use_median_blur': False, 'median_blur_limit': 7, 'use_speckle_noise': False, 'speckle_level': 'medium'}. Best is trial 63 with value: 0.5742574257425745.
[I 2026-03-19 11:51:20,522] Trial 74 pruned. 
[I 2026-03-19 11:55:52,917] Trial 99 pruned. 
[I 2026-03-19 12:14:55,058] Trial 111 finished with value: 0.660535003205383 and parameters: {'learning_rate': 0.00030966431191980544, 'weight_decay': 0.00030213030830413646, 'mosaic_prob': 0.4731859275992937, 'label_smooth': 0.14756151488541935, 'copy_paste_p': 0.5095839387020463, 'slice_stride': 5, 'batch_size': 16, 'use_clahe': True, 'use_shift_scale_rotate': True, 'use_brightness_contrast': False, 'use_median_blur': True, 'median_blur_limit': 5, 'use_speckle_noise': False, 'speckle_level': 'medium'}. Best is trial 106 with value: 0.7300394720216199.
[I 2026-03-19 12:19:06,614] Trial 154 finished with value: 0.5148514851485151 and parameters: {'learning_rate': 0.0037483709833604677, 'weight_decay': 0.0029601284578833625, 'mosaic_prob': 0.5011364991518662, 'label_smooth': 0.023957798214168574, 'copy_paste_p': 0.5438507489919274, 'slice_stride': 7, 'batch_size': 16, 'use_clahe': False, 'use_shift_scale_rotate': True, 'use_brightness_contrast': True, 'use_median_blur': True, 'median_blur_limit': 5, 'use_speckle_noise': True, 'speckle_level': 'heavy'}. Best is trial 106 with value: 0.7300394720216199.
[I 2026-03-19 12:24:56,555] Trial 163 pruned. 
[I 2026-03-19 12:32:27,907] Trial 174 pruned. 
[I 2026-03-19 12:48:25,924] Trial 189 finished with value: 0.6756512343602173 and parameters: {'learning_rate': 0.0023592640994819264, 'weight_decay': 0.00015904413469072489, 'mosaic_prob': 0.5644505659176322, 'label_smooth': 0.01089002228853668, 'copy_paste_p': 0.5263598053629578, 'slice_stride': 10, 'batch_size': 32, 'use_clahe': False, 'use_shift_scale_rotate': True, 'use_brightness_contrast': True, 'use_median_blur': True, 'median_blur_limit': 5, 'use_speckle_noise': True, 'speckle_level': 'medium'}. Best is trial 166 with value: 0.7379452386507251.
[I 2026-03-19 12:56:32,131] Trial 219 pruned. 
[I 2026-03-19 13:03:18,314] Trial 236 finished with value: 0.38623762376237636 and parameters: {'learning_rate': 0.00029999712861650106, 'weight_decay': 0.0001870913293437784, 'mosaic_prob': 0.5910654130161694, 'label_smooth': 0.008719515563704327, 'copy_paste_p': 0.5566359939590152, 'slice_stride': 7, 'batch_size': 16, 'use_clahe': False, 'use_shift_scale_rotate': True, 'use_brightness_contrast': True, 'use_median_blur': True, 'median_blur_limit': 5, 'use_speckle_noise': True, 'speckle_level': 'heavy'}. Best is trial 166 with value: 0.7379452386507251.
[I 2026-03-19 13:17:24,486] Trial 246 pruned. 
[I 2026-03-19 13:32:15,292] Trial 273 pruned. 
[I 2026-03-19 13:49:49,877] Trial 297 finished with value: 0.6938044647999826 and parameters: {'learning_rate': 0.0003927508260867347, 'weight_decay': 0.00020407081329899674, 'mosaic_prob': 0.5542039211656826, 'label_smooth': 0.030151904087163506, 'copy_paste_p': 0.6837493458173997, 'slice_stride': 7, 'batch_size': 16, 'use_clahe': True, 'use_shift_scale_rotate': True, 'use_brightness_contrast': False, 'use_median_blur': True, 'median_blur_limit': 3, 'use_speckle_noise': False, 'speckle_level': 'light'}. Best is trial 227 with value: 0.745034987552105.
[I 2026-03-19 14:03:48,433] Trial 319 finished with value: 0.6986150540937544 and parameters: {'learning_rate': 0.0005147787997439954, 'weight_decay': 0.007990262023087471, 'mosaic_prob': 0.538650906870054, 'label_smooth': 0.08471244364551789, 'copy_paste_p': 0.5703788797162569, 'slice_stride': 7, 'batch_size': 16, 'use_clahe': False, 'use_shift_scale_rotate': True, 'use_brightness_contrast': True, 'use_median_blur': True, 'median_blur_limit': 5, 'use_speckle_noise': True, 'speckle_level': 'light'}. Best is trial 227 with value: 0.745034987552105.
