[I 2026-03-17 22:47:50,957] Using an existing study with name 'yoloe_hparam_search_v5' instead of creating a new one.
/fs01/home/dhaneshr/code/obj-det-test/.venv/lib/python3.12/site-packages/albumentations/core/validation.py:114: UserWarning: ShiftScaleRotate is a special case of Affine transform. Please use Affine transform instead.
  original_init(self, **validated_kwargs)
[I 2026-03-17 22:58:58,328] Trial 229 finished with value: 0.6268850965098397 and parameters: {'learning_rate': 0.0007915728651566832, 'weight_decay': 0.041416012702173176, 'mosaic_prob': 0.7224940715966972, 'label_smooth': 0.10155664206374179, 'copy_paste_p': 0.288665982615622, 'slice_stride': 10, 'batch_size': 16, 'use_clahe': True, 'use_shift_scale_rotate': True, 'use_brightness_contrast': False, 'use_median_blur': True, 'median_blur_limit': 5, 'use_speckle_noise': False, 'speckle_level': 'medium'}. Best is trial 123 with value: 0.7353625013713276.
[I 2026-03-17 23:03:06,112] Trial 257 finished with value: 0.6633663366336637 and parameters: {'learning_rate': 0.0007122595488277191, 'weight_decay': 0.0008499553488449836, 'mosaic_prob': 0.648317977080689, 'label_smooth': 0.08386425338246488, 'copy_paste_p': 0.2527538529324313, 'slice_stride': 7, 'batch_size': 8, 'use_clahe': True, 'use_shift_scale_rotate': True, 'use_brightness_contrast': False, 'use_median_blur': True, 'median_blur_limit': 7, 'use_speckle_noise': False, 'speckle_level': 'medium'}. Best is trial 123 with value: 0.7353625013713276.
[I 2026-03-17 23:14:07,793] Trial 271 finished with value: 0.6505313153269763 and parameters: {'learning_rate': 0.0009639959128804647, 'weight_decay': 0.0034514717585967586, 'mosaic_prob': 0.5705760960317714, 'label_smooth': 0.09200541288125721, 'copy_paste_p': 0.25310068485481557, 'slice_stride': 7, 'batch_size': 8, 'use_clahe': True, 'use_shift_scale_rotate': True, 'use_brightness_contrast': False, 'use_median_blur': True, 'median_blur_limit': 7, 'use_speckle_noise': False, 'speckle_level': 'medium'}. Best is trial 123 with value: 0.7353625013713276.
[I 2026-03-17 23:25:42,483] Trial 300 pruned. 
[I 2026-03-17 23:41:14,936] Trial 322 pruned. 
[I 2026-03-17 23:45:56,535] Trial 359 pruned. 
[I 2026-03-17 23:49:57,726] Trial 370 pruned. 
[I 2026-03-17 23:54:40,414] Trial 382 pruned. 
[I 2026-03-17 23:58:53,642] Trial 393 pruned. 
[I 2026-03-18 00:11:44,976] Trial 403 finished with value: 0.6663657394931822 and parameters: {'learning_rate': 0.0007451496726488284, 'weight_decay': 0.0002021369862196083, 'mosaic_prob': 0.3236212685407541, 'label_smooth': 0.08950246693329583, 'copy_paste_p': 0.5481771455582155, 'slice_stride': 10, 'batch_size': 16, 'use_clahe': True, 'use_shift_scale_rotate': True, 'use_brightness_contrast': True, 'use_median_blur': True, 'median_blur_limit': 5, 'use_speckle_noise': False, 'speckle_level': 'medium'}. Best is trial 123 with value: 0.7353625013713276.
[I 2026-03-18 00:24:36,475] Trial 433 pruned. 
[I 2026-03-18 00:29:08,339] Trial 460 pruned. 
[I 2026-03-18 00:39:48,111] Trial 471 pruned. 
[I 2026-03-18 00:53:05,992] Trial 491 finished with value: 0.672059747467128 and parameters: {'learning_rate': 0.0005542073874434731, 'weight_decay': 0.0025085276856955515, 'mosaic_prob': 0.6785843895224565, 'label_smooth': 0.12560795689559956, 'copy_paste_p': 0.6658954020812419, 'slice_stride': 5, 'batch_size': 8, 'use_clahe': False, 'use_shift_scale_rotate': True, 'use_brightness_contrast': False, 'use_median_blur': True, 'median_blur_limit': 5, 'use_speckle_noise': False, 'speckle_level': 'light'}. Best is trial 409 with value: 0.7500143454379812.
[I 2026-03-18 00:57:40,866] Trial 505 finished with value: 0.6732673267326736 and parameters: {'learning_rate': 0.0004796784995693778, 'weight_decay': 0.0009779256449503437, 'mosaic_prob': 0.4727262630829761, 'label_smooth': 0.06194580850457069, 'copy_paste_p': 0.49289944444211764, 'slice_stride': 5, 'batch_size': 8, 'use_clahe': False, 'use_shift_scale_rotate': True, 'use_brightness_contrast': False, 'use_median_blur': True, 'median_blur_limit': 7, 'use_speckle_noise': True, 'speckle_level': 'light'}. Best is trial 409 with value: 0.7500143454379812.
