/cm/local/apps/slurm/var/spool/job00748/slurm_script: /cvmfs/soft.computecanada.ca/custom/software/lmod/lmod/init/bash: Too many levels of symbolic links
[I 2026-03-17 10:46:48,023] Using an existing study with name 'yoloe_hparam_search_v3' instead of creating a new one.
/fs01/home/dhaneshr/code/obj-det-test/.venv/lib/python3.12/site-packages/albumentations/core/validation.py:114: UserWarning: ShiftScaleRotate is a special case of Affine transform. Please use Affine transform instead.
  original_init(self, **validated_kwargs)
[I 2026-03-17 11:10:45,902] Trial 14 finished with value: 0.4582667648792267 and parameters: {'learning_rate': 0.00043284502212938834, 'weight_decay': 0.007969454818643935, 'slice_stride': 5, 'batch_size': 32, 'mosaic_prob': 0.34044600469728353, 'label_smooth': 0.10621088666940683, 'use_clahe': False, 'use_shift_scale_rotate': True, 'use_brightness_contrast': False, 'use_median_blur': False, 'median_blur_limit': 7, 'use_speckle_noise': False, 'speckle_level': 'heavy', 'copy_paste_p': 0.1397716475108518}. Best is trial 8 with value: 0.6186953783035278.
[I 2026-03-17 11:15:20,076] Trial 33 pruned. 
[I 2026-03-17 11:25:02,604] Trial 50 pruned. 
[I 2026-03-17 11:30:21,944] Trial 76 pruned. 
[I 2026-03-17 11:36:25,855] Trial 88 pruned. 
[I 2026-03-17 11:41:37,998] Trial 95 pruned. 
[I 2026-03-17 12:05:36,996] Trial 109 finished with value: 0.4624244272708893 and parameters: {'learning_rate': 0.0004536824333886933, 'weight_decay': 0.008339137056129731, 'slice_stride': 5, 'batch_size': 32, 'mosaic_prob': 0.3357691203520477, 'label_smooth': 0.06899793133117778, 'use_clahe': False, 'use_shift_scale_rotate': True, 'use_brightness_contrast': False, 'use_median_blur': False, 'median_blur_limit': 7, 'use_speckle_noise': False, 'speckle_level': 'light', 'copy_paste_p': 0.12453192751290065}. Best is trial 8 with value: 0.6186953783035278.
[I 2026-03-17 12:27:59,985] Trial 147 finished with value: 0.46866703033447266 and parameters: {'learning_rate': 0.004832259207239238, 'weight_decay': 0.0006613644475520923, 'slice_stride': 5, 'batch_size': 8, 'mosaic_prob': 0.3855349626117378, 'label_smooth': 0.11388816150898787, 'use_clahe': False, 'use_shift_scale_rotate': True, 'use_brightness_contrast': False, 'use_median_blur': False, 'median_blur_limit': 7, 'use_speckle_noise': False, 'speckle_level': 'light', 'copy_paste_p': 0.17993095580187093}. Best is trial 8 with value: 0.6186953783035278.
[I 2026-03-17 12:34:29,951] Trial 196 pruned. 
[I 2026-03-17 12:39:29,160] Trial 209 pruned. 
[I 2026-03-17 12:45:10,965] Trial 216 pruned. 
[I 2026-03-17 12:51:04,326] Trial 223 pruned. 
[I 2026-03-17 13:12:51,975] Trial 232 finished with value: 0.5046486258506775 and parameters: {'learning_rate': 0.0003972230549247985, 'weight_decay': 0.0007901530921504845, 'slice_stride': 5, 'batch_size': 8, 'mosaic_prob': 0.29065574472845696, 'label_smooth': 0.1053000844636789, 'use_clahe': False, 'use_shift_scale_rotate': True, 'use_brightness_contrast': False, 'use_median_blur': False, 'median_blur_limit': 7, 'use_speckle_noise': False, 'speckle_level': 'heavy', 'copy_paste_p': 0.07606545073642854}. Best is trial 8 with value: 0.6186953783035278.
[I 2026-03-17 13:23:44,014] Trial 250 pruned. 
[I 2026-03-17 13:44:49,071] Trial 265 finished with value: 0.5220912098884583 and parameters: {'learning_rate': 0.0007140248899330838, 'weight_decay': 0.00012306691339259766, 'slice_stride': 5, 'batch_size': 16, 'mosaic_prob': 0.2522819628065543, 'label_smooth': 0.0487963841573645, 'use_clahe': False, 'use_shift_scale_rotate': True, 'use_brightness_contrast': False, 'use_median_blur': False, 'median_blur_limit': 7, 'use_speckle_noise': False, 'speckle_level': 'heavy', 'copy_paste_p': 0.12497497213043311}. Best is trial 8 with value: 0.6186953783035278.
