[I 2026-03-17 22:48:01,493] Using an existing study with name 'yoloe_hparam_search_v5' instead of creating a new one.
/fs01/home/dhaneshr/code/obj-det-test/.venv/lib/python3.12/site-packages/albumentations/core/validation.py:114: UserWarning: ShiftScaleRotate is a special case of Affine transform. Please use Affine transform instead.
  original_init(self, **validated_kwargs)
[I 2026-03-17 22:52:29,863] Trial 237 pruned. 
[I 2026-03-17 23:06:12,452] Trial 246 finished with value: 0.6604282061667228 and parameters: {'learning_rate': 0.0005754532739793587, 'weight_decay': 0.000670096232931248, 'mosaic_prob': 0.5088198522671866, 'label_smooth': 0.10937176295859277, 'copy_paste_p': 0.4891093842248419, 'slice_stride': 10, 'batch_size': 16, 'use_clahe': True, 'use_shift_scale_rotate': True, 'use_brightness_contrast': False, 'use_median_blur': True, 'median_blur_limit': 5, 'use_speckle_noise': False, 'speckle_level': 'light'}. Best is trial 123 with value: 0.7353625013713276.
[I 2026-03-17 23:18:18,187] Trial 280 pruned. 
[I 2026-03-17 23:31:54,064] Trial 311 finished with value: 0.7167376730624567 and parameters: {'learning_rate': 0.0008713682708761088, 'weight_decay': 0.0002797895163139535, 'mosaic_prob': 0.6730488037053155, 'label_smooth': 0.08833235940993804, 'copy_paste_p': 0.21616260807728283, 'slice_stride': 10, 'batch_size': 16, 'use_clahe': True, 'use_shift_scale_rotate': True, 'use_brightness_contrast': False, 'use_median_blur': True, 'median_blur_limit': 5, 'use_speckle_noise': False, 'speckle_level': 'medium'}. Best is trial 123 with value: 0.7353625013713276.
[I 2026-03-17 23:35:59,131] Trial 337 pruned. 
[I 2026-03-17 23:48:28,899] Trial 346 finished with value: 0.6781734312197838 and parameters: {'learning_rate': 0.0006680381535963726, 'weight_decay': 0.00040041727320449535, 'mosaic_prob': 0.39171661442707456, 'label_smooth': 0.08123320540857203, 'copy_paste_p': 0.23696445865322255, 'slice_stride': 10, 'batch_size': 16, 'use_clahe': True, 'use_shift_scale_rotate': True, 'use_brightness_contrast': False, 'use_median_blur': True, 'median_blur_limit': 5, 'use_speckle_noise': False, 'speckle_level': 'light'}. Best is trial 123 with value: 0.7353625013713276.
[I 2026-03-17 23:52:13,738] Trial 378 pruned. 
[I 2026-03-17 23:56:16,382] Trial 388 pruned. 
[I 2026-03-18 00:08:51,748] Trial 396 finished with value: 0.7012588969356689 and parameters: {'learning_rate': 0.0006177518982016494, 'weight_decay': 0.0003368273315844142, 'mosaic_prob': 0.5226736312622389, 'label_smooth': 0.09388714517197123, 'copy_paste_p': 0.6851899024509025, 'slice_stride': 10, 'batch_size': 16, 'use_clahe': True, 'use_shift_scale_rotate': True, 'use_brightness_contrast': True, 'use_median_blur': True, 'median_blur_limit': 5, 'use_speckle_noise': False, 'speckle_level': 'medium'}. Best is trial 123 with value: 0.7353625013713276.
[I 2026-03-18 00:23:37,537] Trial 426 finished with value: 0.6759074492594688 and parameters: {'learning_rate': 0.001243907243363733, 'weight_decay': 0.00031973467470425645, 'mosaic_prob': 0.549451567967693, 'label_smooth': 0.11174595833828296, 'copy_paste_p': 0.6302007405853148, 'slice_stride': 10, 'batch_size': 16, 'use_clahe': True, 'use_shift_scale_rotate': True, 'use_brightness_contrast': True, 'use_median_blur': True, 'median_blur_limit': 5, 'use_speckle_noise': False, 'speckle_level': 'light'}. Best is trial 409 with value: 0.7500143454379812.
[I 2026-03-18 00:37:16,619] Trial 458 finished with value: 0.6900992081860271 and parameters: {'learning_rate': 0.0007030178418839289, 'weight_decay': 0.0030815710329736247, 'mosaic_prob': 0.5177804178638646, 'label_smooth': 0.07774344703703262, 'copy_paste_p': 0.47856491173796023, 'slice_stride': 10, 'batch_size': 16, 'use_clahe': False, 'use_shift_scale_rotate': True, 'use_brightness_contrast': False, 'use_median_blur': True, 'median_blur_limit': 5, 'use_speckle_noise': False, 'speckle_level': 'heavy'}. Best is trial 409 with value: 0.7500143454379812.
[I 2026-03-18 00:50:13,291] Trial 484 finished with value: 0.656352805934492 and parameters: {'learning_rate': 0.0005714612590900042, 'weight_decay': 0.01828234651630238, 'mosaic_prob': 0.48699326868975507, 'label_smooth': 0.06444877903338109, 'copy_paste_p': 0.5742277970791486, 'slice_stride': 5, 'batch_size': 16, 'use_clahe': False, 'use_shift_scale_rotate': True, 'use_brightness_contrast': False, 'use_median_blur': True, 'median_blur_limit': 5, 'use_speckle_noise': False, 'speckle_level': 'medium'}. Best is trial 409 with value: 0.7500143454379812.
[I 2026-03-18 01:05:32,076] Trial 499 finished with value: 0.6970592020967065 and parameters: {'learning_rate': 0.0005398758856735689, 'weight_decay': 0.0009641434651185171, 'mosaic_prob': 0.47285609648666677, 'label_smooth': 0.06535027270876118, 'copy_paste_p': 0.6942061742275247, 'slice_stride': 5, 'batch_size': 8, 'use_clahe': False, 'use_shift_scale_rotate': True, 'use_brightness_contrast': False, 'use_median_blur': True, 'median_blur_limit': 7, 'use_speckle_noise': True, 'speckle_level': 'light'}. Best is trial 409 with value: 0.7500143454379812.
[I 2026-03-18 01:17:21,625] Trial 514 finished with value: 0.6852351420326359 and parameters: {'learning_rate': 0.0006463378388233863, 'weight_decay': 0.0018887538483074989, 'mosaic_prob': 0.5075229706221916, 'label_smooth': 0.06797126629901783, 'copy_paste_p': 0.6838679986662439, 'slice_stride': 5, 'batch_size': 8, 'use_clahe': False, 'use_shift_scale_rotate': True, 'use_brightness_contrast': False, 'use_median_blur': True, 'median_blur_limit': 7, 'use_speckle_noise': False, 'speckle_level': 'light'}. Best is trial 409 with value: 0.7500143454379812.
[I 2026-03-18 01:28:06,151] Trial 518 finished with value: 0.6545725923429899 and parameters: {'learning_rate': 0.0006208066832324932, 'weight_decay': 0.0011780377407394948, 'mosaic_prob': 0.4533122618439743, 'label_smooth': 0.06649851390937625, 'copy_paste_p': 0.6222807737435796, 'slice_stride': 5, 'batch_size': 8, 'use_clahe': False, 'use_shift_scale_rotate': True, 'use_brightness_contrast': False, 'use_median_blur': True, 'median_blur_limit': 7, 'use_speckle_noise': True, 'speckle_level': 'light'}. Best is trial 409 with value: 0.7500143454379812.
