[I 2026-03-17 22:47:44,066] Using an existing study with name 'yoloe_hparam_search_v5' instead of creating a new one.
/fs01/home/dhaneshr/code/obj-det-test/.venv/lib/python3.12/site-packages/albumentations/core/validation.py:114: UserWarning: ShiftScaleRotate is a special case of Affine transform. Please use Affine transform instead.
  original_init(self, **validated_kwargs)
[I 2026-03-17 22:59:45,200] Trial 220 pruned. 
[I 2026-03-17 23:08:56,610] Trial 261 finished with value: 0.6192133884371586 and parameters: {'learning_rate': 0.0007140771797619988, 'weight_decay': 0.0008482675360027443, 'mosaic_prob': 0.6500863501275913, 'label_smooth': 0.08251291105758908, 'copy_paste_p': 0.2539552189327706, 'slice_stride': 7, 'batch_size': 8, 'use_clahe': True, 'use_shift_scale_rotate': True, 'use_brightness_contrast': False, 'use_median_blur': True, 'median_blur_limit': 7, 'use_speckle_noise': False, 'speckle_level': 'medium'}. Best is trial 123 with value: 0.7353625013713276.
[I 2026-03-17 23:20:37,777] Trial 289 finished with value: 0.7165165385144155 and parameters: {'learning_rate': 0.0011231586702419977, 'weight_decay': 0.03397519267029714, 'mosaic_prob': 0.4657929566556468, 'label_smooth': 0.07829325929720002, 'copy_paste_p': 0.5095839387020463, 'slice_stride': 10, 'batch_size': 16, 'use_clahe': False, 'use_shift_scale_rotate': False, 'use_brightness_contrast': True, 'use_median_blur': False, 'median_blur_limit': 5, 'use_speckle_noise': False, 'speckle_level': 'light'}. Best is trial 123 with value: 0.7353625013713276.
[I 2026-03-17 23:24:52,136] Trial 314 pruned. 
[I 2026-03-17 23:29:09,439] Trial 321 pruned. 
[I 2026-03-17 23:38:06,332] Trial 330 finished with value: 0.6567330611039606 and parameters: {'learning_rate': 0.0012067293868449787, 'weight_decay': 0.0020924064291480905, 'mosaic_prob': 0.3185598978918624, 'label_smooth': 0.08099907586153039, 'copy_paste_p': 0.42239628269144897, 'slice_stride': 5, 'batch_size': 16, 'use_clahe': False, 'use_shift_scale_rotate': False, 'use_brightness_contrast': False, 'use_median_blur': False, 'median_blur_limit': 5, 'use_speckle_noise': False, 'speckle_level': 'medium'}. Best is trial 123 with value: 0.7353625013713276.
[I 2026-03-17 23:41:52,599] Trial 351 pruned. 
[I 2026-03-17 23:54:57,406] Trial 361 finished with value: 0.6737050248028548 and parameters: {'learning_rate': 0.0007346641295388874, 'weight_decay': 0.0002280406022471839, 'mosaic_prob': 0.3625949208904745, 'label_smooth': 0.08442280804169207, 'copy_paste_p': 0.5588179103471368, 'slice_stride': 10, 'batch_size': 16, 'use_clahe': True, 'use_shift_scale_rotate': True, 'use_brightness_contrast': False, 'use_median_blur': True, 'median_blur_limit': 5, 'use_speckle_noise': False, 'speckle_level': 'medium'}. Best is trial 123 with value: 0.7353625013713276.
[I 2026-03-18 00:06:17,203] Trial 394 pruned. 
[I 2026-03-18 00:14:32,952] Trial 422 finished with value: 0.6512187343530155 and parameters: {'learning_rate': 0.00124931531502038, 'weight_decay': 0.0024903289279490743, 'mosaic_prob': 0.3788778716570607, 'label_smooth': 0.11163846724610473, 'copy_paste_p': 0.6121308448681715, 'slice_stride': 10, 'batch_size': 8, 'use_clahe': False, 'use_shift_scale_rotate': True, 'use_brightness_contrast': False, 'use_median_blur': True, 'median_blur_limit': 7, 'use_speckle_noise': False, 'speckle_level': 'heavy'}. Best is trial 409 with value: 0.7500143454379812.
[I 2026-03-18 00:19:17,721] Trial 443 pruned. 
[I 2026-03-18 00:31:41,195] Trial 453 pruned. 
[I 2026-03-18 00:35:04,859] Trial 474 finished with value: 0.6039603960396043 and parameters: {'learning_rate': 0.0011191196174721338, 'weight_decay': 0.0006264696641682006, 'mosaic_prob': 0.3977921813223515, 'label_smooth': 0.11771391096108999, 'copy_paste_p': 0.27063828808527707, 'slice_stride': 10, 'batch_size': 8, 'use_clahe': False, 'use_shift_scale_rotate': True, 'use_brightness_contrast': False, 'use_median_blur': True, 'median_blur_limit': 7, 'use_speckle_noise': False, 'speckle_level': 'light'}. Best is trial 409 with value: 0.7500143454379812.
[I 2026-03-18 00:40:26,159] Trial 479 pruned. 
[I 2026-03-18 00:45:02,967] Trial 493 pruned. 
