/cm/local/apps/slurm/var/spool/job00751/slurm_script: /cvmfs/soft.computecanada.ca/custom/software/lmod/lmod/init/bash: Too many levels of symbolic links
[I 2026-03-17 10:46:50,849] Using an existing study with name 'yoloe_hparam_search_v3' instead of creating a new one.
/fs01/home/dhaneshr/code/obj-det-test/.venv/lib/python3.12/site-packages/albumentations/core/validation.py:114: UserWarning: ShiftScaleRotate is a special case of Affine transform. Please use Affine transform instead.
  original_init(self, **validated_kwargs)
[I 2026-03-17 11:10:38,969] Trial 17 finished with value: 0.5294429063796997 and parameters: {'learning_rate': 0.00043284502212938834, 'weight_decay': 0.007969454818643935, 'slice_stride': 5, 'batch_size': 32, 'mosaic_prob': 0.34044600469728353, 'label_smooth': 0.10621088666940683, 'use_clahe': False, 'use_shift_scale_rotate': True, 'use_brightness_contrast': False, 'use_median_blur': False, 'median_blur_limit': 7, 'use_speckle_noise': False, 'speckle_level': 'heavy', 'copy_paste_p': 0.1397716475108518}. Best is trial 8 with value: 0.6186953783035278.
[I 2026-03-17 11:15:32,188] Trial 30 pruned. 
[I 2026-03-17 11:37:13,856] Trial 53 finished with value: 0.4988442063331604 and parameters: {'learning_rate': 0.001134714062390298, 'weight_decay': 0.0056708469493489165, 'slice_stride': 5, 'batch_size': 16, 'mosaic_prob': 0.2970148549051205, 'label_smooth': 0.09036710306959994, 'use_clahe': False, 'use_shift_scale_rotate': True, 'use_brightness_contrast': False, 'use_median_blur': False, 'median_blur_limit': 5, 'use_speckle_noise': False, 'speckle_level': 'heavy', 'copy_paste_p': 0.03267333983044449}. Best is trial 8 with value: 0.6186953783035278.
[I 2026-03-17 11:42:42,338] Trial 98 pruned. 
[I 2026-03-17 12:03:57,748] Trial 110 finished with value: 0.5711499452590942 and parameters: {'learning_rate': 0.0028118872210255064, 'weight_decay': 0.008450378971119275, 'slice_stride': 5, 'batch_size': 32, 'mosaic_prob': 0.33718855614370524, 'label_smooth': 0.07443075042506067, 'use_clahe': False, 'use_shift_scale_rotate': True, 'use_brightness_contrast': False, 'use_median_blur': False, 'median_blur_limit': 7, 'use_speckle_noise': False, 'speckle_level': 'light', 'copy_paste_p': 0.12501459947053223}. Best is trial 8 with value: 0.6186953783035278.
[I 2026-03-17 12:10:42,897] Trial 142 pruned. 
[I 2026-03-17 12:16:02,052] Trial 158 pruned. 
[I 2026-03-17 12:39:19,219] Trial 168 finished with value: 0.4630923569202423 and parameters: {'learning_rate': 0.0024101742104483256, 'weight_decay': 0.0074489456845925695, 'slice_stride': 5, 'batch_size': 32, 'mosaic_prob': 0.2830769187725544, 'label_smooth': 0.08692995507595054, 'use_clahe': False, 'use_shift_scale_rotate': True, 'use_brightness_contrast': False, 'use_median_blur': False, 'median_blur_limit': 3, 'use_speckle_noise': False, 'speckle_level': 'heavy', 'copy_paste_p': 0.11010934135753021}. Best is trial 8 with value: 0.6186953783035278.
[I 2026-03-17 12:44:09,888] Trial 215 pruned. 
[I 2026-03-17 12:50:30,483] Trial 220 pruned. 
[I 2026-03-17 12:55:35,170] Trial 230 pruned. 
[I 2026-03-17 13:16:06,034] Trial 244 finished with value: 0.5305036306381226 and parameters: {'learning_rate': 0.0005317444900545343, 'weight_decay': 0.00015547197313761182, 'slice_stride': 5, 'batch_size': 16, 'mosaic_prob': 0.3702089512191987, 'label_smooth': 0.05068483679805762, 'use_clahe': False, 'use_shift_scale_rotate': True, 'use_brightness_contrast': False, 'use_median_blur': False, 'median_blur_limit': 7, 'use_speckle_noise': False, 'speckle_level': 'heavy', 'copy_paste_p': 0.1274985836241246}. Best is trial 8 with value: 0.6186953783035278.
[I 2026-03-17 13:37:50,001] Trial 258 finished with value: 0.5212939381599426 and parameters: {'learning_rate': 0.000670749723439299, 'weight_decay': 0.00018873561766933087, 'slice_stride': 5, 'batch_size': 8, 'mosaic_prob': 0.2480381463151758, 'label_smooth': 0.06459728265242135, 'use_clahe': False, 'use_shift_scale_rotate': True, 'use_brightness_contrast': False, 'use_median_blur': False, 'median_blur_limit': 7, 'use_speckle_noise': False, 'speckle_level': 'heavy', 'copy_paste_p': 0.13297038853221418}. Best is trial 8 with value: 0.6186953783035278.
[I 2026-03-17 13:43:03,956] Trial 273 pruned. 
[I 2026-03-17 13:49:17,274] Trial 278 pruned. 
