/cm/local/apps/slurm/var/spool/job00736/slurm_script: /cvmfs/soft.computecanada.ca/custom/software/lmod/lmod/init/bash: Too many levels of symbolic links
[I 2026-03-17 10:46:35,915] Using an existing study with name 'yoloe_hparam_search_v3' instead of creating a new one.
/fs01/home/dhaneshr/code/obj-det-test/.venv/lib/python3.12/site-packages/albumentations/core/validation.py:114: UserWarning: ShiftScaleRotate is a special case of Affine transform. Please use Affine transform instead.
  original_init(self, **validated_kwargs)
[I 2026-03-17 11:07:27,077] Trial 2 finished with value: 0.43495023250579834 and parameters: {'learning_rate': 0.00043284502212938834, 'weight_decay': 0.007969454818643935, 'slice_stride': 5, 'batch_size': 32, 'mosaic_prob': 0.34044600469728353, 'label_smooth': 0.10621088666940683, 'use_clahe': False, 'use_shift_scale_rotate': True, 'use_brightness_contrast': False, 'use_median_blur': False, 'median_blur_limit': 7, 'use_speckle_noise': False, 'speckle_level': 'heavy', 'copy_paste_p': 0.1397716475108518}. Best is trial 6 with value: 0.48685187101364136.
[I 2026-03-17 11:12:11,002] Trial 20 pruned. 
[I 2026-03-17 11:16:03,942] Trial 39 pruned. 
[I 2026-03-17 11:37:10,677] Trial 57 finished with value: 0.5062488317489624 and parameters: {'learning_rate': 0.001134714062390298, 'weight_decay': 0.0056708469493489165, 'slice_stride': 5, 'batch_size': 16, 'mosaic_prob': 0.29876992392488466, 'label_smooth': 0.09036710306959994, 'use_clahe': False, 'use_shift_scale_rotate': True, 'use_brightness_contrast': False, 'use_median_blur': False, 'median_blur_limit': 5, 'use_speckle_noise': False, 'speckle_level': 'heavy', 'copy_paste_p': 0.014639641040284646}. Best is trial 8 with value: 0.6186953783035278.
[I 2026-03-17 11:43:02,078] Trial 97 pruned. 
[I 2026-03-17 12:05:13,520] Trial 111 finished with value: 0.4517134130001068 and parameters: {'learning_rate': 0.0028118872210255064, 'weight_decay': 0.00855378112290888, 'slice_stride': 5, 'batch_size': 32, 'mosaic_prob': 0.33718855614370524, 'label_smooth': 0.07443075042506067, 'use_clahe': False, 'use_shift_scale_rotate': True, 'use_brightness_contrast': False, 'use_median_blur': False, 'median_blur_limit': 5, 'use_speckle_noise': False, 'speckle_level': 'light', 'copy_paste_p': 0.12501459947053223}. Best is trial 8 with value: 0.6186953783035278.
[I 2026-03-17 12:10:41,104] Trial 146 pruned. 
[I 2026-03-17 12:16:17,205] Trial 157 pruned. 
[I 2026-03-17 12:22:14,224] Trial 170 pruned. 
[I 2026-03-17 12:25:56,727] Trial 182 pruned. 
[I 2026-03-17 12:33:54,637] Trial 193 pruned. 
[I 2026-03-17 12:56:51,894] Trial 208 finished with value: 0.5100944638252258 and parameters: {'learning_rate': 0.0004796636749421195, 'weight_decay': 0.0001094032110611736, 'slice_stride': 5, 'batch_size': 32, 'mosaic_prob': 0.3279362074455757, 'label_smooth': 0.0980072751493078, 'use_clahe': False, 'use_shift_scale_rotate': True, 'use_brightness_contrast': False, 'use_median_blur': False, 'median_blur_limit': 7, 'use_speckle_noise': False, 'speckle_level': 'heavy', 'copy_paste_p': 0.026771825639811626}. Best is trial 8 with value: 0.6186953783035278.
[I 2026-03-17 13:18:21,998] Trial 245 finished with value: 0.5190598368644714 and parameters: {'learning_rate': 0.0010481136334823005, 'weight_decay': 0.00015630778884797517, 'slice_stride': 5, 'batch_size': 8, 'mosaic_prob': 0.3749604183711331, 'label_smooth': 0.10586649361074708, 'use_clahe': False, 'use_shift_scale_rotate': True, 'use_brightness_contrast': False, 'use_median_blur': False, 'median_blur_limit': 7, 'use_speckle_noise': False, 'speckle_level': 'heavy', 'copy_paste_p': 0.1381720026465691}. Best is trial 8 with value: 0.6186953783035278.
[I 2026-03-17 13:23:34,587] Trial 262 pruned. 
[I 2026-03-17 13:34:01,509] Trial 264 pruned. 
