[I 2026-03-17 22:47:43,890] Using an existing study with name 'yoloe_hparam_search_v5' instead of creating a new one.
/fs01/home/dhaneshr/code/obj-det-test/.venv/lib/python3.12/site-packages/albumentations/core/validation.py:114: UserWarning: ShiftScaleRotate is a special case of Affine transform. Please use Affine transform instead.
  original_init(self, **validated_kwargs)
[I 2026-03-17 23:02:06,087] Trial 219 finished with value: 0.6869771393761488 and parameters: {'learning_rate': 0.0007915728651566832, 'weight_decay': 0.041416012702173176, 'mosaic_prob': 0.7224940715966972, 'label_smooth': 0.10155664206374179, 'copy_paste_p': 0.288665982615622, 'slice_stride': 10, 'batch_size': 16, 'use_clahe': True, 'use_shift_scale_rotate': True, 'use_brightness_contrast': False, 'use_median_blur': True, 'median_blur_limit': 5, 'use_speckle_noise': False, 'speckle_level': 'medium'}. Best is trial 123 with value: 0.7353625013713276.
[I 2026-03-17 23:14:15,524] Trial 270 finished with value: 0.6859577346304983 and parameters: {'learning_rate': 0.0009752135114021492, 'weight_decay': 0.0036054939578113155, 'mosaic_prob': 0.356134584510198, 'label_smooth': 0.09143471420900443, 'copy_paste_p': 0.2539552189327706, 'slice_stride': 7, 'batch_size': 8, 'use_clahe': True, 'use_shift_scale_rotate': True, 'use_brightness_contrast': False, 'use_median_blur': True, 'median_blur_limit': 7, 'use_speckle_noise': False, 'speckle_level': 'medium'}. Best is trial 123 with value: 0.7353625013713276.
[I 2026-03-17 23:26:17,586] Trial 301 pruned. 
[I 2026-03-17 23:38:11,316] Trial 324 finished with value: 0.608815869257816 and parameters: {'learning_rate': 0.0005356261667832757, 'weight_decay': 0.04941679399162963, 'mosaic_prob': 0.4080438610505279, 'label_smooth': 0.10459848428926573, 'copy_paste_p': 0.5305077849631611, 'slice_stride': 5, 'batch_size': 16, 'use_clahe': False, 'use_shift_scale_rotate': False, 'use_brightness_contrast': False, 'use_median_blur': False, 'median_blur_limit': 5, 'use_speckle_noise': False, 'speckle_level': 'medium'}. Best is trial 123 with value: 0.7353625013713276.
[I 2026-03-17 23:42:20,915] Trial 352 pruned. 
[I 2026-03-17 23:47:03,872] Trial 362 pruned. 
[I 2026-03-17 23:58:16,178] Trial 373 pruned. 
[I 2026-03-18 00:02:25,190] Trial 402 pruned. 
[I 2026-03-18 00:15:00,845] Trial 413 finished with value: 0.6952243430239369 and parameters: {'learning_rate': 0.000836228008655108, 'weight_decay': 0.0037328502682907687, 'mosaic_prob': 0.3246269481740557, 'label_smooth': 0.07872298648733289, 'copy_paste_p': 0.36106796882147685, 'slice_stride': 10, 'batch_size': 16, 'use_clahe': False, 'use_shift_scale_rotate': True, 'use_brightness_contrast': False, 'use_median_blur': True, 'median_blur_limit': 5, 'use_speckle_noise': False, 'speckle_level': 'heavy'}. Best is trial 409 with value: 0.7500143454379812.
[I 2026-03-18 00:27:29,191] Trial 444 pruned. 
[I 2026-03-18 00:31:46,450] Trial 468 pruned. 
[I 2026-03-18 00:37:25,628] Trial 475 finished with value: 0.428711881188119 and parameters: {'learning_rate': 0.0003548022144059472, 'weight_decay': 0.0006098559553366831, 'mosaic_prob': 0.33977672974729567, 'label_smooth': 0.08715577328890735, 'copy_paste_p': 0.29788111289280916, 'slice_stride': 10, 'batch_size': 16, 'use_clahe': True, 'use_shift_scale_rotate': True, 'use_brightness_contrast': False, 'use_median_blur': True, 'median_blur_limit': 5, 'use_speckle_noise': False, 'speckle_level': 'light'}. Best is trial 409 with value: 0.7500143454379812.
[I 2026-03-18 00:48:39,573] Trial 485 finished with value: 0.6802115930850082 and parameters: {'learning_rate': 0.0005636892321363977, 'weight_decay': 0.0027906570634749603, 'mosaic_prob': 0.4849570091206274, 'label_smooth': 0.06826033352830266, 'copy_paste_p': 0.46693906176718303, 'slice_stride': 5, 'batch_size': 16, 'use_clahe': False, 'use_shift_scale_rotate': True, 'use_brightness_contrast': False, 'use_median_blur': True, 'median_blur_limit': 5, 'use_speckle_noise': False, 'speckle_level': 'medium'}. Best is trial 409 with value: 0.7500143454379812.
[I 2026-03-18 01:03:52,915] Trial 497 pruned. 
[I 2026-03-18 01:13:56,618] Trial 511 pruned. 
