[I 2026-03-17 22:47:49,719] Using an existing study with name 'yoloe_hparam_search_v5' instead of creating a new one.
/fs01/home/dhaneshr/code/obj-det-test/.venv/lib/python3.12/site-packages/albumentations/core/validation.py:114: UserWarning: ShiftScaleRotate is a special case of Affine transform. Please use Affine transform instead.
  original_init(self, **validated_kwargs)
[I 2026-03-17 22:59:59,425] Trial 226 pruned. 
[I 2026-03-17 23:04:15,868] Trial 262 finished with value: 0.5940594059405944 and parameters: {'learning_rate': 0.0007140771797619988, 'weight_decay': 0.0008482675360027443, 'mosaic_prob': 0.6500863501275913, 'label_smooth': 0.08251291105758908, 'copy_paste_p': 0.2539552189327706, 'slice_stride': 7, 'batch_size': 8, 'use_clahe': True, 'use_shift_scale_rotate': True, 'use_brightness_contrast': False, 'use_median_blur': True, 'median_blur_limit': 7, 'use_speckle_noise': False, 'speckle_level': 'medium'}. Best is trial 123 with value: 0.7353625013713276.
[I 2026-03-17 23:08:29,147] Trial 276 finished with value: 0.5346534653465349 and parameters: {'learning_rate': 0.0009639959128804647, 'weight_decay': 0.0046935282691797624, 'mosaic_prob': 0.5705760960317714, 'label_smooth': 0.09530401890090336, 'copy_paste_p': 0.3172883762553539, 'slice_stride': 7, 'batch_size': 8, 'use_clahe': True, 'use_shift_scale_rotate': True, 'use_brightness_contrast': False, 'use_median_blur': True, 'median_blur_limit': 7, 'use_speckle_noise': False, 'speckle_level': 'medium'}. Best is trial 123 with value: 0.7353625013713276.
[I 2026-03-17 23:13:10,093] Trial 286 pruned. 
[I 2026-03-17 23:28:32,367] Trial 299 finished with value: 0.6615897909857038 and parameters: {'learning_rate': 0.0003358513768892251, 'weight_decay': 0.0005463349564234389, 'mosaic_prob': 0.7081452396099797, 'label_smooth': 0.07823911680251644, 'copy_paste_p': 0.5029919432181242, 'slice_stride': 10, 'batch_size': 16, 'use_clahe': True, 'use_shift_scale_rotate': True, 'use_brightness_contrast': False, 'use_median_blur': True, 'median_blur_limit': 5, 'use_speckle_noise': False, 'speckle_level': 'light'}. Best is trial 123 with value: 0.7353625013713276.
[I 2026-03-17 23:33:53,160] Trial 328 finished with value: 0.5544554455445547 and parameters: {'learning_rate': 0.0012067293868449787, 'weight_decay': 0.0020924064291480905, 'mosaic_prob': 0.6899762818939056, 'label_smooth': 0.06903755570585586, 'copy_paste_p': 0.42239628269144897, 'slice_stride': 5, 'batch_size': 16, 'use_clahe': False, 'use_shift_scale_rotate': False, 'use_brightness_contrast': False, 'use_median_blur': False, 'median_blur_limit': 5, 'use_speckle_noise': False, 'speckle_level': 'medium'}. Best is trial 123 with value: 0.7353625013713276.
[I 2026-03-17 23:44:33,681] Trial 340 finished with value: 0.6543269319797357 and parameters: {'learning_rate': 0.0007237870537638114, 'weight_decay': 0.00040415614985802375, 'mosaic_prob': 0.6589282774597809, 'label_smooth': 0.09156058512335906, 'copy_paste_p': 0.2351467423713878, 'slice_stride': 10, 'batch_size': 16, 'use_clahe': True, 'use_shift_scale_rotate': True, 'use_brightness_contrast': False, 'use_median_blur': True, 'median_blur_limit': 5, 'use_speckle_noise': False, 'speckle_level': 'medium'}. Best is trial 123 with value: 0.7353625013713276.
[I 2026-03-18 00:00:27,390] Trial 368 finished with value: 0.6943453820293425 and parameters: {'learning_rate': 0.0009498013173861583, 'weight_decay': 0.0002280406022471839, 'mosaic_prob': 0.3625949208904745, 'label_smooth': 0.08506515781191257, 'copy_paste_p': 0.5588179103471368, 'slice_stride': 10, 'batch_size': 32, 'use_clahe': True, 'use_shift_scale_rotate': True, 'use_brightness_contrast': False, 'use_median_blur': True, 'median_blur_limit': 3, 'use_speckle_noise': False, 'speckle_level': 'heavy'}. Best is trial 123 with value: 0.7353625013713276.
[I 2026-03-18 00:05:36,562] Trial 405 finished with value: 0.40870297029702984 and parameters: {'learning_rate': 0.000836228008655108, 'weight_decay': 0.000243833285379863, 'mosaic_prob': 0.3246269481740557, 'label_smooth': 0.08048127312769329, 'copy_paste_p': 0.36106796882147685, 'slice_stride': 10, 'batch_size': 32, 'use_clahe': False, 'use_shift_scale_rotate': True, 'use_brightness_contrast': True, 'use_median_blur': True, 'median_blur_limit': 3, 'use_speckle_noise': False, 'speckle_level': 'heavy'}. Best is trial 123 with value: 0.7353625013713276.
[I 2026-03-18 00:09:02,954] Trial 421 finished with value: 0.6138613861386142 and parameters: {'learning_rate': 0.00124931531502038, 'weight_decay': 0.0024903289279490743, 'mosaic_prob': 0.3788778716570607, 'label_smooth': 0.11163846724610473, 'copy_paste_p': 0.6121308448681715, 'slice_stride': 10, 'batch_size': 8, 'use_clahe': False, 'use_shift_scale_rotate': True, 'use_brightness_contrast': False, 'use_median_blur': True, 'median_blur_limit': 7, 'use_speckle_noise': False, 'speckle_level': 'heavy'}. Best is trial 123 with value: 0.7353625013713276.
[I 2026-03-18 00:13:16,421] Trial 427 pruned. 
[I 2026-03-18 00:25:49,475] Trial 437 finished with value: 0.6303473629926621 and parameters: {'learning_rate': 0.0007754236289866715, 'weight_decay': 0.011435081453149564, 'mosaic_prob': 0.5226871892619034, 'label_smooth': 0.10404000661360177, 'copy_paste_p': 0.6184425049908331, 'slice_stride': 10, 'batch_size': 16, 'use_clahe': True, 'use_shift_scale_rotate': False, 'use_brightness_contrast': True, 'use_median_blur': False, 'median_blur_limit': 5, 'use_speckle_noise': False, 'speckle_level': 'heavy'}. Best is trial 409 with value: 0.7500143454379812.
[I 2026-03-18 00:39:37,834] Trial 463 finished with value: 0.7106672428412995 and parameters: {'learning_rate': 0.0006845162657202954, 'weight_decay': 0.0006264696641682006, 'mosaic_prob': 0.5169093300049871, 'label_smooth': 0.11771391096108999, 'copy_paste_p': 0.6496229229070243, 'slice_stride': 10, 'batch_size': 8, 'use_clahe': False, 'use_shift_scale_rotate': True, 'use_brightness_contrast': False, 'use_median_blur': True, 'median_blur_limit': 7, 'use_speckle_noise': False, 'speckle_level': 'light'}. Best is trial 409 with value: 0.7500143454379812.
[I 2026-03-18 00:53:29,739] Trial 490 finished with value: 0.6468832829657072 and parameters: {'learning_rate': 0.0005542073874434731, 'weight_decay': 0.0025085276856955515, 'mosaic_prob': 0.6785843895224565, 'label_smooth': 0.12560795689559956, 'copy_paste_p': 0.6658954020812419, 'slice_stride': 5, 'batch_size': 8, 'use_clahe': False, 'use_shift_scale_rotate': True, 'use_brightness_contrast': False, 'use_median_blur': True, 'median_blur_limit': 7, 'use_speckle_noise': False, 'speckle_level': 'light'}. Best is trial 409 with value: 0.7500143454379812.
[I 2026-03-18 01:04:53,681] Trial 507 finished with value: 0.6417000040034997 and parameters: {'learning_rate': 0.0004796784995693778, 'weight_decay': 0.0009779256449503437, 'mosaic_prob': 0.4727262630829761, 'label_smooth': 0.06194580850457069, 'copy_paste_p': 0.49289944444211764, 'slice_stride': 5, 'batch_size': 8, 'use_clahe': False, 'use_shift_scale_rotate': True, 'use_brightness_contrast': False, 'use_median_blur': True, 'median_blur_limit': 7, 'use_speckle_noise': True, 'speckle_level': 'light'}. Best is trial 409 with value: 0.7500143454379812.
