[I 2026-03-19 11:24:34,690] Using an existing study with name 'yoloe_hparam_search_v6' instead of creating a new one.
/fs01/home/dhaneshr/code/obj-det-test/.venv/lib/python3.12/site-packages/albumentations/core/validation.py:114: UserWarning: ShiftScaleRotate is a special case of Affine transform. Please use Affine transform instead.
  original_init(self, **validated_kwargs)
[I 2026-03-19 11:39:47,151] Trial 47 pruned. 
[I 2026-03-19 11:52:34,677] Trial 84 finished with value: 0.6009613167264843 and parameters: {'learning_rate': 0.00180175766225455, 'weight_decay': 0.01149145293996904, 'mosaic_prob': 0.7797780952829836, 'label_smooth': 0.05679407511907177, 'copy_paste_p': 0.20631055894313843, 'slice_stride': 5, 'batch_size': 32, 'use_clahe': False, 'use_shift_scale_rotate': False, 'use_brightness_contrast': True, 'use_median_blur': False, 'median_blur_limit': 3, 'use_speckle_noise': True, 'speckle_level': 'light'}. Best is trial 42 with value: 0.7017763012337562.
[I 2026-03-19 11:59:27,503] Trial 101 finished with value: 0.5214851485148517 and parameters: {'learning_rate': 0.0002809453356193091, 'weight_decay': 0.001339357875046323, 'mosaic_prob': 0.3632645568404053, 'label_smooth': 0.030021781247780613, 'copy_paste_p': 0.5662700357791253, 'slice_stride': 7, 'batch_size': 8, 'use_clahe': False, 'use_shift_scale_rotate': True, 'use_brightness_contrast': True, 'use_median_blur': True, 'median_blur_limit': 7, 'use_speckle_noise': True, 'speckle_level': 'heavy'}. Best is trial 42 with value: 0.7017763012337562.
[I 2026-03-19 12:17:05,735] Trial 118 finished with value: 0.6870399694840582 and parameters: {'learning_rate': 0.0027480270757672984, 'weight_decay': 0.049056243406146026, 'mosaic_prob': 0.4791062057412066, 'label_smooth': 0.1483297289121832, 'copy_paste_p': 0.48912506719608606, 'slice_stride': 5, 'batch_size': 16, 'use_clahe': True, 'use_shift_scale_rotate': True, 'use_brightness_contrast': False, 'use_median_blur': True, 'median_blur_limit': 5, 'use_speckle_noise': False, 'speckle_level': 'light'}. Best is trial 106 with value: 0.7300394720216199.
[I 2026-03-19 12:33:18,370] Trial 159 pruned. 
[I 2026-03-19 12:51:25,458] Trial 194 finished with value: 0.722125667066607 and parameters: {'learning_rate': 0.0003358513768892251, 'weight_decay': 0.00010295998019183456, 'mosaic_prob': 0.5558016124760634, 'label_smooth': 0.01356376435007809, 'copy_paste_p': 0.4958417494284229, 'slice_stride': 7, 'batch_size': 16, 'use_clahe': False, 'use_shift_scale_rotate': True, 'use_brightness_contrast': True, 'use_median_blur': True, 'median_blur_limit': 7, 'use_speckle_noise': True, 'speckle_level': 'heavy'}. Best is trial 166 with value: 0.7379452386507251.
[I 2026-03-19 13:06:41,120] Trial 226 pruned. 
[I 2026-03-19 13:19:31,412] Trial 256 finished with value: 0.6759222145121607 and parameters: {'learning_rate': 0.0003505037399976517, 'weight_decay': 0.000264273996648934, 'mosaic_prob': 0.47600276227482163, 'label_smooth': 0.02107798014917231, 'copy_paste_p': 0.505251514747525, 'slice_stride': 7, 'batch_size': 8, 'use_clahe': True, 'use_shift_scale_rotate': True, 'use_brightness_contrast': False, 'use_median_blur': True, 'median_blur_limit': 7, 'use_speckle_noise': False, 'speckle_level': 'heavy'}. Best is trial 227 with value: 0.745034987552105.
[I 2026-03-19 13:25:10,370] Trial 278 pruned. 
[I 2026-03-19 13:40:43,842] Trial 286 finished with value: 0.6587441917042669 and parameters: {'learning_rate': 0.0004119304196007954, 'weight_decay': 0.0002018230205342941, 'mosaic_prob': 0.4937363053164806, 'label_smooth': 0.049796264111934954, 'copy_paste_p': 0.45503282405716994, 'slice_stride': 5, 'batch_size': 16, 'use_clahe': True, 'use_shift_scale_rotate': True, 'use_brightness_contrast': False, 'use_median_blur': True, 'median_blur_limit': 7, 'use_speckle_noise': False, 'speckle_level': 'heavy'}. Best is trial 227 with value: 0.745034987552105.
[I 2026-03-19 13:56:08,145] Trial 308 finished with value: 0.6987650320624085 and parameters: {'learning_rate': 0.000341286086310444, 'weight_decay': 0.00024733722592156887, 'mosaic_prob': 0.5366898928786095, 'label_smooth': 0.06433183468764567, 'copy_paste_p': 0.6990822918932144, 'slice_stride': 7, 'batch_size': 16, 'use_clahe': False, 'use_shift_scale_rotate': True, 'use_brightness_contrast': True, 'use_median_blur': True, 'median_blur_limit': 5, 'use_speckle_noise': True, 'speckle_level': 'light'}. Best is trial 227 with value: 0.745034987552105.
[I 2026-03-19 14:08:54,253] Trial 326 finished with value: 0.667904676850444 and parameters: {'learning_rate': 0.00033947713375178756, 'weight_decay': 0.00013310918871585776, 'mosaic_prob': 0.3496900028757868, 'label_smooth': 0.06507649961176462, 'copy_paste_p': 0.6927009381712688, 'slice_stride': 7, 'batch_size': 16, 'use_clahe': False, 'use_shift_scale_rotate': True, 'use_brightness_contrast': True, 'use_median_blur': True, 'median_blur_limit': 5, 'use_speckle_noise': True, 'speckle_level': 'light'}. Best is trial 227 with value: 0.745034987552105.
[I 2026-03-19 14:13:42,585] Trial 333 finished with value: 0.4653465346534656 and parameters: {'learning_rate': 0.0003075466785313085, 'weight_decay': 0.00014168550387332935, 'mosaic_prob': 0.549391114681266, 'label_smooth': 0.07124297535805832, 'copy_paste_p': 0.6524210347303476, 'slice_stride': 7, 'batch_size': 8, 'use_clahe': True, 'use_shift_scale_rotate': True, 'use_brightness_contrast': False, 'use_median_blur': True, 'median_blur_limit': 5, 'use_speckle_noise': False, 'speckle_level': 'light'}. Best is trial 227 with value: 0.745034987552105.
[I 2026-03-19 14:17:48,972] Trial 334 finished with value: 0.6930693069306935 and parameters: {'learning_rate': 0.0007181452087855478, 'weight_decay': 0.020323510802109264, 'mosaic_prob': 0.33135794905348226, 'label_smooth': 0.07742507604205696, 'copy_paste_p': 0.5969892213178651, 'slice_stride': 7, 'batch_size': 8, 'use_clahe': True, 'use_shift_scale_rotate': True, 'use_brightness_contrast': False, 'use_median_blur': True, 'median_blur_limit': 5, 'use_speckle_noise': False, 'speckle_level': 'light'}. Best is trial 227 with value: 0.745034987552105.
[I 2026-03-19 14:23:26,194] Trial 337 pruned. 
