[I 2026-03-19 11:24:26,879] Using an existing study with name 'yoloe_hparam_search_v6' instead of creating a new one.
/fs01/home/dhaneshr/code/obj-det-test/.venv/lib/python3.12/site-packages/albumentations/core/validation.py:114: UserWarning: ShiftScaleRotate is a special case of Affine transform. Please use Affine transform instead.
  original_init(self, **validated_kwargs)
[I 2026-03-19 11:31:32,286] Trial 39 finished with value: 0.3571881188118813 and parameters: {'learning_rate': 0.00043284502212938834, 'weight_decay': 0.03680860814877612, 'mosaic_prob': 0.6659969709057025, 'label_smooth': 0.08979877262955549, 'copy_paste_p': 0.27800932022121827, 'slice_stride': 10, 'batch_size': 16, 'use_clahe': True, 'use_shift_scale_rotate': True, 'use_brightness_contrast': False, 'use_median_blur': True, 'median_blur_limit': 5, 'use_speckle_noise': False, 'speckle_level': 'medium'}. Best is trial 46 with value: 0.3726930693069308.
[I 2026-03-19 11:36:30,398] Trial 67 finished with value: 0.3861386138613863 and parameters: {'learning_rate': 0.000747599299995651, 'weight_decay': 0.003971084710792475, 'mosaic_prob': 0.32322520635999885, 'label_smooth': 0.09113172778521575, 'copy_paste_p': 0.2852620618436458, 'slice_stride': 10, 'batch_size': 8, 'use_clahe': True, 'use_shift_scale_rotate': False, 'use_brightness_contrast': False, 'use_median_blur': False, 'median_blur_limit': 7, 'use_speckle_noise': False, 'speckle_level': 'medium'}. Best is trial 63 with value: 0.5742574257425745.
[I 2026-03-19 11:52:48,887] Trial 75 pruned. 
[I 2026-03-19 12:07:46,414] Trial 103 finished with value: 0.7158943703657825 and parameters: {'learning_rate': 0.0002809453356193091, 'weight_decay': 0.001339357875046323, 'mosaic_prob': 0.3632645568404053, 'label_smooth': 0.030021781247780613, 'copy_paste_p': 0.5662700357791253, 'slice_stride': 7, 'batch_size': 8, 'use_clahe': False, 'use_shift_scale_rotate': True, 'use_brightness_contrast': True, 'use_median_blur': True, 'median_blur_limit': 7, 'use_speckle_noise': True, 'speckle_level': 'heavy'}. Best is trial 103 with value: 0.7158943703657825.
[I 2026-03-19 12:13:33,498] Trial 136 finished with value: 0.5831683168316835 and parameters: {'learning_rate': 0.00021091899003095206, 'weight_decay': 0.0017510518580027533, 'mosaic_prob': 0.38877646607739846, 'label_smooth': 0.003121417796204902, 'copy_paste_p': 0.5841355092833255, 'slice_stride': 7, 'batch_size': 8, 'use_clahe': True, 'use_shift_scale_rotate': True, 'use_brightness_contrast': False, 'use_median_blur': True, 'median_blur_limit': 7, 'use_speckle_noise': False, 'speckle_level': 'heavy'}. Best is trial 106 with value: 0.7300394720216199.
[I 2026-03-19 12:28:35,548] Trial 148 pruned. 
[I 2026-03-19 12:40:38,314] Trial 180 finished with value: 0.6632027231680547 and parameters: {'learning_rate': 0.002414156259656928, 'weight_decay': 0.0004147189074655183, 'mosaic_prob': 0.4462570436722873, 'label_smooth': 0.14287224768882104, 'copy_paste_p': 0.49702861872790205, 'slice_stride': 5, 'batch_size': 16, 'use_clahe': True, 'use_shift_scale_rotate': True, 'use_brightness_contrast': False, 'use_median_blur': True, 'median_blur_limit': 5, 'use_speckle_noise': False, 'speckle_level': 'medium'}. Best is trial 166 with value: 0.7379452386507251.
[I 2026-03-19 12:45:29,417] Trial 206 pruned. 
[I 2026-03-19 12:50:26,655] Trial 215 finished with value: 0.4752475247524755 and parameters: {'learning_rate': 0.0004430153379741383, 'weight_decay': 0.0008642587690124893, 'mosaic_prob': 0.48181834966641707, 'label_smooth': 0.1365300343277893, 'copy_paste_p': 0.5125853788401384, 'slice_stride': 7, 'batch_size': 8, 'use_clahe': True, 'use_shift_scale_rotate': True, 'use_brightness_contrast': False, 'use_median_blur': True, 'median_blur_limit': 7, 'use_speckle_noise': False, 'speckle_level': 'heavy'}. Best is trial 166 with value: 0.7379452386507251.
[I 2026-03-19 13:07:01,726] Trial 222 finished with value: 0.7307181596490177 and parameters: {'learning_rate': 0.0004231826823689618, 'weight_decay': 0.00011737297918180591, 'mosaic_prob': 0.5454452465293883, 'label_smooth': 0.04601028200514984, 'copy_paste_p': 0.30065454405608005, 'slice_stride': 7, 'batch_size': 16, 'use_clahe': True, 'use_shift_scale_rotate': True, 'use_brightness_contrast': False, 'use_median_blur': True, 'median_blur_limit': 5, 'use_speckle_noise': False, 'speckle_level': 'heavy'}. Best is trial 166 with value: 0.7379452386507251.
[I 2026-03-19 13:11:45,155] Trial 257 finished with value: 0.4455445544554458 and parameters: {'learning_rate': 0.0005149458694026951, 'weight_decay': 0.000268377698472381, 'mosaic_prob': 0.4705641782741157, 'label_smooth': 0.03281654162118907, 'copy_paste_p': 0.5041514373758372, 'slice_stride': 7, 'batch_size': 8, 'use_clahe': True, 'use_shift_scale_rotate': True, 'use_brightness_contrast': False, 'use_median_blur': True, 'median_blur_limit': 7, 'use_speckle_noise': False, 'speckle_level': 'heavy'}. Best is trial 227 with value: 0.745034987552105.
[I 2026-03-19 13:26:47,019] Trial 264 finished with value: 0.685509308811326 and parameters: {'learning_rate': 0.0003229796308780456, 'weight_decay': 0.0001541110219224517, 'mosaic_prob': 0.5682308397343171, 'label_smooth': 0.021213517398669755, 'copy_paste_p': 0.660836794364424, 'slice_stride': 7, 'batch_size': 16, 'use_clahe': False, 'use_shift_scale_rotate': True, 'use_brightness_contrast': True, 'use_median_blur': True, 'median_blur_limit': 5, 'use_speckle_noise': True, 'speckle_level': 'light'}. Best is trial 227 with value: 0.745034987552105.
[I 2026-03-19 13:44:01,799] Trial 288 finished with value: 0.6802270535934637 and parameters: {'learning_rate': 0.00040588563305249317, 'weight_decay': 0.00020466856598595, 'mosaic_prob': 0.5085114781122788, 'label_smooth': 0.06024398144991331, 'copy_paste_p': 0.6304503628477565, 'slice_stride': 5, 'batch_size': 16, 'use_clahe': True, 'use_shift_scale_rotate': True, 'use_brightness_contrast': False, 'use_median_blur': True, 'median_blur_limit': 5, 'use_speckle_noise': False, 'speckle_level': 'heavy'}. Best is trial 227 with value: 0.745034987552105.
[I 2026-03-19 13:50:36,647] Trial 311 pruned. 
[I 2026-03-19 13:56:00,771] Trial 320 pruned. 
