[I 2026-03-19 11:24:39,590] Using an existing study with name 'yoloe_hparam_search_v6' instead of creating a new one.
/fs01/home/dhaneshr/code/obj-det-test/.venv/lib/python3.12/site-packages/albumentations/core/validation.py:114: UserWarning: ShiftScaleRotate is a special case of Affine transform. Please use Affine transform instead.
  original_init(self, **validated_kwargs)
[I 2026-03-19 11:31:37,354] Trial 55 finished with value: 0.3494356435643565 and parameters: {'learning_rate': 0.00043284502212938834, 'weight_decay': 0.03680860814877612, 'mosaic_prob': 0.6659969709057025, 'label_smooth': 0.08979877262955549, 'copy_paste_p': 0.27800932022121827, 'slice_stride': 10, 'batch_size': 16, 'use_clahe': True, 'use_shift_scale_rotate': True, 'use_brightness_contrast': False, 'use_median_blur': True, 'median_blur_limit': 5, 'use_speckle_noise': False, 'speckle_level': 'medium'}. Best is trial 46 with value: 0.3726930693069308.
[I 2026-03-19 11:38:11,655] Trial 68 finished with value: 0.45544554455445563 and parameters: {'learning_rate': 0.00011799115631112324, 'weight_decay': 0.00016342508621174608, 'mosaic_prob': 0.41501043514750957, 'label_smooth': 0.13984355128676806, 'copy_paste_p': 0.6428281667388993, 'slice_stride': 7, 'batch_size': 8, 'use_clahe': False, 'use_shift_scale_rotate': False, 'use_brightness_contrast': True, 'use_median_blur': False, 'median_blur_limit': 7, 'use_speckle_noise': True, 'speckle_level': 'heavy'}. Best is trial 63 with value: 0.5742574257425745.
[I 2026-03-19 11:54:49,756] Trial 80 pruned. 
[I 2026-03-19 12:08:33,882] Trial 108 finished with value: 0.7100737658472435 and parameters: {'learning_rate': 0.0029335656785567945, 'weight_decay': 0.00020297579526796993, 'mosaic_prob': 0.4668396176391463, 'label_smooth': 0.01613705935710987, 'copy_paste_p': 0.5095839387020463, 'slice_stride': 7, 'batch_size': 16, 'use_clahe': False, 'use_shift_scale_rotate': True, 'use_brightness_contrast': True, 'use_median_blur': True, 'median_blur_limit': 5, 'use_speckle_noise': True, 'speckle_level': 'heavy'}. Best is trial 103 with value: 0.7158943703657825.
[I 2026-03-19 12:14:28,858] Trial 137 finished with value: 0.4485148514851487 and parameters: {'learning_rate': 0.00020475113325588544, 'weight_decay': 0.0022090781357420966, 'mosaic_prob': 0.5472223931930824, 'label_smooth': 0.0022403248387443744, 'copy_paste_p': 0.5876195052581406, 'slice_stride': 7, 'batch_size': 8, 'use_clahe': True, 'use_shift_scale_rotate': True, 'use_brightness_contrast': False, 'use_median_blur': True, 'median_blur_limit': 7, 'use_speckle_noise': False, 'speckle_level': 'heavy'}. Best is trial 106 with value: 0.7300394720216199.
[I 2026-03-19 12:28:49,953] Trial 151 finished with value: 0.6884049256894733 and parameters: {'learning_rate': 0.00036351962672884636, 'weight_decay': 0.00013823486609736518, 'mosaic_prob': 0.5160227083958077, 'label_smooth': 0.018265957382452458, 'copy_paste_p': 0.5458882607696925, 'slice_stride': 7, 'batch_size': 16, 'use_clahe': False, 'use_shift_scale_rotate': True, 'use_brightness_contrast': True, 'use_median_blur': True, 'median_blur_limit': 5, 'use_speckle_noise': True, 'speckle_level': 'heavy'}. Best is trial 106 with value: 0.7300394720216199.
[I 2026-03-19 12:34:50,336] Trial 181 pruned. 
[I 2026-03-19 12:41:53,834] Trial 199 finished with value: 0.42517821782178233 and parameters: {'learning_rate': 0.00032466971407940913, 'weight_decay': 0.00016557167339809886, 'mosaic_prob': 0.5612556545337739, 'label_smooth': 0.012231918258659864, 'copy_paste_p': 0.49739688212980226, 'slice_stride': 7, 'batch_size': 16, 'use_clahe': False, 'use_shift_scale_rotate': True, 'use_brightness_contrast': True, 'use_median_blur': True, 'median_blur_limit': 7, 'use_speckle_noise': True, 'speckle_level': 'heavy'}. Best is trial 166 with value: 0.7379452386507251.
[I 2026-03-19 12:57:15,393] Trial 207 pruned. 
[I 2026-03-19 13:03:33,805] Trial 238 pruned. 
[I 2026-03-19 13:09:29,211] Trial 247 pruned. 
[I 2026-03-19 13:14:34,489] Trial 261 finished with value: 0.3663366336633665 and parameters: {'learning_rate': 0.00026221400917628455, 'weight_decay': 0.0007159634751961668, 'mosaic_prob': 0.5097796925289315, 'label_smooth': 0.10310675850360243, 'copy_paste_p': 0.5085036777593374, 'slice_stride': 7, 'batch_size': 8, 'use_clahe': True, 'use_shift_scale_rotate': True, 'use_brightness_contrast': False, 'use_median_blur': True, 'median_blur_limit': 5, 'use_speckle_noise': False, 'speckle_level': 'heavy'}. Best is trial 227 with value: 0.745034987552105.
[I 2026-03-19 13:28:54,381] Trial 270 finished with value: 0.6706006501500751 and parameters: {'learning_rate': 0.00034920051478023285, 'weight_decay': 0.00014180498206996304, 'mosaic_prob': 0.5673269430446122, 'label_smooth': 0.00012757252684697518, 'copy_paste_p': 0.5186016422562951, 'slice_stride': 7, 'batch_size': 16, 'use_clahe': False, 'use_shift_scale_rotate': True, 'use_brightness_contrast': True, 'use_median_blur': True, 'median_blur_limit': 5, 'use_speckle_noise': True, 'speckle_level': 'light'}. Best is trial 227 with value: 0.745034987552105.
[I 2026-03-19 13:36:09,181] Trial 292 pruned. 
[I 2026-03-19 13:52:10,609] Trial 305 finished with value: 0.6815591503747256 and parameters: {'learning_rate': 0.0003778508329673322, 'weight_decay': 0.00017441303512898633, 'mosaic_prob': 0.5539264728880189, 'label_smooth': 0.05763873658192469, 'copy_paste_p': 0.68426527348222, 'slice_stride': 7, 'batch_size': 16, 'use_clahe': False, 'use_shift_scale_rotate': True, 'use_brightness_contrast': True, 'use_median_blur': True, 'median_blur_limit': 5, 'use_speckle_noise': True, 'speckle_level': 'light'}. Best is trial 227 with value: 0.745034987552105.
