[I 2026-03-17 22:47:48,395] Using an existing study with name 'yoloe_hparam_search_v5' instead of creating a new one.
/fs01/home/dhaneshr/code/obj-det-test/.venv/lib/python3.12/site-packages/albumentations/core/validation.py:114: UserWarning: ShiftScaleRotate is a special case of Affine transform. Please use Affine transform instead.
  original_init(self, **validated_kwargs)
[I 2026-03-17 22:52:20,095] Trial 223 pruned. 
[I 2026-03-17 22:57:40,984] Trial 242 finished with value: 0.36326732673267337 and parameters: {'learning_rate': 0.0005754532739793587, 'weight_decay': 0.000670096232931248, 'mosaic_prob': 0.5088198522671866, 'label_smooth': 0.10937176295859277, 'copy_paste_p': 0.4891093842248419, 'slice_stride': 10, 'batch_size': 16, 'use_clahe': True, 'use_shift_scale_rotate': True, 'use_brightness_contrast': False, 'use_median_blur': True, 'median_blur_limit': 5, 'use_speckle_noise': False, 'speckle_level': 'light'}. Best is trial 123 with value: 0.7353625013713276.
[I 2026-03-17 23:10:31,598] Trial 256 pruned. 
[I 2026-03-17 23:15:18,299] Trial 290 pruned. 
[I 2026-03-17 23:29:47,235] Trial 302 finished with value: 0.6639194635108535 and parameters: {'learning_rate': 0.0006105883691123067, 'weight_decay': 0.000556020686490783, 'mosaic_prob': 0.7077895370784832, 'label_smooth': 0.0861144475989366, 'copy_paste_p': 0.2781036049808327, 'slice_stride': 10, 'batch_size': 16, 'use_clahe': True, 'use_shift_scale_rotate': True, 'use_brightness_contrast': False, 'use_median_blur': True, 'median_blur_limit': 5, 'use_speckle_noise': False, 'speckle_level': 'light'}. Best is trial 123 with value: 0.7353625013713276.
[I 2026-03-17 23:39:23,656] Trial 332 finished with value: 0.5705605133267329 and parameters: {'learning_rate': 0.0011847102832177327, 'weight_decay': 0.046250277036719946, 'mosaic_prob': 0.7435281738508688, 'label_smooth': 0.08070674909458857, 'copy_paste_p': 0.2784408855254236, 'slice_stride': 5, 'batch_size': 16, 'use_clahe': False, 'use_shift_scale_rotate': False, 'use_brightness_contrast': False, 'use_median_blur': False, 'median_blur_limit': 5, 'use_speckle_noise': False, 'speckle_level': 'light'}. Best is trial 123 with value: 0.7353625013713276.
[I 2026-03-17 23:43:38,304] Trial 353 pruned. 
[I 2026-03-17 23:57:07,831] Trial 363 finished with value: 0.6984004889681571 and parameters: {'learning_rate': 0.0007346641295388874, 'weight_decay': 0.0002280406022471839, 'mosaic_prob': 0.3625949208904745, 'label_smooth': 0.08442280804169207, 'copy_paste_p': 0.5588179103471368, 'slice_stride': 10, 'batch_size': 16, 'use_clahe': True, 'use_shift_scale_rotate': True, 'use_brightness_contrast': False, 'use_median_blur': True, 'median_blur_limit': 5, 'use_speckle_noise': False, 'speckle_level': 'heavy'}. Best is trial 123 with value: 0.7353625013713276.
[I 2026-03-18 00:10:58,070] Trial 399 finished with value: 0.7131667663750331 and parameters: {'learning_rate': 0.000836228008655108, 'weight_decay': 0.000243833285379863, 'mosaic_prob': 0.5226736312622389, 'label_smooth': 0.08301888341571365, 'copy_paste_p': 0.36106796882147685, 'slice_stride': 10, 'batch_size': 16, 'use_clahe': True, 'use_shift_scale_rotate': True, 'use_brightness_contrast': True, 'use_median_blur': True, 'median_blur_limit': 5, 'use_speckle_noise': False, 'speckle_level': 'heavy'}. Best is trial 123 with value: 0.7353625013713276.
[I 2026-03-18 00:15:37,225] Trial 432 pruned. 
[I 2026-03-18 00:27:48,614] Trial 445 pruned. 
[I 2026-03-18 00:31:47,735] Trial 469 finished with value: 0.42574257425742595 and parameters: {'learning_rate': 0.0006769724392601272, 'weight_decay': 0.0007456156273579257, 'mosaic_prob': 0.33977672974729567, 'label_smooth': 0.07904626742491348, 'copy_paste_p': 0.5918889666968867, 'slice_stride': 10, 'batch_size': 8, 'use_clahe': False, 'use_shift_scale_rotate': True, 'use_brightness_contrast': False, 'use_median_blur': True, 'median_blur_limit': 7, 'use_speckle_noise': False, 'speckle_level': 'light'}. Best is trial 409 with value: 0.7500143454379812.
[I 2026-03-18 00:36:03,247] Trial 476 pruned. 
[I 2026-03-18 00:50:48,033] Trial 483 finished with value: 0.6708313562127419 and parameters: {'learning_rate': 0.0005542073874434731, 'weight_decay': 0.0014477349213884954, 'mosaic_prob': 0.6785843895224565, 'label_smooth': 0.08255305085949796, 'copy_paste_p': 0.4003839952141304, 'slice_stride': 5, 'batch_size': 8, 'use_clahe': False, 'use_shift_scale_rotate': True, 'use_brightness_contrast': False, 'use_median_blur': True, 'median_blur_limit': 7, 'use_speckle_noise': False, 'speckle_level': 'light'}. Best is trial 409 with value: 0.7500143454379812.
[I 2026-03-18 00:55:39,296] Trial 500 finished with value: 0.6138613861386142 and parameters: {'learning_rate': 0.0005274371782364522, 'weight_decay': 0.0009779256449503437, 'mosaic_prob': 0.4727262630829761, 'label_smooth': 0.06194580850457069, 'copy_paste_p': 0.49289944444211764, 'slice_stride': 5, 'batch_size': 8, 'use_clahe': False, 'use_shift_scale_rotate': True, 'use_brightness_contrast': False, 'use_median_blur': True, 'median_blur_limit': 7, 'use_speckle_noise': True, 'speckle_level': 'light'}. Best is trial 409 with value: 0.7500143454379812.
