/cm/local/apps/slurm/var/spool/job00732/slurm_script: /cvmfs/soft.computecanada.ca/custom/software/lmod/lmod/init/bash: Too many levels of symbolic links
[I 2026-03-17 10:46:51,815] Using an existing study with name 'yoloe_hparam_search_v3' instead of creating a new one.
/fs01/home/dhaneshr/code/obj-det-test/.venv/lib/python3.12/site-packages/albumentations/core/validation.py:114: UserWarning: ShiftScaleRotate is a special case of Affine transform. Please use Affine transform instead.
  original_init(self, **validated_kwargs)
[I 2026-03-17 11:10:39,111] Trial 18 finished with value: 0.5471373796463013 and parameters: {'learning_rate': 0.00043284502212938834, 'weight_decay': 0.007969454818643935, 'slice_stride': 5, 'batch_size': 32, 'mosaic_prob': 0.34044600469728353, 'label_smooth': 0.10621088666940683, 'use_clahe': False, 'use_shift_scale_rotate': True, 'use_brightness_contrast': False, 'use_median_blur': False, 'median_blur_limit': 7, 'use_speckle_noise': False, 'speckle_level': 'heavy', 'copy_paste_p': 0.1397716475108518}. Best is trial 8 with value: 0.6186953783035278.
[I 2026-03-17 11:15:14,723] Trial 31 pruned. 
[I 2026-03-17 11:18:44,369] Trial 46 pruned. 
[I 2026-03-17 11:41:15,588] Trial 62 finished with value: 0.4667541980743408 and parameters: {'learning_rate': 0.0003028409833967168, 'weight_decay': 0.0055069785358703134, 'slice_stride': 5, 'batch_size': 16, 'mosaic_prob': 0.37632304425022917, 'label_smooth': 0.11842578820561575, 'use_clahe': False, 'use_shift_scale_rotate': True, 'use_brightness_contrast': False, 'use_median_blur': False, 'median_blur_limit': 7, 'use_speckle_noise': False, 'speckle_level': 'heavy', 'copy_paste_p': 0.20256976761272966}. Best is trial 8 with value: 0.6186953783035278.
[I 2026-03-17 12:04:44,250] Trial 107 finished with value: 0.5189348459243774 and parameters: {'learning_rate': 0.0028118872210255064, 'weight_decay': 0.004365412605779657, 'slice_stride': 5, 'batch_size': 32, 'mosaic_prob': 0.33678035699250575, 'label_smooth': 0.07314579172917635, 'use_clahe': False, 'use_shift_scale_rotate': True, 'use_brightness_contrast': False, 'use_median_blur': False, 'median_blur_limit': 7, 'use_speckle_noise': False, 'speckle_level': 'light', 'copy_paste_p': 0.1242447964362317}. Best is trial 8 with value: 0.6186953783035278.
[I 2026-03-17 12:10:23,179] Trial 144 pruned. 
[I 2026-03-17 12:16:12,282] Trial 155 pruned. 
[I 2026-03-17 12:31:40,627] Trial 169 pruned. 
[I 2026-03-17 12:37:11,547] Trial 206 pruned. 
[I 2026-03-17 12:42:32,391] Trial 211 pruned. 
[I 2026-03-17 12:48:20,942] Trial 217 pruned. 
[I 2026-03-17 12:53:56,050] Trial 229 pruned. 
[I 2026-03-17 13:15:42,675] Trial 240 finished with value: 0.5171569585800171 and parameters: {'learning_rate': 0.0009534202548454592, 'weight_decay': 0.00012030680008086224, 'slice_stride': 5, 'batch_size': 16, 'mosaic_prob': 0.3701343860637896, 'label_smooth': 0.10621627632776266, 'use_clahe': False, 'use_shift_scale_rotate': True, 'use_brightness_contrast': False, 'use_median_blur': False, 'median_blur_limit': 7, 'use_speckle_noise': False, 'speckle_level': 'heavy', 'copy_paste_p': 0.12185856834490755}. Best is trial 8 with value: 0.6186953783035278.
[I 2026-03-17 13:37:27,463] Trial 255 finished with value: 0.5653731822967529 and parameters: {'learning_rate': 0.000979241645768424, 'weight_decay': 0.00016773979057417378, 'slice_stride': 5, 'batch_size': 8, 'mosaic_prob': 0.25005735837217835, 'label_smooth': 0.0943561631431126, 'use_clahe': False, 'use_shift_scale_rotate': True, 'use_brightness_contrast': False, 'use_median_blur': False, 'median_blur_limit': 7, 'use_speckle_noise': False, 'speckle_level': 'heavy', 'copy_paste_p': 0.33367799493323197}. Best is trial 8 with value: 0.6186953783035278.
[I 2026-03-17 13:43:09,790] Trial 272 pruned. 
