/cm/local/apps/slurm/var/spool/job00746/slurm_script: /cvmfs/soft.computecanada.ca/custom/software/lmod/lmod/init/bash: Too many levels of symbolic links
[I 2026-03-17 10:46:46,043] Using an existing study with name 'yoloe_hparam_search_v3' instead of creating a new one.
/fs01/home/dhaneshr/code/obj-det-test/.venv/lib/python3.12/site-packages/albumentations/core/validation.py:114: UserWarning: ShiftScaleRotate is a special case of Affine transform. Please use Affine transform instead.
  original_init(self, **validated_kwargs)
[I 2026-03-17 11:10:47,789] Trial 12 finished with value: 0.4751577377319336 and parameters: {'learning_rate': 0.00043284502212938834, 'weight_decay': 0.007969454818643935, 'slice_stride': 5, 'batch_size': 32, 'mosaic_prob': 0.34044600469728353, 'label_smooth': 0.10621088666940683, 'use_clahe': False, 'use_shift_scale_rotate': True, 'use_brightness_contrast': False, 'use_median_blur': False, 'median_blur_limit': 7, 'use_speckle_noise': False, 'speckle_level': 'heavy', 'copy_paste_p': 0.1397716475108518}. Best is trial 8 with value: 0.6186953783035278.
[I 2026-03-17 11:15:33,662] Trial 34 pruned. 
[I 2026-03-17 11:23:14,495] Trial 54 pruned. 
[I 2026-03-17 11:29:06,691] Trial 71 pruned. 
[I 2026-03-17 11:35:50,732] Trial 83 pruned. 
[I 2026-03-17 11:43:29,872] Trial 93 pruned. 
[I 2026-03-17 12:07:03,767] Trial 113 finished with value: 0.5239565372467041 and parameters: {'learning_rate': 0.0003726596474919011, 'weight_decay': 0.008339137056129731, 'slice_stride': 5, 'batch_size': 32, 'mosaic_prob': 0.27412267030772947, 'label_smooth': 0.10515032088861286, 'use_clahe': False, 'use_shift_scale_rotate': True, 'use_brightness_contrast': False, 'use_median_blur': False, 'median_blur_limit': 5, 'use_speckle_noise': False, 'speckle_level': 'light', 'copy_paste_p': 0.12453192751290065}. Best is trial 8 with value: 0.6186953783035278.
[I 2026-03-17 12:13:56,920] Trial 151 pruned. 
[I 2026-03-17 12:19:18,975] Trial 163 pruned. 
[I 2026-03-17 12:39:08,972] Trial 175 finished with value: 0.45925021171569824 and parameters: {'learning_rate': 0.00041966748970534906, 'weight_decay': 0.00902418842986394, 'slice_stride': 5, 'batch_size': 16, 'mosaic_prob': 0.2665084722104232, 'label_smooth': 0.026445137527933295, 'use_clahe': False, 'use_shift_scale_rotate': False, 'use_brightness_contrast': False, 'use_median_blur': False, 'median_blur_limit': 7, 'use_speckle_noise': False, 'speckle_level': 'heavy', 'copy_paste_p': 0.11152508892818568}. Best is trial 8 with value: 0.6186953783035278.
[I 2026-03-17 12:44:35,150] Trial 214 pruned. 
[I 2026-03-17 12:54:30,531] Trial 222 pruned. 
[I 2026-03-17 13:17:05,027] Trial 243 finished with value: 0.5473810434341431 and parameters: {'learning_rate': 0.0009534202548454592, 'weight_decay': 0.00012030680008086224, 'slice_stride': 5, 'batch_size': 16, 'mosaic_prob': 0.370830527953248, 'label_smooth': 0.10621627632776266, 'use_clahe': False, 'use_shift_scale_rotate': True, 'use_brightness_contrast': False, 'use_median_blur': False, 'median_blur_limit': 7, 'use_speckle_noise': False, 'speckle_level': 'heavy', 'copy_paste_p': 0.12185856834490755}. Best is trial 8 with value: 0.6186953783035278.
[I 2026-03-17 13:33:52,151] Trial 260 finished with value: 0.5272535681724548 and parameters: {'learning_rate': 0.0010023356224887064, 'weight_decay': 0.000179043721288578, 'slice_stride': 5, 'batch_size': 16, 'mosaic_prob': 0.3586776899505561, 'label_smooth': 0.09472827631418136, 'use_clahe': False, 'use_shift_scale_rotate': True, 'use_brightness_contrast': False, 'use_median_blur': False, 'median_blur_limit': 7, 'use_speckle_noise': False, 'speckle_level': 'heavy', 'copy_paste_p': 0.12511604940576396}. Best is trial 8 with value: 0.6186953783035278.
[I 2026-03-17 13:52:56,927] Trial 269 finished with value: 0.5298212766647339 and parameters: {'learning_rate': 0.0010384877248963713, 'weight_decay': 0.00011984971527575328, 'slice_stride': 5, 'batch_size': 16, 'mosaic_prob': 0.2405130846313055, 'label_smooth': 0.09283982367348824, 'use_clahe': False, 'use_shift_scale_rotate': True, 'use_brightness_contrast': False, 'use_median_blur': False, 'median_blur_limit': 7, 'use_speckle_noise': False, 'speckle_level': 'heavy', 'copy_paste_p': 0.10237143876597854}. Best is trial 8 with value: 0.6186953783035278.
