[I 2026-03-19 11:24:28,498] Using an existing study with name 'yoloe_hparam_search_v6' instead of creating a new one.
/fs01/home/dhaneshr/code/obj-det-test/.venv/lib/python3.12/site-packages/albumentations/core/validation.py:114: UserWarning: ShiftScaleRotate is a special case of Affine transform. Please use Affine transform instead.
  original_init(self, **validated_kwargs)
[I 2026-03-19 11:39:31,170] Trial 42 finished with value: 0.7017763012337562 and parameters: {'learning_rate': 0.00043284502212938834, 'weight_decay': 0.03680860814877612, 'mosaic_prob': 0.6659969709057025, 'label_smooth': 0.08979877262955549, 'copy_paste_p': 0.27800932022121827, 'slice_stride': 10, 'batch_size': 16, 'use_clahe': True, 'use_shift_scale_rotate': True, 'use_brightness_contrast': False, 'use_median_blur': True, 'median_blur_limit': 5, 'use_speckle_noise': False, 'speckle_level': 'medium'}. Best is trial 42 with value: 0.7017763012337562.
[I 2026-03-19 11:56:39,736] Trial 82 pruned. 
[I 2026-03-19 12:01:57,738] Trial 113 pruned. 
[I 2026-03-19 12:13:20,692] Trial 124 pruned. 
[I 2026-03-19 12:22:34,997] Trial 147 finished with value: 0.47542475247524774 and parameters: {'learning_rate': 0.00020475113325588544, 'weight_decay': 0.0002184786174725122, 'mosaic_prob': 0.5304453570550351, 'label_smooth': 0.020033215990516884, 'copy_paste_p': 0.5627583207033477, 'slice_stride': 7, 'batch_size': 16, 'use_clahe': True, 'use_shift_scale_rotate': True, 'use_brightness_contrast': False, 'use_median_blur': True, 'median_blur_limit': 5, 'use_speckle_noise': False, 'speckle_level': 'heavy'}. Best is trial 106 with value: 0.7300394720216199.
[I 2026-03-19 12:28:11,537] Trial 171 finished with value: 0.36752475247524763 and parameters: {'learning_rate': 0.0004839811469849495, 'weight_decay': 0.0003861553223070895, 'mosaic_prob': 0.33924585912619476, 'label_smooth': 0.04163664063663279, 'copy_paste_p': 0.4706968742164737, 'slice_stride': 7, 'batch_size': 16, 'use_clahe': True, 'use_shift_scale_rotate': True, 'use_brightness_contrast': False, 'use_median_blur': True, 'median_blur_limit': 5, 'use_speckle_noise': False, 'speckle_level': 'heavy'}. Best is trial 106 with value: 0.7300394720216199.
[I 2026-03-19 12:34:43,570] Trial 179 pruned. 
[I 2026-03-19 12:52:39,131] Trial 197 finished with value: 0.7145722009210594 and parameters: {'learning_rate': 0.00032466971407940913, 'weight_decay': 0.00016606587942532219, 'mosaic_prob': 0.5859019370310917, 'label_smooth': 0.028274603609548612, 'copy_paste_p': 0.49663519107940274, 'slice_stride': 7, 'batch_size': 16, 'use_clahe': True, 'use_shift_scale_rotate': True, 'use_brightness_contrast': False, 'use_median_blur': True, 'median_blur_limit': 5, 'use_speckle_noise': False, 'speckle_level': 'heavy'}. Best is trial 166 with value: 0.7379452386507251.
[I 2026-03-19 13:07:51,953] Trial 232 pruned. 
[I 2026-03-19 13:12:28,938] Trial 258 finished with value: 0.5346534653465349 and parameters: {'learning_rate': 0.0005149458694026951, 'weight_decay': 0.000268377698472381, 'mosaic_prob': 0.4705641782741157, 'label_smooth': 0.03281654162118907, 'copy_paste_p': 0.5041514373758372, 'slice_stride': 7, 'batch_size': 8, 'use_clahe': True, 'use_shift_scale_rotate': True, 'use_brightness_contrast': False, 'use_median_blur': True, 'median_blur_limit': 7, 'use_speckle_noise': False, 'speckle_level': 'heavy'}. Best is trial 227 with value: 0.745034987552105.
[I 2026-03-19 13:32:31,682] Trial 266 finished with value: 0.7005487597751408 and parameters: {'learning_rate': 0.0003229796308780456, 'weight_decay': 0.0001541110219224517, 'mosaic_prob': 0.5682308397343171, 'label_smooth': 0.021213517398669755, 'copy_paste_p': 0.660836794364424, 'slice_stride': 7, 'batch_size': 16, 'use_clahe': False, 'use_shift_scale_rotate': True, 'use_brightness_contrast': True, 'use_median_blur': True, 'median_blur_limit': 5, 'use_speckle_noise': True, 'speckle_level': 'light'}. Best is trial 227 with value: 0.745034987552105.
[I 2026-03-19 13:45:31,591] Trial 298 finished with value: 0.6572054234425081 and parameters: {'learning_rate': 0.00040633002744507214, 'weight_decay': 0.00017231311963984868, 'mosaic_prob': 0.5571717625714814, 'label_smooth': 0.04935061587843526, 'copy_paste_p': 0.6817425437989063, 'slice_stride': 7, 'batch_size': 16, 'use_clahe': False, 'use_shift_scale_rotate': True, 'use_brightness_contrast': True, 'use_median_blur': True, 'median_blur_limit': 5, 'use_speckle_noise': True, 'speckle_level': 'light'}. Best is trial 227 with value: 0.745034987552105.
[I 2026-03-19 14:01:58,305] Trial 313 finished with value: 0.692706566652133 and parameters: {'learning_rate': 0.00027781479666621735, 'weight_decay': 0.0002459347285823376, 'mosaic_prob': 0.31556404554348017, 'label_smooth': 0.03440164144670197, 'copy_paste_p': 0.6954796533745101, 'slice_stride': 7, 'batch_size': 16, 'use_clahe': False, 'use_shift_scale_rotate': True, 'use_brightness_contrast': True, 'use_median_blur': True, 'median_blur_limit': 5, 'use_speckle_noise': True, 'speckle_level': 'light'}. Best is trial 227 with value: 0.745034987552105.
[I 2026-03-19 14:15:39,119] Trial 328 pruned. 
[I 2026-03-19 14:20:58,449] Trial 335 finished with value: 0.6138613861386142 and parameters: {'learning_rate': 0.0005015416582628023, 'weight_decay': 0.00011052038658543003, 'mosaic_prob': 0.3309367586995968, 'label_smooth': 0.07702736600199375, 'copy_paste_p': 0.6446492324414905, 'slice_stride': 7, 'batch_size': 8, 'use_clahe': True, 'use_shift_scale_rotate': True, 'use_brightness_contrast': False, 'use_median_blur': True, 'median_blur_limit': 5, 'use_speckle_noise': False, 'speckle_level': 'light'}. Best is trial 227 with value: 0.745034987552105.
