[I 2026-03-17 22:47:56,611] Using an existing study with name 'yoloe_hparam_search_v5' instead of creating a new one.
/fs01/home/dhaneshr/code/obj-det-test/.venv/lib/python3.12/site-packages/albumentations/core/validation.py:114: UserWarning: ShiftScaleRotate is a special case of Affine transform. Please use Affine transform instead.
  original_init(self, **validated_kwargs)
[I 2026-03-17 22:52:28,300] Trial 232 pruned. 
[I 2026-03-17 23:06:41,164] Trial 245 finished with value: 0.7118243542394393 and parameters: {'learning_rate': 0.0005754532739793587, 'weight_decay': 0.000670096232931248, 'mosaic_prob': 0.5088198522671866, 'label_smooth': 0.10937176295859277, 'copy_paste_p': 0.4891093842248419, 'slice_stride': 10, 'batch_size': 16, 'use_clahe': True, 'use_shift_scale_rotate': True, 'use_brightness_contrast': False, 'use_median_blur': True, 'median_blur_limit': 5, 'use_speckle_noise': False, 'speckle_level': 'light'}. Best is trial 123 with value: 0.7353625013713276.
[I 2026-03-17 23:18:29,619] Trial 282 pruned. 
[I 2026-03-17 23:22:44,345] Trial 312 pruned. 
[I 2026-03-17 23:35:08,388] Trial 319 finished with value: 0.6161545455617006 and parameters: {'learning_rate': 0.0012153072205959975, 'weight_decay': 0.04928337965435811, 'mosaic_prob': 0.6868548139125826, 'label_smooth': 0.07086976823839979, 'copy_paste_p': 0.2745887300635748, 'slice_stride': 5, 'batch_size': 16, 'use_clahe': False, 'use_shift_scale_rotate': False, 'use_brightness_contrast': False, 'use_median_blur': False, 'median_blur_limit': 5, 'use_speckle_noise': False, 'speckle_level': 'medium'}. Best is trial 123 with value: 0.7353625013713276.
[I 2026-03-17 23:50:41,253] Trial 341 finished with value: 0.6173889546441592 and parameters: {'learning_rate': 0.0006749739038548574, 'weight_decay': 0.00040041727320449535, 'mosaic_prob': 0.6568552583153143, 'label_smooth': 0.08529991354394245, 'copy_paste_p': 0.23678865057831028, 'slice_stride': 5, 'batch_size': 16, 'use_clahe': True, 'use_shift_scale_rotate': False, 'use_brightness_contrast': False, 'use_median_blur': False, 'median_blur_limit': 5, 'use_speckle_noise': False, 'speckle_level': 'light'}. Best is trial 123 with value: 0.7353625013713276.
[I 2026-03-18 00:03:48,525] Trial 383 finished with value: 0.6948982956959686 and parameters: {'learning_rate': 0.0012673167963529275, 'weight_decay': 0.00034705511435449184, 'mosaic_prob': 0.37239046571247936, 'label_smooth': 0.09468445031081635, 'copy_paste_p': 0.587688616060044, 'slice_stride': 10, 'batch_size': 16, 'use_clahe': True, 'use_shift_scale_rotate': True, 'use_brightness_contrast': False, 'use_median_blur': True, 'median_blur_limit': 5, 'use_speckle_noise': False, 'speckle_level': 'light'}. Best is trial 123 with value: 0.7353625013713276.
[I 2026-03-18 00:15:39,168] Trial 416 finished with value: 0.6817866709388051 and parameters: {'learning_rate': 0.0011943856830069145, 'weight_decay': 0.00014607365958170662, 'mosaic_prob': 0.38163912791452154, 'label_smooth': 0.0935660434992008, 'copy_paste_p': 0.5998262464903376, 'slice_stride': 10, 'batch_size': 16, 'use_clahe': False, 'use_shift_scale_rotate': True, 'use_brightness_contrast': False, 'use_median_blur': True, 'median_blur_limit': 5, 'use_speckle_noise': True, 'speckle_level': 'heavy'}. Best is trial 409 with value: 0.7500143454379812.
[I 2026-03-18 00:27:04,062] Trial 446 finished with value: 0.6286154973734938 and parameters: {'learning_rate': 0.0009549976856052807, 'weight_decay': 0.004778385080386128, 'mosaic_prob': 0.524693548292506, 'label_smooth': 0.07430803717520919, 'copy_paste_p': 0.38263597682153505, 'slice_stride': 10, 'batch_size': 16, 'use_clahe': False, 'use_shift_scale_rotate': False, 'use_brightness_contrast': True, 'use_median_blur': False, 'median_blur_limit': 3, 'use_speckle_noise': False, 'speckle_level': 'heavy'}. Best is trial 409 with value: 0.7500143454379812.
[I 2026-03-18 00:38:49,368] Trial 467 pruned. 
[I 2026-03-18 00:54:21,129] Trial 487 pruned. 
[I 2026-03-18 01:05:25,091] Trial 508 finished with value: 0.6612069106184972 and parameters: {'learning_rate': 0.0017102044300724712, 'weight_decay': 0.0009252923513900529, 'mosaic_prob': 0.4689652739661252, 'label_smooth': 0.06429810439423941, 'copy_paste_p': 0.6948927746225634, 'slice_stride': 5, 'batch_size': 8, 'use_clahe': False, 'use_shift_scale_rotate': True, 'use_brightness_contrast': False, 'use_median_blur': True, 'median_blur_limit': 7, 'use_speckle_noise': True, 'speckle_level': 'light'}. Best is trial 409 with value: 0.7500143454379812.
[I 2026-03-18 01:09:10,635] Trial 513 pruned. 
[I 2026-03-18 01:13:51,876] Trial 516 finished with value: 0.6435643564356439 and parameters: {'learning_rate': 0.000599655489932226, 'weight_decay': 0.0018887538483074989, 'mosaic_prob': 0.5075229706221916, 'label_smooth': 0.06797126629901783, 'copy_paste_p': 0.6838679986662439, 'slice_stride': 5, 'batch_size': 8, 'use_clahe': False, 'use_shift_scale_rotate': True, 'use_brightness_contrast': False, 'use_median_blur': True, 'median_blur_limit': 7, 'use_speckle_noise': False, 'speckle_level': 'light'}. Best is trial 409 with value: 0.7500143454379812.
[I 2026-03-18 01:27:01,800] Trial 517 finished with value: 0.6814916767631941 and parameters: {'learning_rate': 0.0006356251076242764, 'weight_decay': 0.0011780377407394948, 'mosaic_prob': 0.4533122618439743, 'label_smooth': 0.06649851390937625, 'copy_paste_p': 0.6851315695190057, 'slice_stride': 5, 'batch_size': 8, 'use_clahe': False, 'use_shift_scale_rotate': True, 'use_brightness_contrast': False, 'use_median_blur': True, 'median_blur_limit': 7, 'use_speckle_noise': False, 'speckle_level': 'light'}. Best is trial 409 with value: 0.7500143454379812.
