[I 2026-03-17 14:39:39,739] Using an existing study with name 'yoloe_hparam_search_v4' instead of creating a new one.
/fs01/home/dhaneshr/code/obj-det-test/.venv/lib/python3.12/site-packages/albumentations/core/validation.py:114: UserWarning: ShiftScaleRotate is a special case of Affine transform. Please use Affine transform instead.
  original_init(self, **validated_kwargs)
[I 2026-03-17 14:57:06,785] Trial 4 finished with value: 0.6800112895204958 and parameters: {'learning_rate': 0.00043284502212938834, 'weight_decay': 0.007969454818643935, 'mosaic_prob': 0.39279757672456206, 'label_smooth': 0.08979877262955549, 'copy_paste_p': 0.10921304830970556, 'slice_stride': 10, 'batch_size': 16, 'use_clahe': True, 'use_shift_scale_rotate': True, 'use_brightness_contrast': False, 'use_median_blur': True, 'median_blur_limit': 5, 'use_speckle_noise': False, 'speckle_level': 'medium'}. Best is trial 4 with value: 0.6800112895204958.
[I 2026-03-17 15:10:25,865] Trial 44 pruned. 
[I 2026-03-17 15:14:24,425] Trial 71 pruned. 
[I 2026-03-17 15:18:04,971] Trial 78 pruned. 
[I 2026-03-17 15:22:32,948] Trial 82 pruned. 
[I 2026-03-17 15:41:33,564] Trial 93 finished with value: 0.680778643712681 and parameters: {'learning_rate': 0.00019697197654925088, 'weight_decay': 0.0019241914457947813, 'mosaic_prob': 0.2751181477176287, 'label_smooth': 0.11396625784560294, 'copy_paste_p': 0.1520421326034505, 'slice_stride': 7, 'batch_size': 16, 'use_clahe': True, 'use_shift_scale_rotate': True, 'use_brightness_contrast': False, 'use_median_blur': True, 'median_blur_limit': 5, 'use_speckle_noise': False, 'speckle_level': 'heavy'}. Best is trial 14 with value: 0.7280141285840982.
[I 2026-03-17 15:45:40,783] Trial 129 pruned. 
[I 2026-03-17 16:00:01,424] Trial 139 finished with value: 0.6762959252257746 and parameters: {'learning_rate': 0.004832259207239238, 'weight_decay': 0.005952155461049609, 'mosaic_prob': 0.24940202992666638, 'label_smooth': 0.10973203966260159, 'copy_paste_p': 0.12746577954566599, 'slice_stride': 10, 'batch_size': 16, 'use_clahe': True, 'use_shift_scale_rotate': True, 'use_brightness_contrast': False, 'use_median_blur': True, 'median_blur_limit': 5, 'use_speckle_noise': False, 'speckle_level': 'medium'}. Best is trial 14 with value: 0.7280141285840982.
[I 2026-03-17 16:03:21,078] Trial 162 pruned. 
[I 2026-03-17 16:06:40,148] Trial 171 pruned. 
[I 2026-03-17 16:16:17,859] Trial 176 pruned. 
[I 2026-03-17 16:21:08,176] Trial 193 pruned. 
[I 2026-03-17 16:37:24,376] Trial 202 finished with value: 0.6986662707433624 and parameters: {'learning_rate': 0.00036840860586288815, 'weight_decay': 0.003542550024504511, 'mosaic_prob': 0.22166534006066863, 'label_smooth': 0.09635457835133783, 'copy_paste_p': 0.3118008752966299, 'slice_stride': 5, 'batch_size': 16, 'use_clahe': False, 'use_shift_scale_rotate': True, 'use_brightness_contrast': True, 'use_median_blur': True, 'median_blur_limit': 5, 'use_speckle_noise': True, 'speckle_level': 'heavy'}. Best is trial 14 with value: 0.7280141285840982.
[I 2026-03-17 16:48:42,846] Trial 228 pruned. 
[I 2026-03-17 16:53:44,304] Trial 245 pruned. 
