[I 2026-03-19 11:24:35,502] Using an existing study with name 'yoloe_hparam_search_v6' instead of creating a new one.
/fs01/home/dhaneshr/code/obj-det-test/.venv/lib/python3.12/site-packages/albumentations/core/validation.py:114: UserWarning: ShiftScaleRotate is a special case of Affine transform. Please use Affine transform instead.
  original_init(self, **validated_kwargs)
[I 2026-03-19 11:30:09,306] Trial 49 pruned. 
[I 2026-03-19 11:33:56,081] Trial 61 finished with value: 0.3564356435643566 and parameters: {'learning_rate': 0.000747599299995651, 'weight_decay': 0.003971084710792475, 'mosaic_prob': 0.32322520635999885, 'label_smooth': 0.09113172778521575, 'copy_paste_p': 0.2852620618436458, 'slice_stride': 10, 'batch_size': 8, 'use_clahe': True, 'use_shift_scale_rotate': False, 'use_brightness_contrast': False, 'use_median_blur': False, 'median_blur_limit': 7, 'use_speckle_noise': False, 'speckle_level': 'medium'}. Best is trial 46 with value: 0.3726930693069308.
[I 2026-03-19 11:44:28,827] Trial 69 finished with value: 0.39844257425742585 and parameters: {'learning_rate': 0.00012284845182241073, 'weight_decay': 0.007029453326946592, 'mosaic_prob': 0.784768555393933, 'label_smooth': 0.13984355128676806, 'copy_paste_p': 0.4378315353183655, 'slice_stride': 5, 'batch_size': 32, 'use_clahe': False, 'use_shift_scale_rotate': False, 'use_brightness_contrast': True, 'use_median_blur': False, 'median_blur_limit': 3, 'use_speckle_noise': True, 'speckle_level': 'light'}. Best is trial 42 with value: 0.7017763012337562.
[I 2026-03-19 12:01:21,533] Trial 91 pruned. 
[I 2026-03-19 12:06:02,383] Trial 122 pruned. 
[I 2026-03-19 12:10:21,518] Trial 130 finished with value: 0.40594059405940613 and parameters: {'learning_rate': 0.0005592904240304058, 'weight_decay': 0.002019958202692898, 'mosaic_prob': 0.7021655711050463, 'label_smooth': 0.09885429072134608, 'copy_paste_p': 0.25734480753966554, 'slice_stride': 10, 'batch_size': 8, 'use_clahe': True, 'use_shift_scale_rotate': False, 'use_brightness_contrast': False, 'use_median_blur': False, 'median_blur_limit': 7, 'use_speckle_noise': False, 'speckle_level': 'medium'}. Best is trial 106 with value: 0.7300394720216199.
[I 2026-03-19 12:17:13,941] Trial 141 pruned. 
[I 2026-03-19 12:32:47,014] Trial 160 finished with value: 0.6762235875702757 and parameters: {'learning_rate': 0.00038566938405515806, 'weight_decay': 0.00013741369865886396, 'mosaic_prob': 0.5195710541910101, 'label_smooth': 0.023346909185972625, 'copy_paste_p': 0.5387324369104759, 'slice_stride': 7, 'batch_size': 16, 'use_clahe': True, 'use_shift_scale_rotate': True, 'use_brightness_contrast': False, 'use_median_blur': True, 'median_blur_limit': 5, 'use_speckle_noise': False, 'speckle_level': 'heavy'}. Best is trial 106 with value: 0.7300394720216199.
[I 2026-03-19 12:38:10,007] Trial 191 pruned. 
[I 2026-03-19 12:44:37,838] Trial 204 pruned. 
[I 2026-03-19 12:50:10,315] Trial 213 finished with value: 0.3762376237623764 and parameters: {'learning_rate': 0.00041966748970534906, 'weight_decay': 0.000813822714897863, 'mosaic_prob': 0.4917453770038845, 'label_smooth': 0.08547387715582948, 'copy_paste_p': 0.6851899024509025, 'slice_stride': 7, 'batch_size': 8, 'use_clahe': True, 'use_shift_scale_rotate': True, 'use_brightness_contrast': False, 'use_median_blur': True, 'median_blur_limit': 7, 'use_speckle_noise': False, 'speckle_level': 'heavy'}. Best is trial 166 with value: 0.7379452386507251.
[I 2026-03-19 13:04:58,508] Trial 221 pruned. 
[I 2026-03-19 13:18:56,491] Trial 249 finished with value: 0.6442485331850858 and parameters: {'learning_rate': 0.0003549599000515947, 'weight_decay': 0.00014882815806924426, 'mosaic_prob': 0.46828649606435774, 'label_smooth': 0.038615393157054284, 'copy_paste_p': 0.6507754305350756, 'slice_stride': 7, 'batch_size': 8, 'use_clahe': True, 'use_shift_scale_rotate': True, 'use_brightness_contrast': False, 'use_median_blur': True, 'median_blur_limit': 5, 'use_speckle_noise': False, 'speckle_level': 'heavy'}. Best is trial 227 with value: 0.745034987552105.
[I 2026-03-19 13:33:56,978] Trial 276 pruned. 
[I 2026-03-19 13:49:22,647] Trial 300 finished with value: 0.7047741846664354 and parameters: {'learning_rate': 0.0003969695446562558, 'weight_decay': 0.0001793431344614788, 'mosaic_prob': 0.526211543511762, 'label_smooth': 0.061363955677553886, 'copy_paste_p': 0.6850553444588503, 'slice_stride': 7, 'batch_size': 16, 'use_clahe': False, 'use_shift_scale_rotate': True, 'use_brightness_contrast': True, 'use_median_blur': True, 'median_blur_limit': 5, 'use_speckle_noise': True, 'speckle_level': 'light'}. Best is trial 227 with value: 0.745034987552105.
