[I 2026-03-17 22:47:48,396] Using an existing study with name 'yoloe_hparam_search_v5' instead of creating a new one.
/fs01/home/dhaneshr/code/obj-det-test/.venv/lib/python3.12/site-packages/albumentations/core/validation.py:114: UserWarning: ShiftScaleRotate is a special case of Affine transform. Please use Affine transform instead.
  original_init(self, **validated_kwargs)
[I 2026-03-17 22:59:39,857] Trial 224 pruned. 
[I 2026-03-17 23:03:45,195] Trial 259 finished with value: 0.6039603960396043 and parameters: {'learning_rate': 0.0007122595488277191, 'weight_decay': 0.0008499553488449836, 'mosaic_prob': 0.648317977080689, 'label_smooth': 0.08386425338246488, 'copy_paste_p': 0.2527538529324313, 'slice_stride': 7, 'batch_size': 8, 'use_clahe': True, 'use_shift_scale_rotate': True, 'use_brightness_contrast': False, 'use_median_blur': True, 'median_blur_limit': 7, 'use_speckle_noise': False, 'speckle_level': 'medium'}. Best is trial 123 with value: 0.7353625013713276.
[I 2026-03-17 23:07:45,820] Trial 272 finished with value: 0.6435643564356439 and parameters: {'learning_rate': 0.0009639959128804647, 'weight_decay': 0.0034514717585967586, 'mosaic_prob': 0.5705760960317714, 'label_smooth': 0.09200541288125721, 'copy_paste_p': 0.25310068485481557, 'slice_stride': 7, 'batch_size': 8, 'use_clahe': True, 'use_shift_scale_rotate': True, 'use_brightness_contrast': False, 'use_median_blur': True, 'median_blur_limit': 7, 'use_speckle_noise': False, 'speckle_level': 'medium'}. Best is trial 123 with value: 0.7353625013713276.
[I 2026-03-17 23:12:00,872] Trial 284 pruned. 
[I 2026-03-17 23:16:27,192] Trial 294 pruned. 
[I 2026-03-17 23:28:36,506] Trial 304 pruned. 
[I 2026-03-17 23:33:00,651] Trial 329 pruned. 
[I 2026-03-17 23:46:29,545] Trial 339 finished with value: 0.6808881366699181 and parameters: {'learning_rate': 0.0012754379418662583, 'weight_decay': 0.00020856910227883818, 'mosaic_prob': 0.659989020542819, 'label_smooth': 0.08490608727018019, 'copy_paste_p': 0.23560905185918093, 'slice_stride': 10, 'batch_size': 16, 'use_clahe': True, 'use_shift_scale_rotate': True, 'use_brightness_contrast': False, 'use_median_blur': True, 'median_blur_limit': 5, 'use_speckle_noise': False, 'speckle_level': 'medium'}. Best is trial 123 with value: 0.7353625013713276.
[I 2026-03-18 00:01:34,514] Trial 372 finished with value: 0.6763044478334752 and parameters: {'learning_rate': 0.0011139335363694576, 'weight_decay': 0.03726913147419241, 'mosaic_prob': 0.36083358345353833, 'label_smooth': 0.08502049952434879, 'copy_paste_p': 0.5628959770949317, 'slice_stride': 10, 'batch_size': 32, 'use_clahe': True, 'use_shift_scale_rotate': True, 'use_brightness_contrast': False, 'use_median_blur': True, 'median_blur_limit': 3, 'use_speckle_noise': False, 'speckle_level': 'heavy'}. Best is trial 123 with value: 0.7353625013713276.
[I 2026-03-18 00:13:53,359] Trial 409 finished with value: 0.7500143454379812 and parameters: {'learning_rate': 0.0008429170022484867, 'weight_decay': 0.003959664482397866, 'mosaic_prob': 0.3236212685407541, 'label_smooth': 0.0785569963656005, 'copy_paste_p': 0.4936612542488167, 'slice_stride': 10, 'batch_size': 16, 'use_clahe': False, 'use_shift_scale_rotate': True, 'use_brightness_contrast': False, 'use_median_blur': True, 'median_blur_limit': 3, 'use_speckle_noise': False, 'speckle_level': 'light'}. Best is trial 409 with value: 0.7500143454379812.
[I 2026-03-18 00:25:54,729] Trial 441 pruned. 
[I 2026-03-18 00:35:13,459] Trial 465 finished with value: 0.689849398331822 and parameters: {'learning_rate': 0.0006769724392601272, 'weight_decay': 0.0007456156273579257, 'mosaic_prob': 0.49831370533706065, 'label_smooth': 0.07904626742491348, 'copy_paste_p': 0.5918889666968867, 'slice_stride': 10, 'batch_size': 8, 'use_clahe': False, 'use_shift_scale_rotate': True, 'use_brightness_contrast': False, 'use_median_blur': True, 'median_blur_limit': 7, 'use_speckle_noise': False, 'speckle_level': 'light'}. Best is trial 409 with value: 0.7500143454379812.
[I 2026-03-18 00:48:43,745] Trial 480 finished with value: 0.7030375817505599 and parameters: {'learning_rate': 0.0005636892321363977, 'weight_decay': 0.0009805711381455752, 'mosaic_prob': 0.4809105426628504, 'label_smooth': 0.06826033352830266, 'copy_paste_p': 0.5768735659855628, 'slice_stride': 5, 'batch_size': 8, 'use_clahe': False, 'use_shift_scale_rotate': True, 'use_brightness_contrast': False, 'use_median_blur': True, 'median_blur_limit': 7, 'use_speckle_noise': False, 'speckle_level': 'light'}. Best is trial 409 with value: 0.7500143454379812.
[I 2026-03-18 01:00:46,173] Trial 498 finished with value: 0.6744837031290009 and parameters: {'learning_rate': 0.0005076150500013215, 'weight_decay': 0.0009193472375077528, 'mosaic_prob': 0.484379356491364, 'label_smooth': 0.0695864567080613, 'copy_paste_p': 0.6551877662849778, 'slice_stride': 5, 'batch_size': 8, 'use_clahe': False, 'use_shift_scale_rotate': True, 'use_brightness_contrast': False, 'use_median_blur': True, 'median_blur_limit': 7, 'use_speckle_noise': True, 'speckle_level': 'light'}. Best is trial 409 with value: 0.7500143454379812.
[I 2026-03-18 01:04:10,131] Trial 510 finished with value: 0.5148514851485151 and parameters: {'learning_rate': 0.0006356251076242764, 'weight_decay': 0.0053129876047396, 'mosaic_prob': 0.4587459612465916, 'label_smooth': 0.07283270343556576, 'copy_paste_p': 0.36615062753792726, 'slice_stride': 10, 'batch_size': 8, 'use_clahe': False, 'use_shift_scale_rotate': True, 'use_brightness_contrast': False, 'use_median_blur': True, 'median_blur_limit': 7, 'use_speckle_noise': False, 'speckle_level': 'light'}. Best is trial 409 with value: 0.7500143454379812.
