[I 2026-03-17 14:39:58,903] Using an existing study with name 'yoloe_hparam_search_v4' instead of creating a new one.
/fs01/home/dhaneshr/code/obj-det-test/.venv/lib/python3.12/site-packages/albumentations/core/validation.py:114: UserWarning: ShiftScaleRotate is a special case of Affine transform. Please use Affine transform instead.
  original_init(self, **validated_kwargs)
[I 2026-03-17 14:57:50,858] Trial 14 finished with value: 0.7280141285840982 and parameters: {'learning_rate': 0.00043284502212938834, 'weight_decay': 0.007969454818643935, 'mosaic_prob': 0.39279757672456206, 'label_smooth': 0.08979877262955549, 'copy_paste_p': 0.10921304830970556, 'slice_stride': 10, 'batch_size': 16, 'use_clahe': True, 'use_shift_scale_rotate': True, 'use_brightness_contrast': False, 'use_median_blur': True, 'median_blur_limit': 5, 'use_speckle_noise': False, 'speckle_level': 'medium'}. Best is trial 14 with value: 0.7280141285840982.
[I 2026-03-17 15:12:27,958] Trial 48 finished with value: 0.646187209241792 and parameters: {'learning_rate': 0.001243439271836434, 'weight_decay': 0.004685358414631305, 'mosaic_prob': 0.33846808499176184, 'label_smooth': 0.06688463202699092, 'copy_paste_p': 0.008834782520393769, 'slice_stride': 10, 'batch_size': 16, 'use_clahe': True, 'use_shift_scale_rotate': True, 'use_brightness_contrast': False, 'use_median_blur': True, 'median_blur_limit': 5, 'use_speckle_noise': False, 'speckle_level': 'heavy'}. Best is trial 14 with value: 0.7280141285840982.
[I 2026-03-17 15:16:34,818] Trial 76 pruned. 
[I 2026-03-17 15:29:53,126] Trial 81 finished with value: 0.7021810527040587 and parameters: {'learning_rate': 0.0027480270757672984, 'weight_decay': 0.0064578010418016715, 'mosaic_prob': 0.3722606154649341, 'label_smooth': 0.08120703848000191, 'copy_paste_p': 0.14357048202764863, 'slice_stride': 10, 'batch_size': 16, 'use_clahe': True, 'use_shift_scale_rotate': True, 'use_brightness_contrast': False, 'use_median_blur': True, 'median_blur_limit': 5, 'use_speckle_noise': False, 'speckle_level': 'medium'}. Best is trial 14 with value: 0.7280141285840982.
[I 2026-03-17 15:40:48,167] Trial 109 pruned. 
[I 2026-03-17 16:00:20,427] Trial 127 finished with value: 0.6876238931587761 and parameters: {'learning_rate': 0.0034731289337110866, 'weight_decay': 0.0022096958926472003, 'mosaic_prob': 0.38858799654617926, 'label_smooth': 0.09326920399337352, 'copy_paste_p': 0.04598409378155825, 'slice_stride': 7, 'batch_size': 16, 'use_clahe': True, 'use_shift_scale_rotate': True, 'use_brightness_contrast': False, 'use_median_blur': True, 'median_blur_limit': 5, 'use_speckle_noise': False, 'speckle_level': 'heavy'}. Best is trial 14 with value: 0.7280141285840982.
[I 2026-03-17 16:13:57,205] Trial 163 pruned. 
[I 2026-03-17 16:19:41,443] Trial 187 finished with value: 0.5346534653465349 and parameters: {'learning_rate': 0.0045913042126590605, 'weight_decay': 0.007653678700542798, 'mosaic_prob': 0.3766566200763639, 'label_smooth': 0.0183295435508826, 'copy_paste_p': 0.09229914696925631, 'slice_stride': 10, 'batch_size': 16, 'use_clahe': True, 'use_shift_scale_rotate': True, 'use_brightness_contrast': False, 'use_median_blur': True, 'median_blur_limit': 5, 'use_speckle_noise': False, 'speckle_level': 'medium'}. Best is trial 14 with value: 0.7280141285840982.
[I 2026-03-17 16:24:33,931] Trial 199 pruned. 
[I 2026-03-17 16:27:57,044] Trial 208 pruned. 
[I 2026-03-17 16:31:34,890] Trial 211 pruned. 
[I 2026-03-17 16:42:10,394] Trial 218 pruned. 
[I 2026-03-17 16:47:17,495] Trial 238 pruned. 
[I 2026-03-17 17:01:12,796] Trial 243 pruned. 
[I 2026-03-17 17:06:11,241] Trial 262 pruned. 
