[I 2026-03-19 11:24:38,055] Using an existing study with name 'yoloe_hparam_search_v6' instead of creating a new one.
/fs01/home/dhaneshr/code/obj-det-test/.venv/lib/python3.12/site-packages/albumentations/core/validation.py:114: UserWarning: ShiftScaleRotate is a special case of Affine transform. Please use Affine transform instead.
  original_init(self, **validated_kwargs)
[I 2026-03-19 11:31:31,579] Trial 51 finished with value: 0.3584851485148516 and parameters: {'learning_rate': 0.00043284502212938834, 'weight_decay': 0.03680860814877612, 'mosaic_prob': 0.6659969709057025, 'label_smooth': 0.08979877262955549, 'copy_paste_p': 0.27800932022121827, 'slice_stride': 10, 'batch_size': 16, 'use_clahe': True, 'use_shift_scale_rotate': True, 'use_brightness_contrast': False, 'use_median_blur': True, 'median_blur_limit': 5, 'use_speckle_noise': False, 'speckle_level': 'medium'}. Best is trial 46 with value: 0.3726930693069308.
[I 2026-03-19 11:43:04,559] Trial 66 pruned. 
[I 2026-03-19 12:01:02,237] Trial 89 pruned. 
[I 2026-03-19 12:15:07,474] Trial 120 pruned. 
[I 2026-03-19 12:30:44,516] Trial 155 pruned. 
[I 2026-03-19 12:35:35,859] Trial 185 pruned. 
[I 2026-03-19 12:42:00,712] Trial 201 pruned. 
[I 2026-03-19 12:46:42,311] Trial 208 pruned. 
[I 2026-03-19 12:52:31,937] Trial 218 finished with value: 0.40594059405940613 and parameters: {'learning_rate': 0.0004430153379741383, 'weight_decay': 0.0007756864038044633, 'mosaic_prob': 0.5173491873622995, 'label_smooth': 0.045327401452331106, 'copy_paste_p': 0.5125853788401384, 'slice_stride': 7, 'batch_size': 8, 'use_clahe': True, 'use_shift_scale_rotate': True, 'use_brightness_contrast': False, 'use_median_blur': True, 'median_blur_limit': 7, 'use_speckle_noise': False, 'speckle_level': 'heavy'}. Best is trial 166 with value: 0.7379452386507251.
[I 2026-03-19 13:08:32,869] Trial 231 finished with value: 0.679278785962884 and parameters: {'learning_rate': 0.0002992432106644997, 'weight_decay': 0.0001260281960960999, 'mosaic_prob': 0.5462357669296075, 'label_smooth': 0.01575692584445112, 'copy_paste_p': 0.30065454405608005, 'slice_stride': 7, 'batch_size': 16, 'use_clahe': False, 'use_shift_scale_rotate': True, 'use_brightness_contrast': True, 'use_median_blur': True, 'median_blur_limit': 5, 'use_speckle_noise': True, 'speckle_level': 'heavy'}. Best is trial 227 with value: 0.745034987552105.
[I 2026-03-19 13:24:02,165] Trial 260 finished with value: 0.7051458884189871 and parameters: {'learning_rate': 0.0005171894867162803, 'weight_decay': 0.00015354208329621858, 'mosaic_prob': 0.5350447054556793, 'label_smooth': 0.052283589330994557, 'copy_paste_p': 0.5057343823230739, 'slice_stride': 7, 'batch_size': 8, 'use_clahe': True, 'use_shift_scale_rotate': True, 'use_brightness_contrast': False, 'use_median_blur': True, 'median_blur_limit': 7, 'use_speckle_noise': False, 'speckle_level': 'heavy'}. Best is trial 227 with value: 0.745034987552105.
[I 2026-03-19 13:30:26,466] Trial 284 pruned. 
[I 2026-03-19 13:46:25,327] Trial 295 finished with value: 0.6719517711015452 and parameters: {'learning_rate': 0.000407056151428579, 'weight_decay': 0.00020289772926955396, 'mosaic_prob': 0.5254426108920369, 'label_smooth': 0.05159114184821027, 'copy_paste_p': 0.6787700383431479, 'slice_stride': 5, 'batch_size': 16, 'use_clahe': True, 'use_shift_scale_rotate': True, 'use_brightness_contrast': False, 'use_median_blur': True, 'median_blur_limit': 5, 'use_speckle_noise': False, 'speckle_level': 'light'}. Best is trial 227 with value: 0.745034987552105.
[I 2026-03-19 13:53:17,428] Trial 315 pruned. 
[I 2026-03-19 14:00:36,779] Trial 323 pruned. 
