[I 2026-03-17 22:47:46,103] Using an existing study with name 'yoloe_hparam_search_v5' instead of creating a new one.
/fs01/home/dhaneshr/code/obj-det-test/.venv/lib/python3.12/site-packages/albumentations/core/validation.py:114: UserWarning: ShiftScaleRotate is a special case of Affine transform. Please use Affine transform instead.
  original_init(self, **validated_kwargs)
[I 2026-03-17 22:59:34,247] Trial 222 pruned. 
[I 2026-03-17 23:12:25,721] Trial 258 pruned. 
[I 2026-03-17 23:22:44,131] Trial 296 finished with value: 0.6943502824870175 and parameters: {'learning_rate': 0.0011054377363466574, 'weight_decay': 0.023418943079031286, 'mosaic_prob': 0.6741595395077485, 'label_smooth': 0.08847598806743939, 'copy_paste_p': 0.5095839387020463, 'slice_stride': 10, 'batch_size': 16, 'use_clahe': False, 'use_shift_scale_rotate': False, 'use_brightness_contrast': False, 'use_median_blur': False, 'median_blur_limit': 5, 'use_speckle_noise': False, 'speckle_level': 'light'}. Best is trial 123 with value: 0.7353625013713276.
[I 2026-03-17 23:32:29,517] Trial 318 finished with value: 0.647204522157921 and parameters: {'learning_rate': 0.0010281919030881376, 'weight_decay': 0.049394062872302066, 'mosaic_prob': 0.4080438610505279, 'label_smooth': 0.08953036047336893, 'copy_paste_p': 0.5313796118907075, 'slice_stride': 5, 'batch_size': 16, 'use_clahe': False, 'use_shift_scale_rotate': False, 'use_brightness_contrast': False, 'use_median_blur': False, 'median_blur_limit': 5, 'use_speckle_noise': False, 'speckle_level': 'medium'}. Best is trial 123 with value: 0.7353625013713276.
[I 2026-03-17 23:36:35,824] Trial 338 pruned. 
[I 2026-03-17 23:40:28,482] Trial 347 pruned. 
[I 2026-03-17 23:44:18,585] Trial 358 pruned. 
[I 2026-03-17 23:48:22,241] Trial 366 finished with value: 0.3247524752475248 and parameters: {'learning_rate': 0.0009498013173861583, 'weight_decay': 0.0002280406022471839, 'mosaic_prob': 0.3625949208904745, 'label_smooth': 0.08506515781191257, 'copy_paste_p': 0.5588179103471368, 'slice_stride': 10, 'batch_size': 16, 'use_clahe': True, 'use_shift_scale_rotate': True, 'use_brightness_contrast': False, 'use_median_blur': True, 'median_blur_limit': 5, 'use_speckle_noise': False, 'speckle_level': 'heavy'}. Best is trial 123 with value: 0.7353625013713276.
[I 2026-03-18 00:02:13,549] Trial 377 pruned. 
[I 2026-03-18 00:14:23,738] Trial 411 finished with value: 0.6835499492094875 and parameters: {'learning_rate': 0.0008429170022484867, 'weight_decay': 0.003959664482397866, 'mosaic_prob': 0.3236212685407541, 'label_smooth': 0.0785569963656005, 'copy_paste_p': 0.4936612542488167, 'slice_stride': 10, 'batch_size': 16, 'use_clahe': False, 'use_shift_scale_rotate': True, 'use_brightness_contrast': False, 'use_median_blur': True, 'median_blur_limit': 5, 'use_speckle_noise': False, 'speckle_level': 'light'}. Best is trial 409 with value: 0.7500143454379812.
[I 2026-03-18 00:25:25,559] Trial 442 finished with value: 0.6602096022944908 and parameters: {'learning_rate': 0.0007748089906342939, 'weight_decay': 0.004401000798207107, 'mosaic_prob': 0.5422328160741665, 'label_smooth': 0.07455061193264279, 'copy_paste_p': 0.3505878524333833, 'slice_stride': 10, 'batch_size': 16, 'use_clahe': False, 'use_shift_scale_rotate': False, 'use_brightness_contrast': True, 'use_median_blur': False, 'median_blur_limit': 3, 'use_speckle_noise': False, 'speckle_level': 'heavy'}. Best is trial 409 with value: 0.7500143454379812.
[I 2026-03-18 00:35:45,970] Trial 461 finished with value: 0.6376458477150916 and parameters: {'learning_rate': 0.0006769724392601272, 'weight_decay': 0.0007456156273579257, 'mosaic_prob': 0.49831370533706065, 'label_smooth': 0.07904626742491348, 'copy_paste_p': 0.5918889666968867, 'slice_stride': 10, 'batch_size': 16, 'use_clahe': False, 'use_shift_scale_rotate': True, 'use_brightness_contrast': False, 'use_median_blur': True, 'median_blur_limit': 5, 'use_speckle_noise': True, 'speckle_level': 'light'}. Best is trial 409 with value: 0.7500143454379812.
[I 2026-03-18 00:40:25,384] Trial 481 finished with value: 0.6237623762376241 and parameters: {'learning_rate': 0.0005636892321363977, 'weight_decay': 0.0009805711381455752, 'mosaic_prob': 0.4809105426628504, 'label_smooth': 0.06826033352830266, 'copy_paste_p': 0.5768735659855628, 'slice_stride': 5, 'batch_size': 8, 'use_clahe': False, 'use_shift_scale_rotate': True, 'use_brightness_contrast': False, 'use_median_blur': True, 'median_blur_limit': 7, 'use_speckle_noise': False, 'speckle_level': 'light'}. Best is trial 409 with value: 0.7500143454379812.
[I 2026-03-18 00:51:50,063] Trial 492 finished with value: 0.6806452449306585 and parameters: {'learning_rate': 0.0005542073874434731, 'weight_decay': 0.0025085276856955515, 'mosaic_prob': 0.6785843895224565, 'label_smooth': 0.12560795689559956, 'copy_paste_p': 0.6658954020812419, 'slice_stride': 10, 'batch_size': 8, 'use_clahe': False, 'use_shift_scale_rotate': True, 'use_brightness_contrast': False, 'use_median_blur': True, 'median_blur_limit': 5, 'use_speckle_noise': False, 'speckle_level': 'light'}. Best is trial 409 with value: 0.7500143454379812.
[I 2026-03-18 00:56:25,846] Trial 502 finished with value: 0.6138613861386142 and parameters: {'learning_rate': 0.0004796784995693778, 'weight_decay': 0.0009779256449503437, 'mosaic_prob': 0.4727262630829761, 'label_smooth': 0.06194580850457069, 'copy_paste_p': 0.49289944444211764, 'slice_stride': 5, 'batch_size': 8, 'use_clahe': False, 'use_shift_scale_rotate': True, 'use_brightness_contrast': False, 'use_median_blur': True, 'median_blur_limit': 7, 'use_speckle_noise': True, 'speckle_level': 'light'}. Best is trial 409 with value: 0.7500143454379812.
