[I 2026-03-19 11:24:39,228] Using an existing study with name 'yoloe_hparam_search_v6' instead of creating a new one.
/fs01/home/dhaneshr/code/obj-det-test/.venv/lib/python3.12/site-packages/albumentations/core/validation.py:114: UserWarning: ShiftScaleRotate is a special case of Affine transform. Please use Affine transform instead.
  original_init(self, **validated_kwargs)
[I 2026-03-19 11:39:45,389] Trial 56 pruned. 
[I 2026-03-19 11:45:54,784] Trial 83 pruned. 
[I 2026-03-19 11:56:47,335] Trial 92 finished with value: 0.6410558622621224 and parameters: {'learning_rate': 0.0011672005269991867, 'weight_decay': 0.017509372226427584, 'mosaic_prob': 0.6035921370166129, 'label_smooth': 0.10973262327915756, 'copy_paste_p': 0.3425295906038691, 'slice_stride': 7, 'batch_size': 8, 'use_clahe': False, 'use_shift_scale_rotate': False, 'use_brightness_contrast': True, 'use_median_blur': False, 'median_blur_limit': 7, 'use_speckle_noise': True, 'speckle_level': 'heavy'}. Best is trial 42 with value: 0.7017763012337562.
[I 2026-03-19 12:03:15,898] Trial 114 pruned. 
[I 2026-03-19 12:08:51,968] Trial 126 finished with value: 0.42574257425742595 and parameters: {'learning_rate': 0.000549117965798401, 'weight_decay': 0.026903610040179268, 'mosaic_prob': 0.7036018102517149, 'label_smooth': 0.08008449120596033, 'copy_paste_p': 0.25734480753966554, 'slice_stride': 10, 'batch_size': 8, 'use_clahe': True, 'use_shift_scale_rotate': False, 'use_brightness_contrast': False, 'use_median_blur': False, 'median_blur_limit': 5, 'use_speckle_noise': False, 'speckle_level': 'medium'}. Best is trial 103 with value: 0.7158943703657825.
[I 2026-03-19 12:14:53,705] Trial 138 finished with value: 0.4920792079207923 and parameters: {'learning_rate': 0.00020746758899924933, 'weight_decay': 0.0016156245826009395, 'mosaic_prob': 0.6302996229142291, 'label_smooth': 0.00830971562970208, 'copy_paste_p': 0.5869705589506639, 'slice_stride': 7, 'batch_size': 8, 'use_clahe': False, 'use_shift_scale_rotate': True, 'use_brightness_contrast': True, 'use_median_blur': True, 'median_blur_limit': 7, 'use_speckle_noise': True, 'speckle_level': 'heavy'}. Best is trial 106 with value: 0.7300394720216199.
[I 2026-03-19 12:21:19,374] Trial 153 finished with value: 0.4140594059405942 and parameters: {'learning_rate': 0.00038844246486195385, 'weight_decay': 0.002866740212922113, 'mosaic_prob': 0.5028776192355132, 'label_smooth': 0.016655320210600302, 'copy_paste_p': 0.5430861436565128, 'slice_stride': 7, 'batch_size': 16, 'use_clahe': False, 'use_shift_scale_rotate': True, 'use_brightness_contrast': True, 'use_median_blur': True, 'median_blur_limit': 5, 'use_speckle_noise': True, 'speckle_level': 'heavy'}. Best is trial 106 with value: 0.7300394720216199.
[I 2026-03-19 12:29:06,550] Trial 170 finished with value: 0.44036633663366354 and parameters: {'learning_rate': 0.00037393636212216706, 'weight_decay': 0.00038884403216464937, 'mosaic_prob': 0.44367239156836263, 'label_smooth': 0.14320091868785167, 'copy_paste_p': 0.4743487507237122, 'slice_stride': 7, 'batch_size': 16, 'use_clahe': True, 'use_shift_scale_rotate': True, 'use_brightness_contrast': False, 'use_median_blur': True, 'median_blur_limit': 5, 'use_speckle_noise': False, 'speckle_level': 'heavy'}. Best is trial 106 with value: 0.7300394720216199.
[I 2026-03-19 12:37:24,670] Trial 183 pruned. 
[I 2026-03-19 12:54:58,765] Trial 203 pruned. 
[I 2026-03-19 13:01:12,592] Trial 234 pruned. 
[I 2026-03-19 13:05:45,462] Trial 245 finished with value: 0.633663366336634 and parameters: {'learning_rate': 0.0008677383931339142, 'weight_decay': 0.00014795538594535878, 'mosaic_prob': 0.46159060237116933, 'label_smooth': 0.008373172923318625, 'copy_paste_p': 0.48348474215112075, 'slice_stride': 7, 'batch_size': 8, 'use_clahe': True, 'use_shift_scale_rotate': True, 'use_brightness_contrast': False, 'use_median_blur': True, 'median_blur_limit': 7, 'use_speckle_noise': False, 'speckle_level': 'heavy'}. Best is trial 166 with value: 0.7379452386507251.
[I 2026-03-19 13:11:04,125] Trial 252 finished with value: 0.43564356435643586 and parameters: {'learning_rate': 0.00026757796499367944, 'weight_decay': 0.0014201833854891514, 'mosaic_prob': 0.4702908287414127, 'label_smooth': 0.03853517946689264, 'copy_paste_p': 0.5091792989487615, 'slice_stride': 7, 'batch_size': 8, 'use_clahe': True, 'use_shift_scale_rotate': True, 'use_brightness_contrast': False, 'use_median_blur': True, 'median_blur_limit': 5, 'use_speckle_noise': False, 'speckle_level': 'heavy'}. Best is trial 227 with value: 0.745034987552105.
[I 2026-03-19 13:25:36,101] Trial 262 finished with value: 0.694949370978589 and parameters: {'learning_rate': 0.0005183674858054278, 'weight_decay': 0.0002708746814206686, 'mosaic_prob': 0.5712594144340223, 'label_smooth': 0.03204276314800867, 'copy_paste_p': 0.6398253991834248, 'slice_stride': 7, 'batch_size': 16, 'use_clahe': True, 'use_shift_scale_rotate': True, 'use_brightness_contrast': False, 'use_median_blur': True, 'median_blur_limit': 5, 'use_speckle_noise': False, 'speckle_level': 'heavy'}. Best is trial 227 with value: 0.745034987552105.
[I 2026-03-19 13:32:12,762] Trial 287 finished with value: 0.4485148514851487 and parameters: {'learning_rate': 0.00038023552374813816, 'weight_decay': 0.0006858051588666317, 'mosaic_prob': 0.5295346402841408, 'label_smooth': 0.052706798304738116, 'copy_paste_p': 0.6699527623257822, 'slice_stride': 5, 'batch_size': 16, 'use_clahe': True, 'use_shift_scale_rotate': True, 'use_brightness_contrast': False, 'use_median_blur': True, 'median_blur_limit': 5, 'use_speckle_noise': False, 'speckle_level': 'heavy'}. Best is trial 227 with value: 0.745034987552105.
