[I 2026-03-17 22:47:50,288] Using an existing study with name 'yoloe_hparam_search_v5' instead of creating a new one.
/fs01/home/dhaneshr/code/obj-det-test/.venv/lib/python3.12/site-packages/albumentations/core/validation.py:114: UserWarning: ShiftScaleRotate is a special case of Affine transform. Please use Affine transform instead.
  original_init(self, **validated_kwargs)
[I 2026-03-17 23:00:02,130] Trial 228 pruned. 
[I 2026-03-17 23:04:09,646] Trial 263 finished with value: 0.5544554455445547 and parameters: {'learning_rate': 0.0007140771797619988, 'weight_decay': 0.0008482675360027443, 'mosaic_prob': 0.6500863501275913, 'label_smooth': 0.08251291105758908, 'copy_paste_p': 0.2539552189327706, 'slice_stride': 7, 'batch_size': 8, 'use_clahe': True, 'use_shift_scale_rotate': True, 'use_brightness_contrast': False, 'use_median_blur': True, 'median_blur_limit': 7, 'use_speckle_noise': False, 'speckle_level': 'medium'}. Best is trial 123 with value: 0.7353625013713276.
[I 2026-03-17 23:16:58,025] Trial 275 pruned. 
[I 2026-03-17 23:28:21,914] Trial 306 finished with value: 0.641705752894619 and parameters: {'learning_rate': 0.0008707839533447586, 'weight_decay': 0.0005757261670218325, 'mosaic_prob': 0.6726633168632645, 'label_smooth': 0.08888718601656813, 'copy_paste_p': 0.21558603956491457, 'slice_stride': 10, 'batch_size': 16, 'use_clahe': True, 'use_shift_scale_rotate': True, 'use_brightness_contrast': False, 'use_median_blur': True, 'median_blur_limit': 5, 'use_speckle_noise': False, 'speckle_level': 'medium'}. Best is trial 123 with value: 0.7353625013713276.
[I 2026-03-17 23:39:31,030] Trial 327 finished with value: 0.6342046440987972 and parameters: {'learning_rate': 0.000540565851311354, 'weight_decay': 0.04931024264354836, 'mosaic_prob': 0.3916917967505633, 'label_smooth': 0.07131057837689667, 'copy_paste_p': 0.5396655390979546, 'slice_stride': 5, 'batch_size': 16, 'use_clahe': False, 'use_shift_scale_rotate': False, 'use_brightness_contrast': False, 'use_median_blur': False, 'median_blur_limit': 5, 'use_speckle_noise': False, 'speckle_level': 'medium'}. Best is trial 123 with value: 0.7353625013713276.
[I 2026-03-17 23:43:50,321] Trial 354 pruned. 
[I 2026-03-17 23:47:53,728] Trial 364 pruned. 
[I 2026-03-17 23:59:44,671] Trial 374 pruned. 
[I 2026-03-18 00:10:29,949] Trial 404 pruned. 
[I 2026-03-18 00:23:54,647] Trial 431 pruned. 
[I 2026-03-18 00:37:37,190] Trial 459 finished with value: 0.6967766417660863 and parameters: {'learning_rate': 0.0007030178418839289, 'weight_decay': 0.0030815710329736247, 'mosaic_prob': 0.5177804178638646, 'label_smooth': 0.07774344703703262, 'copy_paste_p': 0.47856491173796023, 'slice_stride': 10, 'batch_size': 16, 'use_clahe': False, 'use_shift_scale_rotate': True, 'use_brightness_contrast': False, 'use_median_blur': True, 'median_blur_limit': 5, 'use_speckle_noise': False, 'speckle_level': 'heavy'}. Best is trial 409 with value: 0.7500143454379812.
[I 2026-03-18 00:52:30,159] Trial 486 pruned. 
[I 2026-03-18 01:05:10,767] Trial 503 finished with value: 0.6199862736217377 and parameters: {'learning_rate': 0.0008358837471611787, 'weight_decay': 0.0009641434651185171, 'mosaic_prob': 0.47285609648666677, 'label_smooth': 0.06535027270876118, 'copy_paste_p': 0.6942061742275247, 'slice_stride': 5, 'batch_size': 8, 'use_clahe': False, 'use_shift_scale_rotate': True, 'use_brightness_contrast': False, 'use_median_blur': True, 'median_blur_limit': 7, 'use_speckle_noise': True, 'speckle_level': 'light'}. Best is trial 409 with value: 0.7500143454379812.
[I 2026-03-18 01:08:31,193] Trial 512 finished with value: 0.4851485148514854 and parameters: {'learning_rate': 0.0006282452379703104, 'weight_decay': 0.003716343328608575, 'mosaic_prob': 0.5075229706221916, 'label_smooth': 0.07351845103037559, 'copy_paste_p': 0.4444885528988949, 'slice_stride': 10, 'batch_size': 8, 'use_clahe': False, 'use_shift_scale_rotate': True, 'use_brightness_contrast': False, 'use_median_blur': True, 'median_blur_limit': 7, 'use_speckle_noise': False, 'speckle_level': 'medium'}. Best is trial 409 with value: 0.7500143454379812.
[I 2026-03-18 01:19:47,410] Trial 515 finished with value: 0.6818454040659013 and parameters: {'learning_rate': 0.0006208066832324932, 'weight_decay': 0.0011780377407394948, 'mosaic_prob': 0.4533122618439743, 'label_smooth': 0.06649851390937625, 'copy_paste_p': 0.6851315695190057, 'slice_stride': 5, 'batch_size': 8, 'use_clahe': False, 'use_shift_scale_rotate': True, 'use_brightness_contrast': False, 'use_median_blur': True, 'median_blur_limit': 7, 'use_speckle_noise': False, 'speckle_level': 'light'}. Best is trial 409 with value: 0.7500143454379812.
