[I 2026-03-17 14:39:38,393] Using an existing study with name 'yoloe_hparam_search_v4' instead of creating a new one.
/fs01/home/dhaneshr/code/obj-det-test/.venv/lib/python3.12/site-packages/albumentations/core/validation.py:114: UserWarning: ShiftScaleRotate is a special case of Affine transform. Please use Affine transform instead.
  original_init(self, **validated_kwargs)
[I 2026-03-17 14:50:31,065] Trial 1 pruned. 
[I 2026-03-17 14:59:58,752] Trial 26 pruned. 
[I 2026-03-17 15:04:09,177] Trial 51 pruned. 
[I 2026-03-17 15:23:38,612] Trial 56 finished with value: 0.6538401032960744 and parameters: {'learning_rate': 0.00030597868748051207, 'weight_decay': 0.0056708469493489165, 'mosaic_prob': 0.44605489691145417, 'label_smooth': 0.10619097317435439, 'copy_paste_p': 0.056067610192645, 'slice_stride': 7, 'batch_size': 16, 'use_clahe': True, 'use_shift_scale_rotate': True, 'use_brightness_contrast': False, 'use_median_blur': True, 'median_blur_limit': 5, 'use_speckle_noise': False, 'speckle_level': 'medium'}. Best is trial 14 with value: 0.7280141285840982.
[I 2026-03-17 15:28:01,082] Trial 95 pruned. 
[I 2026-03-17 15:31:58,135] Trial 103 pruned. 
[I 2026-03-17 15:43:36,863] Trial 115 pruned. 
[I 2026-03-17 15:59:34,023] Trial 133 finished with value: 0.6460227574313496 and parameters: {'learning_rate': 0.00016381493041474853, 'weight_decay': 0.0022319205342526387, 'mosaic_prob': 0.25072857170887314, 'label_smooth': 0.09321459329442436, 'copy_paste_p': 0.1205974887202714, 'slice_stride': 7, 'batch_size': 8, 'use_clahe': True, 'use_shift_scale_rotate': True, 'use_brightness_contrast': False, 'use_median_blur': True, 'median_blur_limit': 7, 'use_speckle_noise': False, 'speckle_level': 'light'}. Best is trial 14 with value: 0.7280141285840982.
[I 2026-03-17 16:15:32,566] Trial 161 finished with value: 0.6942835478051949 and parameters: {'learning_rate': 0.0004596926029837961, 'weight_decay': 0.0042263420852774874, 'mosaic_prob': 0.3966928125871416, 'label_smooth': 0.08819546967902012, 'copy_paste_p': 0.1789141141063862, 'slice_stride': 5, 'batch_size': 16, 'use_clahe': False, 'use_shift_scale_rotate': True, 'use_brightness_contrast': False, 'use_median_blur': True, 'median_blur_limit': 5, 'use_speckle_noise': False, 'speckle_level': 'medium'}. Best is trial 14 with value: 0.7280141285840982.
[I 2026-03-17 16:32:23,611] Trial 189 finished with value: 0.6497196281313885 and parameters: {'learning_rate': 0.004626902761919476, 'weight_decay': 0.007802618762262979, 'mosaic_prob': 0.37352105255993273, 'label_smooth': 0.01835411624632862, 'copy_paste_p': 0.08244203106054233, 'slice_stride': 10, 'batch_size': 16, 'use_clahe': True, 'use_shift_scale_rotate': True, 'use_brightness_contrast': False, 'use_median_blur': True, 'median_blur_limit': 5, 'use_speckle_noise': False, 'speckle_level': 'medium'}. Best is trial 14 with value: 0.7280141285840982.
[I 2026-03-17 16:42:08,291] Trial 219 pruned. 
[I 2026-03-17 16:56:02,627] Trial 237 pruned. 
[I 2026-03-17 17:00:35,426] Trial 257 pruned. 
[I 2026-03-17 17:07:15,070] Trial 261 finished with value: 0.633663366336634 and parameters: {'learning_rate': 0.0035454330061736464, 'weight_decay': 0.0024474092240996228, 'mosaic_prob': 0.4405944713373891, 'label_smooth': 0.09985233690268236, 'copy_paste_p': 0.4617726306082856, 'slice_stride': 7, 'batch_size': 16, 'use_clahe': True, 'use_shift_scale_rotate': True, 'use_brightness_contrast': True, 'use_median_blur': True, 'median_blur_limit': 5, 'use_speckle_noise': False, 'speckle_level': 'heavy'}. Best is trial 14 with value: 0.7280141285840982.
[I 2026-03-17 17:10:40,882] Trial 273 pruned. 
