[I 2026-03-19 11:24:32,524] Using an existing study with name 'yoloe_hparam_search_v6' instead of creating a new one.
/fs01/home/dhaneshr/code/obj-det-test/.venv/lib/python3.12/site-packages/albumentations/core/validation.py:114: UserWarning: ShiftScaleRotate is a special case of Affine transform. Please use Affine transform instead.
  original_init(self, **validated_kwargs)
[I 2026-03-19 11:30:54,540] Trial 46 finished with value: 0.3726930693069308 and parameters: {'learning_rate': 0.00043284502212938834, 'weight_decay': 0.03680860814877612, 'mosaic_prob': 0.6659969709057025, 'label_smooth': 0.08979877262955549, 'copy_paste_p': 0.27800932022121827, 'slice_stride': 10, 'batch_size': 16, 'use_clahe': True, 'use_shift_scale_rotate': True, 'use_brightness_contrast': False, 'use_median_blur': True, 'median_blur_limit': 5, 'use_speckle_noise': False, 'speckle_level': 'medium'}. Best is trial 46 with value: 0.3726930693069308.
[I 2026-03-19 11:34:44,090] Trial 64 finished with value: 0.5049504950495052 and parameters: {'learning_rate': 0.000747599299995651, 'weight_decay': 0.003971084710792475, 'mosaic_prob': 0.32322520635999885, 'label_smooth': 0.09113172778521575, 'copy_paste_p': 0.2852620618436458, 'slice_stride': 10, 'batch_size': 8, 'use_clahe': True, 'use_shift_scale_rotate': False, 'use_brightness_contrast': False, 'use_median_blur': False, 'median_blur_limit': 7, 'use_speckle_noise': False, 'speckle_level': 'medium'}. Best is trial 63 with value: 0.5742574257425745.
[I 2026-03-19 11:41:11,758] Trial 73 pruned. 
[I 2026-03-19 11:47:20,867] Trial 87 pruned. 
[I 2026-03-19 11:52:21,762] Trial 94 pruned. 
[I 2026-03-19 11:59:02,666] Trial 100 pruned. 
[I 2026-03-19 12:15:55,420] Trial 116 finished with value: 0.6759756623127104 and parameters: {'learning_rate': 0.000539485389232306, 'weight_decay': 0.0002615749585058393, 'mosaic_prob': 0.35066515165687695, 'label_smooth': 0.027454950427566058, 'copy_paste_p': 0.47666753220518676, 'slice_stride': 10, 'batch_size': 16, 'use_clahe': True, 'use_shift_scale_rotate': True, 'use_brightness_contrast': False, 'use_median_blur': True, 'median_blur_limit': 5, 'use_speckle_noise': False, 'speckle_level': 'medium'}. Best is trial 106 with value: 0.7300394720216199.
[I 2026-03-19 12:24:25,924] Trial 158 finished with value: 0.4022475247524754 and parameters: {'learning_rate': 0.00037261545863675934, 'weight_decay': 0.0001318126344500492, 'mosaic_prob': 0.49966273136178496, 'label_smooth': 0.02215237538362675, 'copy_paste_p': 0.4707220448984522, 'slice_stride': 7, 'batch_size': 16, 'use_clahe': True, 'use_shift_scale_rotate': True, 'use_brightness_contrast': False, 'use_median_blur': True, 'median_blur_limit': 5, 'use_speckle_noise': False, 'speckle_level': 'heavy'}. Best is trial 106 with value: 0.7300394720216199.
[I 2026-03-19 12:30:32,633] Trial 173 pruned. 
[I 2026-03-19 12:44:03,271] Trial 184 pruned. 
[I 2026-03-19 13:00:48,210] Trial 211 finished with value: 0.7350103340390503 and parameters: {'learning_rate': 0.0004186064867053193, 'weight_decay': 0.000813822714897863, 'mosaic_prob': 0.4917453770038845, 'label_smooth': 0.08547387715582948, 'copy_paste_p': 0.6851899024509025, 'slice_stride': 7, 'batch_size': 8, 'use_clahe': True, 'use_shift_scale_rotate': True, 'use_brightness_contrast': False, 'use_median_blur': True, 'median_blur_limit': 7, 'use_speckle_noise': False, 'speckle_level': 'heavy'}. Best is trial 166 with value: 0.7379452386507251.
[I 2026-03-19 13:05:42,392] Trial 243 finished with value: 0.5148514851485151 and parameters: {'learning_rate': 0.000359041210252183, 'weight_decay': 0.0009773644304641002, 'mosaic_prob': 0.4592016507306992, 'label_smooth': 0.025322546778639612, 'copy_paste_p': 0.4851206136728454, 'slice_stride': 7, 'batch_size': 8, 'use_clahe': True, 'use_shift_scale_rotate': True, 'use_brightness_contrast': False, 'use_median_blur': True, 'median_blur_limit': 5, 'use_speckle_noise': False, 'speckle_level': 'heavy'}. Best is trial 166 with value: 0.7379452386507251.
[I 2026-03-19 13:20:15,339] Trial 251 pruned. 
[I 2026-03-19 13:34:54,755] Trial 279 pruned. 
[I 2026-03-19 13:48:36,266] Trial 302 finished with value: 0.6981719746314796 and parameters: {'learning_rate': 0.0003969695446562558, 'weight_decay': 0.0001793431344614788, 'mosaic_prob': 0.526211543511762, 'label_smooth': 0.061363955677553886, 'copy_paste_p': 0.6850553444588503, 'slice_stride': 7, 'batch_size': 16, 'use_clahe': False, 'use_shift_scale_rotate': True, 'use_brightness_contrast': True, 'use_median_blur': True, 'median_blur_limit': 5, 'use_speckle_noise': True, 'speckle_level': 'light'}. Best is trial 227 with value: 0.745034987552105.
