[I 2026-03-19 11:24:40,231] Using an existing study with name 'yoloe_hparam_search_v6' instead of creating a new one.
/fs01/home/dhaneshr/code/obj-det-test/.venv/lib/python3.12/site-packages/albumentations/core/validation.py:114: UserWarning: ShiftScaleRotate is a special case of Affine transform. Please use Affine transform instead.
  original_init(self, **validated_kwargs)
[I 2026-03-19 11:30:02,056] Trial 57 pruned. 
[I 2026-03-19 11:40:39,341] Trial 60 finished with value: 0.642251489622041 and parameters: {'learning_rate': 0.000747599299995651, 'weight_decay': 0.003971084710792475, 'mosaic_prob': 0.32322520635999885, 'label_smooth': 0.09113172778521575, 'copy_paste_p': 0.2852620618436458, 'slice_stride': 10, 'batch_size': 8, 'use_clahe': True, 'use_shift_scale_rotate': False, 'use_brightness_contrast': False, 'use_median_blur': False, 'median_blur_limit': 7, 'use_speckle_noise': False, 'speckle_level': 'medium'}. Best is trial 42 with value: 0.7017763012337562.
[I 2026-03-19 11:47:38,771] Trial 86 pruned. 
[I 2026-03-19 11:56:23,099] Trial 95 pruned. 
[I 2026-03-19 12:13:10,023] Trial 112 finished with value: 0.6993708087750958 and parameters: {'learning_rate': 0.00030966431191980544, 'weight_decay': 0.00030213030830413646, 'mosaic_prob': 0.4731859275992937, 'label_smooth': 0.14756151488541935, 'copy_paste_p': 0.5095839387020463, 'slice_stride': 10, 'batch_size': 16, 'use_clahe': True, 'use_shift_scale_rotate': True, 'use_brightness_contrast': False, 'use_median_blur': True, 'median_blur_limit': 5, 'use_speckle_noise': False, 'speckle_level': 'medium'}. Best is trial 106 with value: 0.7300394720216199.
[I 2026-03-19 12:20:12,741] Trial 146 pruned. 
[I 2026-03-19 12:36:38,381] Trial 166 finished with value: 0.7379452386507251 and parameters: {'learning_rate': 0.000490892937896775, 'weight_decay': 0.0004366909491710489, 'mosaic_prob': 0.33945465882536113, 'label_smooth': 0.03520533173945255, 'copy_paste_p': 0.46927932027077496, 'slice_stride': 7, 'batch_size': 16, 'use_clahe': True, 'use_shift_scale_rotate': True, 'use_brightness_contrast': False, 'use_median_blur': True, 'median_blur_limit': 5, 'use_speckle_noise': False, 'speckle_level': 'heavy'}. Best is trial 166 with value: 0.7379452386507251.
[I 2026-03-19 12:42:45,499] Trial 202 pruned. 
[I 2026-03-19 12:57:38,568] Trial 210 finished with value: 0.6860861952828413 and parameters: {'learning_rate': 0.0004430153379741383, 'weight_decay': 0.0008642587690124893, 'mosaic_prob': 0.48181834966641707, 'label_smooth': 0.0268466617360211, 'copy_paste_p': 0.5125853788401384, 'slice_stride': 7, 'batch_size': 8, 'use_clahe': True, 'use_shift_scale_rotate': True, 'use_brightness_contrast': False, 'use_median_blur': True, 'median_blur_limit': 5, 'use_speckle_noise': False, 'speckle_level': 'heavy'}. Best is trial 166 with value: 0.7379452386507251.
[I 2026-03-19 13:11:58,219] Trial 240 finished with value: 0.6655497536032263 and parameters: {'learning_rate': 0.000862375921090894, 'weight_decay': 0.00018953015118206007, 'mosaic_prob': 0.46126852868084917, 'label_smooth': 0.01654660625261909, 'copy_paste_p': 0.4851494399669029, 'slice_stride': 7, 'batch_size': 16, 'use_clahe': True, 'use_shift_scale_rotate': True, 'use_brightness_contrast': False, 'use_median_blur': True, 'median_blur_limit': 5, 'use_speckle_noise': False, 'speckle_level': 'heavy'}. Best is trial 227 with value: 0.745034987552105.
[I 2026-03-19 13:29:31,428] Trial 265 finished with value: 0.7123190308782813 and parameters: {'learning_rate': 0.00032342892324662857, 'weight_decay': 0.00015354208329621858, 'mosaic_prob': 0.5350447054556793, 'label_smooth': 0.052283589330994557, 'copy_paste_p': 0.5173569423000588, 'slice_stride': 7, 'batch_size': 16, 'use_clahe': False, 'use_shift_scale_rotate': True, 'use_brightness_contrast': True, 'use_median_blur': True, 'median_blur_limit': 5, 'use_speckle_noise': True, 'speckle_level': 'light'}. Best is trial 227 with value: 0.745034987552105.
[I 2026-03-19 13:47:43,787] Trial 294 pruned. 
[I 2026-03-19 14:04:41,762] Trial 316 finished with value: 0.7322345035850347 and parameters: {'learning_rate': 0.0005748863225567111, 'weight_decay': 0.00023932014565840494, 'mosaic_prob': 0.54354704642898, 'label_smooth': 0.08525694863562076, 'copy_paste_p': 0.636963955422829, 'slice_stride': 7, 'batch_size': 16, 'use_clahe': False, 'use_shift_scale_rotate': True, 'use_brightness_contrast': True, 'use_median_blur': True, 'median_blur_limit': 5, 'use_speckle_noise': True, 'speckle_level': 'light'}. Best is trial 227 with value: 0.745034987552105.
[I 2026-03-19 14:17:48,135] Trial 330 finished with value: 0.6691294418707521 and parameters: {'learning_rate': 0.0003135454692337707, 'weight_decay': 0.00013314263211294678, 'mosaic_prob': 0.35548086506724585, 'label_smooth': 0.06445561573653316, 'copy_paste_p': 0.29109458374522096, 'slice_stride': 7, 'batch_size': 8, 'use_clahe': False, 'use_shift_scale_rotate': True, 'use_brightness_contrast': True, 'use_median_blur': True, 'median_blur_limit': 5, 'use_speckle_noise': True, 'speckle_level': 'light'}. Best is trial 227 with value: 0.745034987552105.
[I 2026-03-19 14:22:30,141] Trial 336 pruned. 
