[I 2026-03-19 11:24:34,691] Using an existing study with name 'yoloe_hparam_search_v6' instead of creating a new one.
/fs01/home/dhaneshr/code/obj-det-test/.venv/lib/python3.12/site-packages/albumentations/core/validation.py:114: UserWarning: ShiftScaleRotate is a special case of Affine transform. Please use Affine transform instead.
  original_init(self, **validated_kwargs)
[I 2026-03-19 11:29:45,794] Trial 48 finished with value: 0.2930693069306931 and parameters: {'learning_rate': 0.00043284502212938834, 'weight_decay': 0.03680860814877612, 'mosaic_prob': 0.6659969709057025, 'label_smooth': 0.08979877262955549, 'copy_paste_p': 0.27800932022121827, 'slice_stride': 10, 'batch_size': 16, 'use_clahe': True, 'use_shift_scale_rotate': True, 'use_brightness_contrast': False, 'use_median_blur': True, 'median_blur_limit': 5, 'use_speckle_noise': False, 'speckle_level': 'medium'}. Best is trial 48 with value: 0.2930693069306931.
[I 2026-03-19 11:34:40,193] Trial 59 finished with value: 0.5445544554455448 and parameters: {'learning_rate': 0.000747599299995651, 'weight_decay': 0.003971084710792475, 'mosaic_prob': 0.32322520635999885, 'label_smooth': 0.09113172778521575, 'copy_paste_p': 0.2852620618436458, 'slice_stride': 10, 'batch_size': 8, 'use_clahe': True, 'use_shift_scale_rotate': False, 'use_brightness_contrast': False, 'use_median_blur': False, 'median_blur_limit': 7, 'use_speckle_noise': False, 'speckle_level': 'medium'}. Best is trial 63 with value: 0.5742574257425745.
[I 2026-03-19 11:43:45,581] Trial 72 finished with value: 0.6236991743168319 and parameters: {'learning_rate': 0.0020917152515896632, 'weight_decay': 0.0006461998317863072, 'mosaic_prob': 0.4277244377305936, 'label_smooth': 0.1336237870943792, 'copy_paste_p': 0.4122977791083038, 'slice_stride': 5, 'batch_size': 8, 'use_clahe': False, 'use_shift_scale_rotate': False, 'use_brightness_contrast': True, 'use_median_blur': False, 'median_blur_limit': 7, 'use_speckle_noise': True, 'speckle_level': 'light'}. Best is trial 42 with value: 0.7017763012337562.
[I 2026-03-19 11:50:07,524] Trial 90 pruned. 
[I 2026-03-19 11:54:56,097] Trial 97 finished with value: 0.19801980198019806 and parameters: {'learning_rate': 0.004527787913742285, 'weight_decay': 0.0008747245849765471, 'mosaic_prob': 0.6000634731149819, 'label_smooth': 0.11587932856943234, 'copy_paste_p': 0.34315465631866887, 'slice_stride': 7, 'batch_size': 32, 'use_clahe': False, 'use_shift_scale_rotate': True, 'use_brightness_contrast': True, 'use_median_blur': True, 'median_blur_limit': 7, 'use_speckle_noise': True, 'speckle_level': 'light'}. Best is trial 42 with value: 0.7017763012337562.
[I 2026-03-19 12:01:12,924] Trial 109 pruned. 
[I 2026-03-19 12:07:00,756] Trial 121 pruned. 
[I 2026-03-19 12:14:22,912] Trial 134 finished with value: 0.5475247524752478 and parameters: {'learning_rate': 0.00020758924512527386, 'weight_decay': 0.0019385163119648822, 'mosaic_prob': 0.38403435172912875, 'label_smooth': 0.006432106916270025, 'copy_paste_p': 0.45419417071968615, 'slice_stride': 7, 'batch_size': 8, 'use_clahe': False, 'use_shift_scale_rotate': True, 'use_brightness_contrast': True, 'use_median_blur': True, 'median_blur_limit': 7, 'use_speckle_noise': True, 'speckle_level': 'heavy'}. Best is trial 106 with value: 0.7300394720216199.
[I 2026-03-19 12:31:28,137] Trial 150 finished with value: 0.6951537756916096 and parameters: {'learning_rate': 0.00037854221323949035, 'weight_decay': 0.0027468586731446416, 'mosaic_prob': 0.5179547056285306, 'label_smooth': 0.018220763984413996, 'copy_paste_p': 0.5504820957280068, 'slice_stride': 7, 'batch_size': 16, 'use_clahe': False, 'use_shift_scale_rotate': True, 'use_brightness_contrast': True, 'use_median_blur': True, 'median_blur_limit': 5, 'use_speckle_noise': True, 'speckle_level': 'heavy'}. Best is trial 106 with value: 0.7300394720216199.
[I 2026-03-19 12:38:42,273] Trial 187 pruned. 
[I 2026-03-19 12:54:28,581] Trial 205 finished with value: 0.6694039316588778 and parameters: {'learning_rate': 0.0004189049552652406, 'weight_decay': 0.043310920598364056, 'mosaic_prob': 0.48115730961337383, 'label_smooth': 0.028942009334799453, 'copy_paste_p': 0.5322927296025531, 'slice_stride': 7, 'batch_size': 16, 'use_clahe': True, 'use_shift_scale_rotate': True, 'use_brightness_contrast': False, 'use_median_blur': True, 'median_blur_limit': 5, 'use_speckle_noise': False, 'speckle_level': 'heavy'}. Best is trial 166 with value: 0.7379452386507251.
[I 2026-03-19 13:00:57,546] Trial 233 pruned. 
[I 2026-03-19 13:05:48,913] Trial 244 finished with value: 0.6435643564356439 and parameters: {'learning_rate': 0.0008677383931339142, 'weight_decay': 0.00014795538594535878, 'mosaic_prob': 0.46159060237116933, 'label_smooth': 0.008373172923318625, 'copy_paste_p': 0.48348474215112075, 'slice_stride': 7, 'batch_size': 8, 'use_clahe': True, 'use_shift_scale_rotate': True, 'use_brightness_contrast': False, 'use_median_blur': True, 'median_blur_limit': 5, 'use_speckle_noise': False, 'speckle_level': 'heavy'}. Best is trial 166 with value: 0.7379452386507251.
[I 2026-03-19 13:21:11,764] Trial 254 pruned. 
[I 2026-03-19 13:40:31,298] Trial 281 finished with value: 0.7092831513068187 and parameters: {'learning_rate': 0.0004628170652997722, 'weight_decay': 0.00032485709004407653, 'mosaic_prob': 0.5527331648457525, 'label_smooth': 0.14672970368042967, 'copy_paste_p': 0.6769408181249875, 'slice_stride': 7, 'batch_size': 16, 'use_clahe': True, 'use_shift_scale_rotate': True, 'use_brightness_contrast': False, 'use_median_blur': True, 'median_blur_limit': 5, 'use_speckle_noise': False, 'speckle_level': 'heavy'}. Best is trial 227 with value: 0.745034987552105.
