[I 2026-03-17 22:47:51,763] Using an existing study with name 'yoloe_hparam_search_v5' instead of creating a new one.
/fs01/home/dhaneshr/code/obj-det-test/.venv/lib/python3.12/site-packages/albumentations/core/validation.py:114: UserWarning: ShiftScaleRotate is a special case of Affine transform. Please use Affine transform instead.
  original_init(self, **validated_kwargs)
[I 2026-03-17 22:52:07,955] Trial 230 pruned. 
[I 2026-03-17 22:56:06,818] Trial 239 pruned. 
[I 2026-03-17 23:00:04,773] Trial 250 pruned. 
[I 2026-03-17 23:03:49,482] Trial 264 finished with value: 0.4445544554455448 and parameters: {'learning_rate': 0.0005074854401817235, 'weight_decay': 0.0034362734521751854, 'mosaic_prob': 0.3338556676474382, 'label_smooth': 0.09261814580225324, 'copy_paste_p': 0.25135860263513055, 'slice_stride': 10, 'batch_size': 8, 'use_clahe': True, 'use_shift_scale_rotate': True, 'use_brightness_contrast': False, 'use_median_blur': True, 'median_blur_limit': 7, 'use_speckle_noise': False, 'speckle_level': 'medium'}. Best is trial 123 with value: 0.7353625013713276.
[I 2026-03-17 23:07:41,925] Trial 273 finished with value: 0.524752475247525 and parameters: {'learning_rate': 0.000634359475476528, 'weight_decay': 0.034999639016950065, 'mosaic_prob': 0.35444637700394965, 'label_smooth': 0.0790617867588774, 'copy_paste_p': 0.2553484673609918, 'slice_stride': 7, 'batch_size': 8, 'use_clahe': True, 'use_shift_scale_rotate': True, 'use_brightness_contrast': False, 'use_median_blur': True, 'median_blur_limit': 7, 'use_speckle_noise': False, 'speckle_level': 'medium'}. Best is trial 123 with value: 0.7353625013713276.
[I 2026-03-17 23:11:45,938] Trial 283 pruned. 
[I 2026-03-17 23:23:31,268] Trial 292 pruned. 
[I 2026-03-17 23:35:30,229] Trial 320 finished with value: 0.5316793270563903 and parameters: {'learning_rate': 0.00015809546274114168, 'weight_decay': 0.0019902944883909285, 'mosaic_prob': 0.6875284965717169, 'label_smooth': 0.08616337191739444, 'copy_paste_p': 0.534156303490391, 'slice_stride': 5, 'batch_size': 16, 'use_clahe': False, 'use_shift_scale_rotate': False, 'use_brightness_contrast': False, 'use_median_blur': False, 'median_blur_limit': 5, 'use_speckle_noise': False, 'speckle_level': 'medium'}. Best is trial 123 with value: 0.7353625013713276.
[I 2026-03-17 23:49:27,229] Trial 343 finished with value: 0.7198430682305653 and parameters: {'learning_rate': 0.0006877116756460217, 'weight_decay': 0.002467099835798404, 'mosaic_prob': 0.6606509236713316, 'label_smooth': 0.09067286402370975, 'copy_paste_p': 0.2653717931025774, 'slice_stride': 10, 'batch_size': 16, 'use_clahe': True, 'use_shift_scale_rotate': True, 'use_brightness_contrast': False, 'use_median_blur': True, 'median_blur_limit': 5, 'use_speckle_noise': False, 'speckle_level': 'medium'}. Best is trial 123 with value: 0.7353625013713276.
[I 2026-03-17 23:53:49,759] Trial 381 pruned. 
[I 2026-03-18 00:04:22,706] Trial 392 pruned. 
[I 2026-03-18 00:17:45,682] Trial 418 finished with value: 0.7054934080563335 and parameters: {'learning_rate': 0.0013123259891619304, 'weight_decay': 0.0002158543166121358, 'mosaic_prob': 0.6355637994445699, 'label_smooth': 0.09234093542856502, 'copy_paste_p': 0.6066541933801474, 'slice_stride': 10, 'batch_size': 8, 'use_clahe': False, 'use_shift_scale_rotate': True, 'use_brightness_contrast': False, 'use_median_blur': True, 'median_blur_limit': 7, 'use_speckle_noise': True, 'speckle_level': 'heavy'}. Best is trial 409 with value: 0.7500143454379812.
[I 2026-03-18 00:32:13,948] Trial 451 finished with value: 0.6881282236258186 and parameters: {'learning_rate': 0.0009549243702279704, 'weight_decay': 0.0006264696641682006, 'mosaic_prob': 0.5169093300049871, 'label_smooth': 0.0761582122980357, 'copy_paste_p': 0.6496229229070243, 'slice_stride': 10, 'batch_size': 16, 'use_clahe': False, 'use_shift_scale_rotate': False, 'use_brightness_contrast': True, 'use_median_blur': False, 'median_blur_limit': 3, 'use_speckle_noise': True, 'speckle_level': 'heavy'}. Best is trial 409 with value: 0.7500143454379812.
[I 2026-03-18 00:42:39,904] Trial 477 finished with value: 0.6860123334289764 and parameters: {'learning_rate': 0.0010654614821985532, 'weight_decay': 0.0006270747185546476, 'mosaic_prob': 0.3954179892266904, 'label_smooth': 0.11634893253702182, 'copy_paste_p': 0.6658954020812419, 'slice_stride': 10, 'batch_size': 16, 'use_clahe': False, 'use_shift_scale_rotate': True, 'use_brightness_contrast': False, 'use_median_blur': True, 'median_blur_limit': 5, 'use_speckle_noise': True, 'speckle_level': 'light'}. Best is trial 409 with value: 0.7500143454379812.
[I 2026-03-18 00:47:13,206] Trial 494 pruned. 
