[I 2026-03-19 11:24:38,727] Using an existing study with name 'yoloe_hparam_search_v6' instead of creating a new one.
/fs01/home/dhaneshr/code/obj-det-test/.venv/lib/python3.12/site-packages/albumentations/core/validation.py:114: UserWarning: ShiftScaleRotate is a special case of Affine transform. Please use Affine transform instead.
  original_init(self, **validated_kwargs)
[I 2026-03-19 11:40:06,602] Trial 53 pruned. 
[I 2026-03-19 11:57:08,259] Trial 85 pruned. 
[I 2026-03-19 12:02:37,835] Trial 115 pruned. 
[I 2026-03-19 12:06:13,378] Trial 125 finished with value: 0.3663366336633665 and parameters: {'learning_rate': 0.0027480270757672984, 'weight_decay': 0.04915475553747465, 'mosaic_prob': 0.3024703175839637, 'label_smooth': 0.08032288423921365, 'copy_paste_p': 0.31233662823410446, 'slice_stride': 10, 'batch_size': 16, 'use_clahe': True, 'use_shift_scale_rotate': False, 'use_brightness_contrast': False, 'use_median_blur': False, 'median_blur_limit': 5, 'use_speckle_noise': False, 'speckle_level': 'medium'}. Best is trial 42 with value: 0.7017763012337562.
[I 2026-03-19 12:10:40,277] Trial 131 finished with value: 0.40594059405940613 and parameters: {'learning_rate': 0.0005592904240304058, 'weight_decay': 0.002019958202692898, 'mosaic_prob': 0.7021655711050463, 'label_smooth': 0.09885429072134608, 'copy_paste_p': 0.25734480753966554, 'slice_stride': 10, 'batch_size': 8, 'use_clahe': True, 'use_shift_scale_rotate': False, 'use_brightness_contrast': False, 'use_median_blur': False, 'median_blur_limit': 7, 'use_speckle_noise': False, 'speckle_level': 'medium'}. Best is trial 106 with value: 0.7300394720216199.
[I 2026-03-19 12:17:28,034] Trial 142 pruned. 
[I 2026-03-19 12:23:41,065] Trial 161 finished with value: 0.36524752475247535 and parameters: {'learning_rate': 0.00038566938405515806, 'weight_decay': 0.0002291675437221652, 'mosaic_prob': 0.5195710541910101, 'label_smooth': 0.0396105549693555, 'copy_paste_p': 0.5387324369104759, 'slice_stride': 7, 'batch_size': 16, 'use_clahe': True, 'use_shift_scale_rotate': True, 'use_brightness_contrast': False, 'use_median_blur': True, 'median_blur_limit': 5, 'use_speckle_noise': False, 'speckle_level': 'heavy'}. Best is trial 106 with value: 0.7300394720216199.
[I 2026-03-19 12:31:14,629] Trial 172 pruned. 
[I 2026-03-19 12:45:07,238] Trial 186 pruned. 
[I 2026-03-19 12:51:43,072] Trial 214 finished with value: 0.4673267326732676 and parameters: {'learning_rate': 0.00041966748970534906, 'weight_decay': 0.000813822714897863, 'mosaic_prob': 0.4917453770038845, 'label_smooth': 0.08547387715582948, 'copy_paste_p': 0.6851899024509025, 'slice_stride': 7, 'batch_size': 8, 'use_clahe': True, 'use_shift_scale_rotate': True, 'use_brightness_contrast': False, 'use_median_blur': True, 'median_blur_limit': 7, 'use_speckle_noise': False, 'speckle_level': 'heavy'}. Best is trial 166 with value: 0.7379452386507251.
[I 2026-03-19 12:57:20,257] Trial 228 pruned. 
[I 2026-03-19 13:13:19,391] Trial 239 pruned. 
[I 2026-03-19 13:27:45,816] Trial 268 pruned. 
[I 2026-03-19 13:44:37,208] Trial 290 finished with value: 0.7183750760516753 and parameters: {'learning_rate': 0.00039939354505412976, 'weight_decay': 0.002490898534875779, 'mosaic_prob': 0.39973340381009265, 'label_smooth': 0.030078577593080386, 'copy_paste_p': 0.6314940063992269, 'slice_stride': 7, 'batch_size': 16, 'use_clahe': True, 'use_shift_scale_rotate': True, 'use_brightness_contrast': False, 'use_median_blur': True, 'median_blur_limit': 5, 'use_speckle_noise': False, 'speckle_level': 'light'}. Best is trial 227 with value: 0.745034987552105.
[I 2026-03-19 13:57:38,746] Trial 312 finished with value: 0.6646837269937591 and parameters: {'learning_rate': 0.0005181413791957956, 'weight_decay': 0.0002413704375486508, 'mosaic_prob': 0.5391937708162249, 'label_smooth': 0.035528957548734155, 'copy_paste_p': 0.6752748865657161, 'slice_stride': 7, 'batch_size': 16, 'use_clahe': False, 'use_shift_scale_rotate': True, 'use_brightness_contrast': True, 'use_median_blur': True, 'median_blur_limit': 5, 'use_speckle_noise': True, 'speckle_level': 'light'}. Best is trial 227 with value: 0.745034987552105.
