[I 2026-03-19 11:24:38,677] Using an existing study with name 'yoloe_hparam_search_v6' instead of creating a new one.
/fs01/home/dhaneshr/code/obj-det-test/.venv/lib/python3.12/site-packages/albumentations/core/validation.py:114: UserWarning: ShiftScaleRotate is a special case of Affine transform. Please use Affine transform instead.
  original_init(self, **validated_kwargs)
[I 2026-03-19 11:30:28,477] Trial 54 finished with value: 0.2931683168316832 and parameters: {'learning_rate': 0.00043284502212938834, 'weight_decay': 0.03680860814877612, 'mosaic_prob': 0.6659969709057025, 'label_smooth': 0.08979877262955549, 'copy_paste_p': 0.27800932022121827, 'slice_stride': 10, 'batch_size': 16, 'use_clahe': True, 'use_shift_scale_rotate': True, 'use_brightness_contrast': False, 'use_median_blur': True, 'median_blur_limit': 5, 'use_speckle_noise': False, 'speckle_level': 'medium'}. Best is trial 45 with value: 0.35297029702970306.
[I 2026-03-19 11:34:22,540] Trial 63 finished with value: 0.5742574257425745 and parameters: {'learning_rate': 0.000747599299995651, 'weight_decay': 0.003971084710792475, 'mosaic_prob': 0.32322520635999885, 'label_smooth': 0.09113172778521575, 'copy_paste_p': 0.2852620618436458, 'slice_stride': 10, 'batch_size': 8, 'use_clahe': True, 'use_shift_scale_rotate': False, 'use_brightness_contrast': False, 'use_median_blur': False, 'median_blur_limit': 7, 'use_speckle_noise': False, 'speckle_level': 'medium'}. Best is trial 63 with value: 0.5742574257425745.
[I 2026-03-19 11:48:35,177] Trial 71 finished with value: 0.6495680680165269 and parameters: {'learning_rate': 0.0020917152515896632, 'weight_decay': 0.0019185425629216761, 'mosaic_prob': 0.30377365965814657, 'label_smooth': 0.1336237870943792, 'copy_paste_p': 0.4122977791083038, 'slice_stride': 5, 'batch_size': 8, 'use_clahe': False, 'use_shift_scale_rotate': False, 'use_brightness_contrast': True, 'use_median_blur': False, 'median_blur_limit': 7, 'use_speckle_noise': True, 'speckle_level': 'light'}. Best is trial 42 with value: 0.7017763012337562.
[I 2026-03-19 11:55:01,248] Trial 96 finished with value: 0.21633663366336636 and parameters: {'learning_rate': 0.004115984516565232, 'weight_decay': 0.00011270684292210721, 'mosaic_prob': 0.6035921370166127, 'label_smooth': 0.1151438996551187, 'copy_paste_p': 0.34088128446702887, 'slice_stride': 7, 'batch_size': 32, 'use_clahe': False, 'use_shift_scale_rotate': True, 'use_brightness_contrast': True, 'use_median_blur': True, 'median_blur_limit': 7, 'use_speckle_noise': True, 'speckle_level': 'light'}. Best is trial 42 with value: 0.7017763012337562.
[I 2026-03-19 12:01:31,661] Trial 110 pruned. 
[I 2026-03-19 12:06:50,476] Trial 123 pruned. 
[I 2026-03-19 12:11:00,292] Trial 132 finished with value: 0.633663366336634 and parameters: {'learning_rate': 0.0009602595866833836, 'weight_decay': 0.0019497210270416154, 'mosaic_prob': 0.6302996229142291, 'label_smooth': 0.09665783486209642, 'copy_paste_p': 0.23933222764995168, 'slice_stride': 10, 'batch_size': 8, 'use_clahe': True, 'use_shift_scale_rotate': False, 'use_brightness_contrast': False, 'use_median_blur': False, 'median_blur_limit': 7, 'use_speckle_noise': False, 'speckle_level': 'medium'}. Best is trial 106 with value: 0.7300394720216199.
[I 2026-03-19 12:18:07,319] Trial 143 pruned. 
[I 2026-03-19 12:33:44,383] Trial 162 finished with value: 0.6780232476645113 and parameters: {'learning_rate': 0.0003822660620096446, 'weight_decay': 0.0002209889206915054, 'mosaic_prob': 0.45003948008670375, 'label_smooth': 0.0372620377088386, 'copy_paste_p': 0.5403139084698392, 'slice_stride': 7, 'batch_size': 16, 'use_clahe': True, 'use_shift_scale_rotate': True, 'use_brightness_contrast': False, 'use_median_blur': True, 'median_blur_limit': 5, 'use_speckle_noise': False, 'speckle_level': 'heavy'}. Best is trial 106 with value: 0.7300394720216199.
[I 2026-03-19 12:51:23,130] Trial 195 finished with value: 0.6802602851354078 and parameters: {'learning_rate': 0.0006309859484034139, 'weight_decay': 0.0001006753546679736, 'mosaic_prob': 0.5721068304793516, 'label_smooth': 0.012160679817101273, 'copy_paste_p': 0.5273968572541669, 'slice_stride': 7, 'batch_size': 16, 'use_clahe': True, 'use_shift_scale_rotate': True, 'use_brightness_contrast': False, 'use_median_blur': True, 'median_blur_limit': 5, 'use_speckle_noise': False, 'speckle_level': 'heavy'}. Best is trial 166 with value: 0.7379452386507251.
[I 2026-03-19 13:04:49,639] Trial 225 finished with value: 0.6246520025419745 and parameters: {'learning_rate': 0.0006072893181481298, 'weight_decay': 0.00012047643826456696, 'mosaic_prob': 0.5473124521434246, 'label_smooth': 0.07351959220302579, 'copy_paste_p': 0.48563840902484706, 'slice_stride': 7, 'batch_size': 16, 'use_clahe': True, 'use_shift_scale_rotate': True, 'use_brightness_contrast': False, 'use_median_blur': True, 'median_blur_limit': 5, 'use_speckle_noise': False, 'speckle_level': 'heavy'}. Best is trial 166 with value: 0.7379452386507251.
[I 2026-03-19 13:19:06,355] Trial 248 pruned. 
[I 2026-03-19 13:35:18,277] Trial 277 pruned. 
[I 2026-03-19 13:51:09,239] Trial 304 finished with value: 0.7019690480807174 and parameters: {'learning_rate': 0.0003899788124217361, 'weight_decay': 0.0001719271062174853, 'mosaic_prob': 0.5570976587574257, 'label_smooth': 0.060951864740475516, 'copy_paste_p': 0.67315917907381, 'slice_stride': 7, 'batch_size': 16, 'use_clahe': False, 'use_shift_scale_rotate': True, 'use_brightness_contrast': True, 'use_median_blur': True, 'median_blur_limit': 5, 'use_speckle_noise': True, 'speckle_level': 'light'}. Best is trial 227 with value: 0.745034987552105.
[I 2026-03-19 13:59:05,871] Trial 321 pruned. 
