[I 2026-03-19 11:24:30,543] Using an existing study with name 'yoloe_hparam_search_v6' instead of creating a new one.
/fs01/home/dhaneshr/code/obj-det-test/.venv/lib/python3.12/site-packages/albumentations/core/validation.py:114: UserWarning: ShiftScaleRotate is a special case of Affine transform. Please use Affine transform instead.
  original_init(self, **validated_kwargs)
[I 2026-03-19 11:37:48,247] Trial 43 pruned. 
[I 2026-03-19 11:53:57,579] Trial 77 pruned. 
[I 2026-03-19 12:00:25,044] Trial 107 finished with value: 0.4013861386138615 and parameters: {'learning_rate': 0.0002789916501431784, 'weight_decay': 0.00010811423680881941, 'mosaic_prob': 0.4794373684145814, 'label_smooth': 0.14987201996693336, 'copy_paste_p': 0.5224811371780523, 'slice_stride': 7, 'batch_size': 16, 'use_clahe': False, 'use_shift_scale_rotate': True, 'use_brightness_contrast': True, 'use_median_blur': True, 'median_blur_limit': 5, 'use_speckle_noise': True, 'speckle_level': 'heavy'}. Best is trial 42 with value: 0.7017763012337562.
[I 2026-03-19 12:04:18,324] Trial 119 pruned. 
[I 2026-03-19 12:14:40,310] Trial 127 finished with value: 0.6174091419336862 and parameters: {'learning_rate': 0.000549117965798401, 'weight_decay': 0.026903610040179268, 'mosaic_prob': 0.7036018102517149, 'label_smooth': 0.09885429072134608, 'copy_paste_p': 0.25734480753966554, 'slice_stride': 10, 'batch_size': 8, 'use_clahe': True, 'use_shift_scale_rotate': False, 'use_brightness_contrast': False, 'use_median_blur': False, 'median_blur_limit': 7, 'use_speckle_noise': False, 'speckle_level': 'medium'}. Best is trial 106 with value: 0.7300394720216199.
[I 2026-03-19 12:28:57,633] Trial 152 finished with value: 0.6489209843106174 and parameters: {'learning_rate': 0.00036351962672884636, 'weight_decay': 0.00013823486609736518, 'mosaic_prob': 0.5160227083958077, 'label_smooth': 0.018265957382452458, 'copy_paste_p': 0.5458882607696925, 'slice_stride': 7, 'batch_size': 16, 'use_clahe': False, 'use_shift_scale_rotate': True, 'use_brightness_contrast': True, 'use_median_blur': True, 'median_blur_limit': 5, 'use_speckle_noise': True, 'speckle_level': 'heavy'}. Best is trial 106 with value: 0.7300394720216199.
[I 2026-03-19 12:35:09,297] Trial 182 pruned. 
[I 2026-03-19 12:52:11,046] Trial 200 finished with value: 0.68030866255775 and parameters: {'learning_rate': 0.00032466971407940913, 'weight_decay': 0.00016557167339809886, 'mosaic_prob': 0.5612556545337739, 'label_smooth': 0.012231918258659864, 'copy_paste_p': 0.49739688212980226, 'slice_stride': 7, 'batch_size': 16, 'use_clahe': False, 'use_shift_scale_rotate': True, 'use_brightness_contrast': True, 'use_median_blur': True, 'median_blur_limit': 7, 'use_speckle_noise': True, 'speckle_level': 'heavy'}. Best is trial 166 with value: 0.7379452386507251.
[I 2026-03-19 13:06:16,074] Trial 229 pruned. 
[I 2026-03-19 13:11:15,559] Trial 255 finished with value: 0.524752475247525 and parameters: {'learning_rate': 0.0005149458694026951, 'weight_decay': 0.00025780471345815224, 'mosaic_prob': 0.4705641782741157, 'label_smooth': 0.03281654162118907, 'copy_paste_p': 0.5041514373758372, 'slice_stride': 7, 'batch_size': 8, 'use_clahe': True, 'use_shift_scale_rotate': True, 'use_brightness_contrast': False, 'use_median_blur': True, 'median_blur_limit': 7, 'use_speckle_noise': False, 'speckle_level': 'heavy'}. Best is trial 227 with value: 0.745034987552105.
[I 2026-03-19 13:29:24,476] Trial 263 finished with value: 0.6705353626734577 and parameters: {'learning_rate': 0.0003229796308780456, 'weight_decay': 0.0001541110219224517, 'mosaic_prob': 0.5682308397343171, 'label_smooth': 0.021213517398669755, 'copy_paste_p': 0.660836794364424, 'slice_stride': 7, 'batch_size': 16, 'use_clahe': True, 'use_shift_scale_rotate': True, 'use_brightness_contrast': False, 'use_median_blur': True, 'median_blur_limit': 5, 'use_speckle_noise': False, 'speckle_level': 'heavy'}. Best is trial 227 with value: 0.745034987552105.
[I 2026-03-19 13:43:48,319] Trial 293 finished with value: 0.6316751605056399 and parameters: {'learning_rate': 0.000407056151428579, 'weight_decay': 0.00020289772926955396, 'mosaic_prob': 0.5284947760572366, 'label_smooth': 0.029871545545760866, 'copy_paste_p': 0.6758713864621083, 'slice_stride': 5, 'batch_size': 16, 'use_clahe': True, 'use_shift_scale_rotate': True, 'use_brightness_contrast': False, 'use_median_blur': True, 'median_blur_limit': 5, 'use_speckle_noise': False, 'speckle_level': 'light'}. Best is trial 227 with value: 0.745034987552105.
[I 2026-03-19 13:49:32,201] Trial 310 pruned. 
[I 2026-03-19 14:05:39,859] Trial 318 finished with value: 0.7136173292968 and parameters: {'learning_rate': 0.0005147787997439954, 'weight_decay': 0.007990262023087471, 'mosaic_prob': 0.538650906870054, 'label_smooth': 0.06345051905718954, 'copy_paste_p': 0.5703788797162569, 'slice_stride': 7, 'batch_size': 16, 'use_clahe': False, 'use_shift_scale_rotate': True, 'use_brightness_contrast': True, 'use_median_blur': True, 'median_blur_limit': 5, 'use_speckle_noise': True, 'speckle_level': 'light'}. Best is trial 227 with value: 0.745034987552105.
[I 2026-03-19 14:19:24,195] Trial 332 pruned. 
